,TITLE,AUTHOR,PUBLISHER,DESCRIPTION,Label
101,What We're Fighting for Now Is Each Other,Wen Stephenson,Beacon Press,an urgent ontheground look at some of the new american radic who have laid everyth on the line to build a stronger climat justic movement the scienc is clear catastroph climat chang by ani human definit is upon us at the same time the fossilfuel industri ha doubl down econom and polit on busi as usual we face an unpreced situationa radic situat as an individu of conscienc how will you respond in journalist wen stephenson woke up to the true scale and urgenc of the catastroph bear down on human start with the poorest and most vulner everywher and confront what he call the spiritu crisi at the heart of the climat crisi inspir by other who refus to retreat into variou form of denial and fatal he walk away from hi career in mainstream media and becam an activist join those work to build a transform movement for climat justic in america in what were fight for now is each other stephenson tell hi own stori and offer an upclos ontheground look at some of the remark and courag peoplethos he call new american radicalswho have laid everyth on the line to build and inspir thi fastgrow movement oldschool environmentalist and young climatejustic organ frontlin commun leader and texa tarsand blockad quaker and colleg student evangel and occupi most import stephenson push beyond easi label to understand who these peopl realli are what drive them and what theyr ultim fight for he argu that the movement is less like environment as we know it and more like the great humanright and socialjustic struggl of the nineteenth and twentieth centuri from abolition to civil right it a movement for human solidar thi is a fierc urgent and profoundli spiritu journey into the climatejustic movement at a critic momentin search of what climat justic at thi late hour might yet mean,Climate_justice
102,Climate Justice,Ravi Kanbur & Henry Shue,"Oxford University Press, USA",climat justic requir share the burden and benefit of climat chang and it resolut equit and fairli it bring togeth justic between gener and justic within gener in particular it requir that attempt to address justic between gener through variou intervent design to curb greenhous emiss today do not end up creat injustic in our time by hurt the current poor and vulner the unit nation sustain develop goal sdg summit in septemb and the confer of parti cop to the framework convent on climat chang in pari in decemb brought climat chang and it develop impact centr stage in global discuss in the run up to pari mari robinson former presid of ireland and un secretari gener special envoy for climat chang institut the climat justic dialogu to mobil polit will and creativ think to shape an ambiti and just intern climat agreement in the editor of thi volum an economist and a philosoph serv on the high level advisori committe of the climat justic dialogu they note the overlap and mutual enforc between the econom and philosoph discours on climat justic but they also note the great need for these strand to come togeth to support the public and polici discours climat justic integr econom and philosophi is the result bring togeth contribut from economist and philosoph climat justic illustr the differ approach how they overlap and interact and what they have alreadi learn from each other and might still have to learn,Climate_justice
103,Climate Justice,Henry Shue,"Oxford University Press, USA",climat chang is the most difficult threat face human thi centuri and negoti to reach intern agreement have so far founder on deep issu of justic provid provoc and imagin answer to key question of justic inform by polit insight and scientif understand thi book offer a new way forward,Climate_justice
104,Struggles for Climate Justice,Brandon Barclay Derman,Springer Nature,thi book provid an access but intellectu rigor introduct to the global social movement for climat justic and address the social uneven consequ of anthropogen climat chang deploy relat understand of naturesocieti space and power brandon derman show that climat chang ha been coproduc with social inequ mismatch level of respons and vulner and institut that emerg in tandem with those disproportion compos the terrain on which ngo and social movement now contest climat injustic in a widerang polit of connect casebas chapter explor the defin commit of affect and alli commun and how they have shape specif struggl mobil human right intern treati transnat activist forum nation and local constitu and broadbas demonstr derman synthes these case and similar effort across the globe to identifi and explor crosscut theme in climat justic polit as well as the opportun and dilemma face advoc and activist and those who would alli with them go forward how should we understand campaign for climat justic what do these initi share and what differenti them what in fact doe climat justic mean in these context and what do the frame and progress of such effort in differ set suggest about the broader condit that produc and sustain climat injustic how those condit could be unmad and what might take their place struggl for climat justic approach these question from an interdisciplinari perspect access to graduat and advanc undergradu student as well as scholar of geographi social movement environment polit polici and socioleg studi,Climate_justice
105,Routledge Handbook of Climate Justice,Tahseen Jafry,Routledge,the term climat justic began to gain traction in the late follow a wide rang of activ by social and environment justic movement that emerg in respons to the oper of the fossil fuel industri and later to what their member saw as the fail global climat govern model that becam so transpar at in copenhagen the term continu to gain momentum in discuss around sustain develop climat chang mitig and adapt and ha been slowli make it way into the world of intern and nation polici howev the connect between these remain unestablish address the need for a comprehens and integr refer compendium the routledg handbook of climat justic provid student academ and profession with a valuabl insight into thi fastgrow field draw togeth a multidisciplinari rang of author from the global north and south thi handbook address some of the most salient topic in current climat justic research includ just transit urban climat justic and public engag in addit to the field more tradit focu on gender intern govern and climat ethic with an emphasi on facilit learn base on cuttingedg specialis climat justic research and applic each chapter draw from the most recent sourc realworld best practic and tutor reflect on the strateg dimens of climat justic and it relat disciplin the routledg handbook of climat justic will be essenti read for student and scholar as well as be a vital refer tool for those practic engag in the field,Climate_justice
106,Climate Change from the Streets,Michael Méndez,Yale University Press,an urgent and time stori of the contenti polit of incorpor environment justic into global climat chang polici although the scienc of climat chang is clear polici decis about how to respond to it effect remain contenti even when such decis claim to be guid by object knowledg they are made and implement through polit institut and relationshipsand all the compet interest and power struggl that thi impli michael mendez tell a time stori of peopl place and power in the context of climat chang and inequ he explor the perspect and influenc lowincom peopl of color bring to their advocaci work on climat chang in california activist group have galvan behind issu such as air pollut poverti allevi and green job to advanc equit climat solut at the local state and global level argu that environment protect and improv public health are inextric link mendez contend that we must incorpor local knowledg cultur and histori into policymak to fulli address the global complex of climat chang and the real threat face our local commun,Climate_justice
107,Climate Justice and Collective Action,Angela Kallhoff,Routledge,thi book develop a theori of climat cooper design for concert action which emphasis the role and function of collect in achiev share climat goal in debat on climat chang action research focus on three major goal on mitig on adapt and on transform even though these goal are accept concert action is still difficult to realiz climat justic and collect action provid an analysi of whi thi is the case and develop a theori of climat cooper design to overcom the exist roadblock angela kallhoff start with a thorough analysi of failur of collect action in the context of climat chang action take inspir from theori of water cooper she then establish a theori of joint action that refram climat goal as share goal and highlight the import of adher to principl of fair thi also includ an explor of the norm claim work in the background of climat cooper final kallhoff put forward propos for a fair alloc of duti to cooper with respect to climat goal thi book will be of great interest to student and scholar of climat action climat justic environment sociolog and environment philosophi and ethic more broadli,Climate_justice
108,The EU and Global Climate Justice,Franziskus von Lucke & Thomas Diez & Solveig Aamodt & Bettina Ahrens,Routledge,thi book examin the european union contribut to the develop of the global climat regim within the broader framework of global justic it argu that the procedur dimens of justic ha been larg overlook so far in the assess of eu climat polici and reveal the eu ha significantli contribut to the develop of the climat regim within it broader effort to solidaris intern societi at the same time the book identifi deficit of the climat regim and limit to the eu impact and explain whi the eu polici toward global climat chang ha shift over time final howev it argu that these polici should not be assess in term of be either wholli posit or neg but that they are shot through with ambigu thi book will be of key interest to scholar student and practition of climat chang climat polit environment and climat justic studi and more broadli to eu studi and intern relat,Climate_justice
109,Media and Transnational Climate Justice,Anna Roosvall & Matthew Tegelberg,"Peter Lang Incorporated, International Academic Publishers",a widerang interdisciplinari studi of activ and media base on origin research thi is a time and insight contribut to theoriz global justic as involv solidar and voic beyond exist polit structuresk nash professor of sociolog goldsmith univers of london and faculti fellow center for cultur sociolog yale univers,Climate_justice
110,Climate Justice in a Non-ideal World,Jennifer Clare Heyward & Dominic Roser,Oxford University Press,climat chang is a press intern polit issu for which a practic but principl solut is urgent requir climat justic in a nonid world aim to make norm theoris on climat justic more relev and applic to polit realiti and public polici the motiv behind thi edit collect is that norm theoris ha someth to offer even in an imperfect world mire by partial complianc and unfavour circumst in the last year a live debat ha sprung up in polit philosophi about nonid theori and there ha also been an upsurg of interest in the variou norm issu rais by climat chang such as intergener justic transnat harm collect action or risk assess howev there ha been littl systemat discuss of the link between climat justic and nonid theori even though the former would seem like a paradigm exampl of the relev of the latter the aim of thi edit volum is to address thi in do so the volum present origin work from lead expert on climat ethic includ sever who have particip in climat polici the first part of the book discuss those facet of the debat on climat justic that becom relev due to the shortcom of current global action on climat chang the second part make specif suggest for adjust current polici and negoti procedur in way that are feasibl in the rel short term while still decreas the distanc between current climat polici and the ideal the chapter in the third and final part reflect upon how philosoph work can be brought to bear on the debat in climat scienc commun and polit,Climate_justice
111,Justice in Climate Action Planning,Brian Petersen & Hélène B. Ducros,Springer Nature,thi edit volum examin how climat action plan engag justic at the scale of the citi recent event in the unit state make the context particularli ripe for a discuss of justic in urban climat polit on the one hand the emerg of the black live matter movement georg floyd death and the promin of racial discrimin in the public realm have mainstream the notion of justic on the other hand the dire consequ of increas frequenc and sever of climat event on vulner segment of urban popul are undeni while some citi have been proactiv about integr justic in their climat action plan in most place an explicit and systemat link between both sphere ha been lack thi book explor thi interfac as it seek to understand how citi can respond to climat chang in a just way and for just outcom while resili strategi base on develop may engag histor inequ they may at the same time result in margin certain popul through variou process from mismatch solut to outright exclus and climat gentrif by identifi how certain popul are includ in or exclud from climat action plan practic the chapter in thi volum draw on case studi to outlin the differenti outcom of climat action in american citi also propos a templat for compar work beyond the us the author tackl the debat about how justic is or is not integr in climat action plan and assess practic implic while also make theoret and methodolog contribut as it fill a gap in the literatur at the intersect of justic and climat action the book produc new insight for a widerang audienc student practition policymak planner the nonprofit sector and scholar in geographi urban plan urban studi environment studi ecolog polit scienc or anthropolog along five axe of investigationtheori resili equiti commun and comparison as methodth contributor offer variou pathway into the intersect between urban climat action and differ understand of justic collect they invit a reflect that can lead to practic initi in climat mitig while also advanc the theoriz of social justic to account for the urban as a node where injustic play out and can be address with signific result,Climate_justice
112,Climate Justice,Randall Abate,~Publisher not available~,climat chang is one of the most complex polit social and environment issu of thi centuri and climat chang adapt ha becom an increasingli larg focu of global effort the intern commun attent on adapt ha been primarili focus on develop countri need with consensu that the world most vulner communitiesth urban and rural poor lowli island nation and indigen peoplesrequir addit protect it wa in respons to thi need for equiti that climat justic emerg climat justic can be defin gener as address the disproportion burden of climat chang impact on poor and margin commun it seek to promot more equit alloc of the burden of these impact at the local nation and global level through proactiv regulatori initi and reactiv judici remedi that draw on intern human right and domest environment justic theori yet effort to defin climat justic as a field of inquiri can be elus and underinclus becaus the concept is so vast in scope climat justic case studi in global and region govern challeng seek to fill that void provid an overview of the landscap of climat justic from a varieti of legal and geograph perspect in a case studi format draw on the expertis of contributor from countri the book analyz climat justic from an intern law perspect and from the perspect of legal respons to promot climat justic in sever region of the world includ pacif island nation south asia north america africa and the middl east it address propos solut to a rang of regulatori obstacl under intern law us law and foreign domest law in seek to promot climat justic on a global scale,Climate_justice
113,Climate Justice and Historical Emissions,Lukas H. Meyer & Pranay Sanklecha,Cambridge University Press,thi book provid a systemat introduct to the debat on histor emiss and climat chang for student research and policymak,Climate_justice
114,Climate Futures,Kum-Kum Bhavnani & John Foran & Priya A. Kurian & Debashish Munshi,Zed Books Ltd.,approach the issu of climat chang and climat justic from a rang of divers perspect includ those of cultur gender indigen race and sexual as well as challeng coloni histori and capitalist present climat futur boldli address the appar inevit of climat chao seek better explan of the underli caus and consequ of climat chang and map strategi toward a better futur or at a minimum the most like bestcas world that we can get to thi book envis planetari social movement robust enough to spark the necessari chang need to achiev deepli sustain and just econom social and polit polici and practic bring togeth insight from interdisciplinari scholar policymak creativ and activist climat futur argu for the need to get past usandthem divid and acknowledg how live of creatur far and near human and nonhuman are interconnect,Climate_justice
115,Defining Environmental Justice,David Schlosberg,Oxford University Press,the book use both environment movement and polit theori to help defin what is meant by environment and ecolog justic it will be use to anyon interest in environment polit environment movement and justic theori,Climate_justice
116,Climate Justice,Dominic Roser & Christian Seidel,Routledge,the link between justic and climat chang is becom increasingli promin in public debat on climat polici thi clear and concis philosoph introduct to climat justic address the hot topic of climat chang as a moral challeng use engag everyday exampl the author address the core argument by provid a comprehens and balanc overview of thi heat debat enabl student and practition to think critic about the subject area and to promot discuss on question such as whi do anyth in the face of climat chang how much do we owe our descend a better world or noth at all how should we distribut the burden of climat action between industri and develop countri should i adopt a green lifestyl even if no one els make an effort which mean of reduc emiss are permiss should we put hope in technolog solut should we redesign democrat institut for more effect climat polici with chapter summari illustr exampl and suggest for further read thi book is an ideal introduct for student in polit philosophi appli ethic and environment ethic as well as for practition work on one of the most urgent issu of our time,Climate_justice
117,Indigenous Peoples and Climate Justice,Giada Giacomini,Springer Nature,thi book provid a new interpret of intern law specif dedic to indigen peopl in the context of a climat justic approach the book present a critic analysi of past and current develop at the intersect of human right and intern environment law and govern the book suggest new way forward and demonstr the need for a paradigmat shift that would enhanc the meaning particip of indigen peopl as fundament actor in the conserv of biodivers and in the fight against climat chang the book offer guidanc on a number of critic intersect and interdepend issu at the forefront of climat chang law and polici insid and outsid of the un climat chang regim the author suggest that the adopt of a critic perspect on intern law is need in order to highlight inher structur and system issu of the intern law regim which are all issu that ultim imped the pursu of climat justic for indigen peopl,Climate_justice
118,Climate Change and Justice,Jeremy Moss,Cambridge University Press,thi collect shed new light on the key ethic issu of climat chang justic,Climate_justice
119,Climate Justice and Non-State Actors,Jeremy Moss & Lachlan Umbers,Routledge,thi book investig the relationship between nonstat actor and climat justic from a philosoph perspect the climat justic literatur remain larg focus upon the right and duti of state yet for decad state have fail to take adequ step to address climat chang thi ha led some to suggest that if sever climat chang and it attend harm are to be avoid nonstat actor are go to have to step into the breach thi collect repres the first attempt to systemat examin the climat duti of the most signific nonstat actor corpor subnat polit commun and individu target at academ philosoph work on climat justic thi collect will also be of great interest to student and scholar of global justic appli ethic polit philosophi and environment human,Climate_justice
120,"Understanding Global Warming with Max Axiom, Super Scientist",Agnieszka Biskup,Capstone Classroom,in graphic novel format follow the adventur of max axiom as he explain the scienc behind global warmingprovid by publish,Global_warming
121,The Great Global Warming Blunder,Roy W Spencer,Encounter Books,the great global warm blunder unveil new evid from major scientif find that explod the convent wisdom on climat chang and reshap the global warm debat as we know it roy w spencer a former senior nasa climatologist reveal how climat research have mistaken caus and effect when analyz cloud behavior and have been dupe by mother natur into believ the earth climat system is far more sensit to human activ and carbon dioxid than it realli is in fact spencer present astonish new evid that recent warm is not the fault of human but the result of chaotic intern natur cycl that have been caus period of warm and cool for millennia more carbon dioxid in the atmospher is not necessarili to be fear the great global warm blunder explain that burn of fossil fuel may actual be benefici for life on earth as groupthink behavior and misguid global warm polici propos threaten the live of million of the world poorest most vulner citizen the great global warm blunder is a scintil expos and muchneed call for debat,Global_warming
122,Global Warming: A Very Short Introduction,Mark Maslin,"Oxford University Press, UK",global warm is one of the most controversi scientif issu of the twenti first centuri thi book provid an inform uptod and readabl book about the predict impact of global warm and the surpris that could be in store for us in the near futur global warm is one of the most controversi scientif issu of the twentyfirst centuri thi is a problem that ha seriou econom sociolog geopolit polit and person implic thi veri short introduct is an inform uptod and readabl book about the predict impact of global warm and the surpris that could be in store for us in the near futur it unpack the controversi that surround global warm draw on materi from the recent report of the intergovernment panel on climat chang ipcc a huge collabor studi draw togeth current think on the subject from expert in a rang of disciplin and for the first time present the find of the panel for a gener readership the book also discuss the polit of global warm and look at what we can do now to adapt to climat chang and mitig it worst effect,Global_warming
123,The Politically Incorrect Guide to Global Warming,Christopher C. Horner,Regnery Publishing,an exposa of some of the more controversi agenda behind global warm argu that poorqual scienc and dishonest polit are contribut to the intent disporportion and selfserv level of fear,Global_warming
124,Climate Change,Edmond A. Mathez & Jason Smerdon,Columbia University Press,thi second edit of climat chang is an access and comprehens guid to the scienc behind global warm exquisit illustr the text is gear toward student at a varieti of level edmond a mathez and jason e smerdon provid a broad inform introduct to the scienc that underli our understand of the climat system and the effect of human activ on the warm of our planet mathez and smerdon describ the role that the atmospher and ocean play in our climat introduc the concept of radiat balanc and explain climat chang that occur in the past they also detail the human activ that influenc the climat such as greenhous ga and aerosol emiss and deforest as well as the effect of natur phenomena climat chang conclud with a look toward the futur discuss climat model project explor the econom and technolog realiti of energi product and present a view of the global warm challeng through the len of risk each chapter featur profil of scientist who advanc our understand of the materi discuss thi new edit expand on the first edit present of scientif concept make it ideal for classroom use for a wide swath of undergradu and master student with both scienc and nonscienc background,Global_warming
125,Global Warming,John Houghton,Cambridge University Press,how much of global warm is due to human activ how far will it be possibl to adapt to chang of climat sir john houghton definit full colour guid to climat chang answer these question and more by provid the best and latest inform avail includ the latest ipcc find the simpl logic flow of idea give an invalu ground in the scienc as well as the physic and human impact of climat chang for undergradu student across a wide rang of disciplin access to both scientist and nonscientist the text avoid mathemat equat and includ more technic materi in box while simpl figur help student to understand the conclus the scienc lead to without be overwhelm by vast amount of data question for student to consid and test their understand are includ in each chapter along with care select further read to expand their knowledg,Global_warming
