,TITLE,AUTHOR,PUBLISHER,DESCRIPTION,Label
48,Flexible Mechanisms for an Efficient Climate Policy,Karl L. Brockmann & Marcus Stronzik,Springer Science & Business Media,in the kyoto protocol to the un framework convent on climat chang industri countri agre on bind absolut target for greenhous ga emiss and on the admiss of flexibl marketeconomi instrument such as emiss trade joint implement and the clean develop mechan use for reach the target the contribut in thi volum reveal that flexibl instrument can lower the cost of climat protect consider not onli in theori but also in practic concern implement it will be necessari to take care of possibl loophol uncertainti and transact cost which may be too high if no proper design is chosen,Climate_policy
49,The Design and Implementation of US Climate Policy,Don Fullerton & Catherine Wolfram,University of Chicago Press,econom research on climat chang ha been crucial in advanc our understand of the consequ associ with global warm as well as the cost and benefit of the variou polici that might reduc emiss of greenhous gase as nation work to develop climat polici econom insight into their design and implement are ever more import with a balanc between theoret and empir approach the design and implement of us climat polici look at the possibl effect of variou climat polici on a rang of econom outcom the studi that compris the volum examin topic that includ the coordinationor lack thereofbetween the feder and state govern implic of monitor and enforc climat polici and the specif consequ of variou climat polici for the agricultur automot and build sector,Climate_policy
50,Understanding Environmental Policy,Steven Cohen,Columbia University Press,the first edit of thi pragmat cours text emphas the polici valu of a big pictur approach to the ethic polit technolog and scientif econom and manag aspect of environment issu the text then appli thi approach to realworld case exampl involv leak underground storag tank toxic wast cleanup and the effect of global climat chang thi second edit demonstr the ongo effect of thi framework to gener meaning action and polici solut to todayo urgent environment issu the text add case exampl concern congest tax ewast hydrofrack and recent develop in global climat chang and updat refer and other materi throughout incorpor the polit and polici chang of the obama administrationo first term and develop in nation and global environment issu,Climate_policy
51,Carbon Captured,Matto Mildenberger,MIT Press,a compar examin of domest climat polit that offer a theori for crossnat differ in domest climat policymak climat chang threaten the planet and yet polici respons have vari wide across nation some countri have undertaken ambiti program to stave off climat disast other have done littl and still other have pass polici that were later roll back in thi book matto mildenberg open the black box of domest climat polit examin polici make trajectori in sever countri and offer a theoret explan for nation differ in the climat polici process mildenberg introduc the concept of doubl representationwhen carbon pollut enjoy polit represent on both the left through industri union fear of job loss and the right through industri busi associ fight polici costsand argu that differ climat polici approach can be explain by the interact of climat polici prefer and domest institut he illustr hi theori with detail histori of climat polit in norway the unit state and australia along with briefer discuss of polici in in germani japan the unit kingdom and canada he show that norway systemat shield polit connect industri pollut from cost begin with it pioneer carbon tax the unit state after the failur of carbon reduct legisl final act on climat reform through a seri of obama administr execut action and australia labor and green parti enact an emiss trade scheme which wa subsequ repeal by a conserv liber parti govern ultim mildenberg argu for the import of polit consider in understand the climat policymak process and discuss possibl futur polici direct,Climate_policy
52,Climate Change and Social Movements,Eugene Nulman,Springer,climat chang and social movement is a rivet and thorough explor of three import campaign to influenc climat chang polici in the unit kingdom the author delv deep into the campaign and illumin the way policymak think about and respond to social movement,Climate_policy
53,Neoliberalism and Climate Policy in the United States,Robert MacNeil,Routledge,thi book explor how washington effort to act on climat chang have been translat under condit of american neoliber where the state struggl to find a stabl and legitim role in the economi and where environment and industri polici are enorm contenti topic thi origin work conceptu us climat polici first and foremost as a question of innov polici with capit accumul and market domin as it main driver it argu that us climat polici must be understood in the context of washington broader effort over the past four decad to domin and monopol novel hightech market and it use of immens amount of state power to achiev thi end from thi perspect mani element of us climat polit that seem confus or contradictori actual appear to have an obviou and consist logic thi book will be of particular interest to student and scholar of ipe as well as individu gener interest in gain a stronger understand of us climat polit and polici and the role and influenc of neoliber on contemporari econom govern,Climate_policy
54,Climate Change,David G. Victor,Council on Foreign Relations,council on foreign relat thi book provid a balanc and comprehens account of the issu involv in climat chang and the rang of domest and foreign polici option avail to american policymak,Climate_policy
55,Climate Change and Society,Riley E. Dunlap & Robert J. Brulle,"Oxford University Press, USA",climat chang is one of today most import issu present an intellectu challeng to the natur and social scienc while there ha been progress in natur scienc understand of climat chang social scienc research ha not been as fulli develop thi collect of essay break new theoret and empir ground by present climat chang as a thoroughli social phenomenon embed in our institut and cultur practic,Climate_policy
56,The Violence of Climate Change,Kevin J. O'Brien,Georgetown University Press,climat chang is view as a primarili scientif econom or polit issu while acknowledg the legitimaci of these perspect kevin j obrien argu that we should respond to climat chang first and foremost as a case of systemat and structur violenc global warm is larg caus by the carbon emiss of the affluent emiss that harm the poor first and worst climat chang is violenc becaus it divid human be from one anoth and from the earth obrien offer a construct and creativ respons to thi violenc through practic exampl of activ and nonviol peacemak provid brief biographi of five christian in the unit statesjohn woolman jane addam dorothi day martin luther king jr and cesar chavez these activist ideal social commit and polit savvi offer lesson of resist applic to the struggl against climat chang and for social justic,Climate_policy
57,Climate Change from the Streets,Michael Méndez,Yale University Press,an urgent and time stori of the contenti polit of incorpor environment justic into global climat chang polici although the scienc of climat chang is clear polici decis about how to respond to it effect remain contenti even when such decis claim to be guid by object knowledg they are made and implement through polit institut and relationshipsand all the compet interest and power struggl that thi impli michael mendez tell a time stori of peopl place and power in the context of climat chang and inequ he explor the perspect and influenc lowincom peopl of color bring to their advocaci work on climat chang in california activist group have galvan behind issu such as air pollut poverti allevi and green job to advanc equit climat solut at the local state and global level argu that environment protect and improv public health are inextric link mendez contend that we must incorpor local knowledg cultur and histori into policymak to fulli address the global complex of climat chang and the real threat face our local commun,Climate_policy
58,Understanding Climate Change,Sarah L. Burch & Sara E. Harris,University of Toronto Press,the second edit of understand climat chang provid reader with a concis access and holist pictur of the climat chang problem includ both the scientif and human dimens,Climate_policy
59,An Introduction to Climate Change Economics and Policy,Felix FitzRoy & Elissaios Papyrakis,Routledge,the edit of an introduct to climat chang econom and polici explain the key scientif econom and polici issu relat to climat chang in a complet uptod introduct for anyon interest and student at all level in variou relat cours includ environment econom intern develop geographi polit and intern relat fitzroy and papyraki highlight how economist and policymak often misunderstand the scienc of climat chang underestim the grow threat to futur civil and surviv and exagger the cost of radic measur need to stabil the climat in contrast they show how direct and indirect cost of fossil fuel particularli the huge health cost of local pollut actual exceed the invest need for transit to an almost zero carbon economi in two or three decad use avail technolog,Climate_policy
60,Farming for Our Future,PETER H.. ROSENBERG LEHNER (NATHAN A.) & Nathan Rosenberg,~Publisher not available~,farm for our futur examin the polici and legal reform necessari to acceler the adopt of practic that can make agricultur in the unit state climateneutr or better these proven practic will also make our food system more resili to the impact of climat chang agricultur contribut to climat chang is substantialmuch more so than offici figur suggestand we will not be abl to achiev our overal mitig goal unless agricultur emiss sharpli declin fortun farm and ranch can be a major part of the climat solut while protect biodivers strengthen rural commun and improv the live of the worker who cultiv our crop and rear our anim the import of agricultur climat solut can not be underestim it is a critic element both in ensur our food secur and limit climat chang thi book provid essenti solut to address the greatest crise of our time,Climate_policy
61,Turning Down the Heat,H. Compston & I. Bailey,Springer,thi studi analys the polit of climat polici in a rang of affluent democraci and at eu level in order to identifi polit strategi that would make it easier for govern to make major cut in greenhous ga emiss without sustain signific polit damag,Climate_policy
62,The Climate Change Playbook,Dennis Meadows & Linda Booth Sweeney & Gillian Martin Mehers,Chelsea Green Publishing,the simpl interact exercis in the climat chang playbook can help citizen better understand climat chang diagnos it caus anticip it futur consequ and effect construct chang adapt from the system think playbook the twentytwo game are now specif relev to climatechang commun and craft for use by expert advoc and educ illustr guidelin walk leader through set each game up facilit it and debrief particip user will find game that are suitabl for a varieti of audienceswheth larg and seat as in a confer room or smaller and mobil as in a workshop seminar or meet,Climate_policy
63,Climate Change,John T. Hardy,John Wiley & Sons,humaninduc climat chang is a seriou concern draw increas attent from the media polici maker and citizen around the world thi comprehens and thoughtprovok volum explain in easili understand languag the potenti effect of climat chang on our planet and our live climat chang caus effect and solut examin the latest scientif find without ani advanc technic knowledg it goe beyond a descript of chang in the physic environ to consid the broader issu of ecolog econom and human effect of climat chang the book explain the caus and effect of climat chang from a natur and human environ perspect mitig option and polici that could reduc the impact of climat chang global impact with case studi are taken from north america europ australasia and elsewher essenti read for undergradu and gener reader who want to heighten their knowledg and understand of thi import problem,Climate_policy
64,EU Climate Policy,Elin Lerum Boasson & Mr Jørgen Wettestad,"Ashgate Publishing, Ltd.",climat polici is today a signific area of eu govern provid import framework condit for mani industri but how ha eu climat polici develop thi book offer structur compar case studi of the develop of four central climat polici emiss trade system renew carbon captur and storag and energi polici for build examin the intrigu similar and differ in how these have taken shape combin sociolog new institution and polit scienc theori in a novel and engag way elin lerum boasson and jrgen wettestad explor and explain the histori of eu climat polici what emerg are fascin stori of skill entrepreneur who have manag to creat and exploit polit window of opportun and of more longterm pathdepend develop draw on more than interviewe the author present account never told befor provid a valuabl and time contribut to our knowledg of environment manag and eu integr thi book is a mustread for all those seek to understand the drive forc in eu climat polici and recogn it prospect for the futur,Climate_policy
65,"Firms, Governments, and Climate Policy",Carlo Carraro & Christian Egenhofer,Edward Elgar Publishing,the kyoto protocol to reduc greenhous gase ghg in the major of industrialis countri is the first small step on the way to an effect climat polici in the longterm climat polici will call for greater ghg reduct and the full particip of the global commun the five integr chapter of thi book review theoret find and empir evid in the search for the right incent which could induc firm and govern to undertak ghg abat measur thi book analys the polici mix that provid the best possibl incent for firm and govern to act on climat chang and sign up to intern climat agreement in do so the author address a multitud of relat issu includ the linkag between flexibl mechan and voluntari agreement regul and taxat the opportun and barrier of the kyoto protocol for industri and the incent for firm to undertak climaterel rd and invest as well as illustr the environment benefit and costeffect of altern polici mix in reduc ghg emiss the author also offer sensibl polici prescript for increas the number of countri that ratifi and implement climat agreement environment and resourc economist environment scientist climat analyst and policymak should all read thi book which offer an authorit contribut to what is arguabl the most critic contemporari environment polici issu,Climate_policy
66,A Climate Policy Revolution,Roland Kupers,~Publisher not available~,in thi book roland kuper argu that the climat crisi is well suit to the bottomup rapid and revolutionari chang complex scienc theoriz he succinctli make the case that complex scienc promis polici solut to address climat chang,Climate_policy
67,EU Climate Change Policy,Marjan Peeters & Kurt Deketelaere,Edward Elgar Pub,thi excel edit collect assembl by peeter and deketelaer on the achiev of eu climat chang polici is a veri time public they have brought togeth nineteen distinguish mostli european scholar on climat law and polici to provid an inform account of the flurri of initi benjamin j richardson maastricht journal of european and compar law,Climate_policy
68,Statehouse and Greenhouse,Barry G. Rabe,Rowman & Littlefield,no environment issu trigger such feel of hopeless as global climat chang mani area of the world includ region of the unit state have experienc a wide rang of unusu dramat weather event recent much climat chang analysi forecast horror of biblic proport such as massiv flood habitat loss speci loss and epidem relat to warmer weather such account of impend disast have help trigger extrem reaction wherein some observ simpli dismiss global climat chang as at the veri worst a minor inconveni requir modest adapt it is perhap no surpris therefor that an american feder govern known for institut gridlock ha accomplish virtual noth in thi area in the last decad polici inertia is not the stori of thi book howev statehous and greenhous examin the surpris evolut of statelevel govern polici on global climat chang environment polici analyst barri rabe detail a divers set of innov case offer detail analysi of statelevel polici design to combat global warm the book explain whi state innov in global climat chang ha been rel vigor and whi it ha drawn so littl attent thu far rabe draw larger potenti lesson from thi recent flurri of american experi statehous and greenhous help to move debat over global climat chang from bombast to the realm of what is polit and technic feasibl,Climate_policy
69,Climate Change Science and Policy,Stephen H. Schneider,Island Press,thi is the mcomprehens and currrefer resourc on climat chang avail today it featur fortynin individu chapter by some of the world lead climat scientist it five section address climat chang in five dimens ecolog impact polici analysi intern consider unit state consider and mitig option to reduc carbon emiss in mani way thi volum supersed the fourth assessmreport of the intergovernment panel on climat chang ipcc mani import develop too recto be treat in the ipcc document are cover here overal climat chang scienc and polici paint a direr pictur of the effect of climat chang than do the ipcc report it reveal that climat chang ha progress faster than the ipcc report anticip and that the outlook for the futur is bleaker than the ipcc report,Climate_policy
70,The Kyoto Protocol,Sebastian Oberthür & Hermann E. Ott,Springer Science & Business Media,the adopt of the kyoto protocol in decemb wa a major achiev in the endeavour to tackl the problem of global climat chang at the dawn of the centuri after mani year of involv in the negoti process the book two intern recognis author now offer the intern commun a first hand and insid perspect of the debat on the kyoto protocol the book provid a comprehens scholarli analysi of the histori and content of the protocol itself as well as of the econom polit and legal implic of it implement it also present a perspect for the further develop of the climat regim these import featur make thi book an indispens work tool for polici maker negoti academ and all those activ involv and interest in climat chang issu in both the develop and develop world,Climate_policy
71,Climate Policy Integration into EU Energy Policy,Claire Dupont,Routledge,climat chang is a crosscut longterm global problem that present policymak with mani challeng in their effort to respond to the issu integr climat polici object into the elabor and agreement of polici measur in other sector repres one promis method for ensur coher polici that respond adequ to the climat chang challeng thi book explor the integr of longterm climat polici object into eu energi polici it engag indepth empir analysi on the integr of climat polici object into renew energi polici energi perform of build and polici in support of natur ga import infrastructur the book describ insuffici level of climat polici integr across these area to achiev the longterm polici goal a conceptu framework to find reason for insuffici integr level is develop and appli thi book is a valuabl resourc for student research academ and policymak interest in environment climat chang and energi polici develop in the eu particularli from the perspect of longterm polici challeng the book add to scholarli literatur on polici integr and eu integr and contribut to new and develop research about eu decarbonis,Climate_policy
72,Climate Economics,Richard S. J. Tol,Edward Elgar Publishing,thi uniqu textbook offer comprehens coverag of the econom of climat chang and climat polici and is a suitabl guid for advanc undergradu postgradu and doctor student topic discuss includ the cost and benefit of adapt and mitig discount uncertainti polici instrument and intern agreementskey featur of the second edit indepth treatment of the econom of climat chang care explan of concept and their applic to climat polici customiz integr assess model that illustr all issu discuss specif usag guidelin for each level of reader companion websit featur data extra read quizz video and more to support seminar session and further explor of the topic discuss of the latest develop in theori and polici a stronger empir basi than the first edit thi book is an essenti text for advanc undergradu and master student in econom climat chang and environment polici and an excel resourc for research and practition look for a key text to support them across all of their teach,Climate_policy
73,A Perfect Moral Storm,Stephen M. Gardiner,Oxford University Press,climat chang is arguabl the great problem confront human but we have done littl to head off thi loom catastroph in the perfect moral storm philosoph stephen gardin illumin our danger inact by place the environment crisi in an entir new light consid it as an ethic failur gardin clarifi the moral situat identifi the temptat or storm that make us vulner to a certain kind of corrupt first the world most affluent nation are tempt to pass on the cost of climat chang to the poorer and weaker citizen of the world second the present gener is tempt to pass the problem on to futur gener third our poor grasp of scienc intern justic and the human relationship to natur help to facilit inact as a result we are engag in will selfdecept when the live of futur gener the world poor and even the basic fabric of life on the planet is at stake we should wake up to thi profound ethic failur gardin conclud and demand more of our institut our leader and ourselv thi is a radic book both in the sens that it face extrem and in the sens that it goe to the root notr dame philosoph review the book strength lie in gardin success at understand and clarifi the type of moral issu that climat chang rais which is an import first step toward solut scienc magazin gardin ha expertli explor some veri instinctu and vital import consider which cannot realist be ignor requir read green prophet gardin make a strong case for highlight and insist on the ethic dimens of the climat problem and hi warn about buckpass and the danger appeal of moral corrupt hit home time higher educ stephen gardin take to a new level our understand of the moral dimens of climat chang a perfect moral storm argu convincingli that climat chang is the greatest moral challeng our speci ha ever face and that the problem goe even deeper than we think peter singer princeton univers,Climate_policy
74,Climate Policy Assessment for India,~Author not available~,Universities Press,the asiapacif integr model aim bring togeth model belong to divers disciplin for analys polici on climat chang pollut manag and ecosystem preserv the focu of aim is on nation and region polici assess in the asiapacif region and their interfac with global econom and environment regim in thi book climat chang polici assess studi for india use topdown macroeconom and bottomup technoeconom model belong to the aim famili are present the book will be of particular interest to policymak model research and research network interest in the area of develop energi environ and climat chang,Climate_policy
75,The Actual US Climate Policy In Comparison With The Global Climate Protection And The Interrelation With The US Economy,Jan Hollmann,GRIN Verlag,seminar paper from the year in the subject engin industri engin and manag grade b pforzheim univers industri engin cours foreign languag depart seminar entri in the bibliographi languag english abstract climat chang is a grow threat to the unit state and all other nation but what are the world countri do about it some detail of thi answer are list in thi project global warm is a global problem that requir a global solut mani american citizen begin to take action to fight climat chang and it consequ becaus in the past environment problem were not on the agenda in the us polit except in california where climat problem were treat exemplari a grow number of state and local govern and privat compani in the usa are step forward to address climat chang with reason creativ costeffect strategi to reduc greenhous ga emiss but is it enough to preserv our environ and our climat the us presid call global warm the greatest environment challeng of the centuri and urg all american to help find solut to thi import problem nevertheless the usa repres itself as refusenik for ani agreement in climat polici dure the last climat confer cop,Climate_policy
76,Climate Change,Mark Maslin,Oxford University Press,climat chang a veri short introduct examin the scienc the histori and the polit of climat chang draw on the latest scienc from the recent ipcc report thi vsi examin the potenti catastroph impact of climat chang in the futur global awar of climat chang ha grown veri rapidli as shown by the wide support for campaign like greta thunberg and group like extinct rebellion and the declar by mani govern that we are now in a climat emerg it is a threat that forc us to examin the whole basi of modern societi thi vsi explor the geopolit econom technolog and social solut to climat chang and argu for new mode of think in tackl the climat crisi provid by publish,Climate_policy
