,TITLE,AUTHOR,PUBLISHER,DESCRIPTION,Label
185,Disposable City,Mario Alejandro Ariza,Bold Type Books,a deeplyreport person investig by a miami journalist into the present and futur effect of climat chang in the magic citya wateri harbing for coastal citi worldwid miami florida is like to be entir underwat by the end of thi centuri resid are alreadi start to see the effect of sea level rise today from sunni day flood caus by higher tide to a sewer system on the brink of total collaps the citi undeni live in a climat chang world in dispos citi miami resid mario alejandro ariza show us not onli what climat chang look like on the ground today but also what miami will look like year from now and how that futur ha been shape by the citi racist past and present as politician continu to kick the can down the road and miami becom increasingli unliv real estat vultur and wealthi resid will be abl to get out or move to higher ground but the most vulner commun disproportion compos of peopl of color will face flood damag rise hous cost danger higher temperatur and stronger hurrican that they cant afford to escap miami may be on the front line of climat chang but the battl it fight today is come for the rest of the usand the rest of the worldfar sooner than we could have imagin even a decad ago dispos citi is a thought portrait of both a vibrant citi with a uniqu cultur and the social econom and psychic cost of climat chang that call us to act befor it too late,climate_change
186,Climate Maps,Ian F. Mahaney,"The Rosen Publishing Group, Inc",explain how to read and understand a climat map,climate_change
187,Tales of Two Planets,John Freeman,Penguin,build from hi acclaim antholog tale of two america belov writer and editor john freeman draw togeth a group of our greatest writer from around the world to help us see how the environment crisi is hit some of the most vulner commun where they live in the past five year john freeman previous editor of granta ha launch a celebr intern literari magazin freeman and compil two acclaim antholog that deal with incom inequ as it is experienc in the cours of thi work one major theme came up repeatedli climat chang is make alreadi dire inequ much wors devast further the alreadi devast but the problem of climat chang are not restrict to those from the less develop world galvan by hi convers with writer and activist around the world freeman engag with some of today most eloqu storytel mani of whom hail from the place under the most acut stressfrom the capit of burundi to bangkok thailand the respons ha been extraordinari margaret atwood conjur with a dystopian futur in a remark poem lauren groff whisk us to florida edwidg danticat to haiti tahmima anam to bangladesh yasmin el rashidi to egypt while eka kurniawan bring us to indonesia chinelo okparanta to nigeria and anuradha roy to the himalaya in the wake of flood dam build and drought thi is a literari allpoint bulletin of fiction essay poem and reportag about the most import crisi of our time,climate_change
188,Climate-Challenged Society,John S. Dryzek & Richard B. Norgaard & David Schlosberg,Oxford University Press,a short access introductori treatment of how climat chang affect societi and how social econom and polit system can do and should respond,climate_change
189,How to Avoid a Climate Disaster,Bill Gates,~Publisher not available~,bill gate ha spent a decad investig the caus and effect of climat chang with the help of expert in the field of physic chemistri biolog engin polit scienc and financ he ha focus on what must be done in order to stop the planet slide toward certain environment disast in thi book he not onli explain whi we need to work toward netzero emiss of greenhous gase but also detail what we need to do to achiev thi profoundli import goal he give us a clearey descript of the challeng we face draw on hi understand of innov and what it take to get new idea into the market he describ the area in which technolog is alreadi help to reduc emiss where and how the current technolog can be made to function more effect where breakthrough technolog are need and who is work on these essenti innov final he lay out a concret practic plan for achiev the goal of zero emissionssuggest not onli polici that govern should adopt but what we as individu can do to keep our govern our employ and ourselv account in thi crucial enterpris as bill gate make clear achiev zero emiss will not be simpl or easi to do but if we follow the plan he set out here it is a goal firmli within our reach,climate_change
190,Using Climate Maps,Rebecca E. Hirsch,Lerner Digital ™,audise ebook with audio combin profession narrat and text highlight for an engag read aloud experi ever wonder which state are the cloudiest or what citi get the most snow climat map can tell you they show averag weather conditionsin your neighborhood around the world or even on mar but how do you read a climat map and how are these map made read on to learn the detail,climate_change
191,Urbanism in the Age of Climate Change,Peter Calthorpe,Island Press,citi are green is becom a common refrain but calthorp argu that a more comprehens understand of urban at the region scale provid a better platform to address climat chang in thi groundbreak new work he show how such region scale urban can be combin with green technolog to achiev not onli need reduct in carbon emiss but other critic economi and lifestyl benefit rather than just provid anoth checklist of new energi sourc or one dimension land use altern he combin them into comprehens nation growth scenario for and document their potenti impact in so do he power demonstr that it will take an integr approach of land use transform polici chang and innov technolog to transit to a low carbon economi to accomplish thi calthorp synthes thirti year of experi start with hi ground break work in sustain commun design in the follow through to hi current leadership in transitori design region plan and land use polici peter calthorp show us what is possibl use real world exampl of innov design strategi and forwardthink polici that are alreadi chang the way we live thi provoc and engag work emerg from calthorp belief that just as the last fifti year produc massiv chang in our cultur economi and environ the next fifti will gener chang of an even more profound natur the book enhanc by it superb fourcolor graphic is a call to action and a road map for move forward,climate_change
192,Climate Change and Social Movements,Eugene Nulman,Palgrave Macmillan,climat chang and social movement is a rivet and thorough explor of three import campaign to influenc climat chang polici in the unit kingdom social movement organ and activist work togeth to pass legisl on emiss target oppos the construct of carbonintens infrastructur and establish a public bank that would increas invest into renew energi and energi effici technolog what impact did the campaign have on polici when wa the time ripe for activist to win their demand how were these social movement organ and group abl to effect polici and what strategi were involv the author answer all of these question and more by delv deep into the campaign and illumin the way policymak think about and respond to social movement,climate_change
193,Climate and Human Migration,Robert A. McLeman,Cambridge University Press,studi warn that global warm and sea level rise will creat hundr of million of environment refuge while climat chang will undoubtedli affect futur migrat pattern and behavior the potenti outcom are far more complex than the environment refuge scenario suggest thi book provid a comprehens review of how physic and human process interact to shape migrat use simpl diagram and model to guid the research polici maker and advanc student through the climatemigr process the book appli standard concept and theori use in climat and migrat scholarship to explain how event such as hurrican katrina the dust bowl african drought and flood in bangladesh and china have trigger migrat that havent alway fit the environment refuge storylin lesson from past migrat are use to predict how futur migrat pattern will unfold in the face of sea level rise food insecur and polit instabl and to review option for polici maker,climate_change
194,Climate Change and Cultural Dynamics,David G. Anderson & Kirk Maasch & Daniel H. Sandweiss,Elsevier,the middl holocen epoch to year ago wa a time of dramat chang in the physic world and in human cultur across thi span climat condit chang rapidli with cool in the high to midlatitud and dri in the tropic in mani part of the world human group becam more complex with earli horticultur system replac by intens agricultur and smallscal societi be replac by larger more hierarchi organ climat chang and cultur dynam explor the caus and effect relationship between climat chang and cultur transform across the midholocen c bc explor the role of climat chang on the develop of societi around the world chapter detail divers geograph region cowritten by note archaeologist and paleoclimatologist for nonspecialist,climate_change
195,Storming the Wall,Todd Miller,City Lights Open Media,fastpac frontlin reportag chronicl how climat chang is acceler migrat border buildup and militar in the us and beyond,climate_change
196,Climate Change,William James Burroughs,Cambridge University Press,updat textbook on climat chang for cours in meteorolog oceanographi environment scienc earth scienc and geographi,climate_change
197,The Oxford Handbook of Organizational Climate and Culture,Benjamin Schneider & Karen M. Barbera,Oxford Library of Psychology,the oxford handbook of organiz climat and cultur present the breadth of topic from industri and organiz psycholog and organiz behavior through the lens of organiz climat and cultur the handbook reveal in great detail how in both research and practic climat and cultur reciproc influenc each other the detail reveal the mani practic that organ use to acquir develop manag motiv lead and treat employe both at home and in the multin set that character contemporari organ chapter author are both expert in their field of research and also repres current climat and cultur practic in five nation and intern compani mcdonald the mayo clinic pepsico and tata in addit new approach to the collect and analysi of climat and cultur data are present as well as new think about organiz chang from an integr climat and cultur paradigm no other compendium integr climat and cultur think like thi handbook doe and no other compendium present both an uptod review of the theori and research on the mani facet of climat and cultur as well as contemporari practic the handbook take a climat and cultur vantag point on micro approach to human issu at work recruit and hire train and perform manag motiv and fair as well as organiz process team leadership career commun and it also explic the fact that these are lodg within firm that function in larger nation and intern context,climate_change
198,Encyclical on Climate Change and Inequality,Pope Francis,National Geographic Books,the complet text of laudato si the landmark encycl letter from pope franci that as time magazin report rock the intern commun in the encycl on climat chang and inequ the belov pope exhort the world to combat environment degrad and it impact on the poor in a stir clarion call that is not mere aim at cathol reader but rather at a wide lay audienc the pope cite the overwhelm scientif evid of climat chang and doe not hesit to detail how it is the result of a histor level of unequ distribut of wealth it is in short as the new york time label it an urgent call to action intend to persuad follow around the world to chang their behavior in hope of protect a fragil planet with an insight and inform introduct by harvard professor naomi oresk fame for her bestsel merchant of doubt how a hand of scientist obscur the truth on issu from tobacco smoke to global warm,climate_change
199,Carbon Inequality,DARIO. KENNER,Routledge,with a specif focu on the unit state and the unit kingdom carbon inequ studi the role of the richest peopl in contribut to climat chang via their luxuri consumpt and their invest in an innov contribut it attempt to quantifi person respons for sharehold in larg fossil fuel compani thi book explor the implic of the richest peopl histor respons for global warm the impact of which affect them less than most other in global societi kenner analys how the richest peopl run larg oil and ga compani have success use their polit influenc to lobbi the us and uk govern thi assess of their grow polit power is particularli pertin at a time of increas inequ and grow public awar of the impact of climat chang the book also highlight the crucial role of the richest in block the lowcarbon transit in the us and the uk explor how thi could be counter to ensur fossil fuel are fulli replac by renew energi thi book will be of great relev to scholar and polici maker with an interest in inequ climat chang and sustain transit,climate_change
200,Climate Change,Mark Maslin,"Oxford University Press, USA",previou edit publish as global warm,climate
201,Basher Science: Climate Change,Simon Basher,Macmillan,an introduct to climat chang cover such topic as the polar ice cap the greenhous effect global warm and fossil fuel,climate
202,Climate Change,Chip Fletcher,John Wiley & Sons,thi book introduc climat chang fundament and essenti concept that reveal the extent of the damag the impact felt around the globe and the innov and leadership it will take to bring an end to the statu quo emphas peerreview literatur thi text detail the impact of climat chang on land and sea the water cycl human commun the weather and human collect futur coverag of greenhous gase ocean and atmospher process pleistocen and holocen paleoclim sea level and other fundament topic provid a deep understand of key mechan while discuss of extrem weather econom impact and resourc scarciti reveal how climat chang is alreadi impact peopl livesand will continu to do so at an increas rate for the forese futur,climate
203,The Violence of Climate Change,Kevin J. O'Brien,Georgetown University Press,climat chang is view as a primarili scientif econom or polit issu while acknowledg the legitimaci of these perspect kevin j obrien argu that we should respond to climat chang first and foremost as a case of systemat and structur violenc global warm is larg caus by the carbon emiss of the affluent emiss that harm the poor first and worst climat chang is violenc becaus it divid human be from one anoth and from the earth obrien offer a construct and creativ respons to thi violenc through practic exampl of activ and nonviol peacemak provid brief biographi of five christian in the unit statesjohn woolman jane addam dorothi day martin luther king jr and cesar chavez these activist ideal social commit and polit savvi offer lesson of resist applic to the struggl against climat chang and for social justic,climate
204,Climate Change,David Leonard Downie & Kate Brash & Catherine Vaughan,ABC-CLIO,an access introduct to climat chang that outlin key scientif econom and polit issu review how the global commun ha address the issu to date and discuss the option be explor for further action numer primari sourc document includ excerpt from import earli scientif articl on climat chang global climat treati the intergovernment panel on climat chang assess report and statement from academ busi religi group and more a rich varieti of graphic help reader understand current and expect impact of climat chang as well as the latest data and idea from the scientif commun on the subject of global climat chang,climate
205,Climate,Dana Desonie,Infobase Publishing,discuss the issu of global warm and what we can do to prevent it rise thi book address how peopl must use energi more effici develop altern energi sourc and lower emiss technolog,climate
206,Climate Change,Joseph F. DiMento & Pamela Doughman,MIT Press,most of us are familiar with the term climat chang and global warm but not toomani of us understand the scienc behind them we dont realli understand how climat chang willaffect us and for that reason we might not consid it as press a concern as say housingpric or the qualiti of local educ thi book explain the scientif knowledg about globalclim chang clearli and concis in engag nontechn languag describ how it willaffect all of us and suggest how govern busi and citizen can take action against it ifpeopl dont quit understand the serious of climat chang it is partli becaus politiciansand the media have misrepres the scientif commun strong consensu on itpolitician byselect pars the word of mainstream scientist and the media by presentingbalanc account that give the view of a small number of contrarian equal weight withempir support scientif find the scienc is complex couch in the technic languageof sink forc and albedo and invok probabl risk rang and uncertainti policydiscuss use such unfamiliar term as no regret polici clean develop mechan andgreenhousega intens climat chang explain the nut and bolt of climat and the greenhouseeffect and describ their interact it discuss the natur of consensu in scienc and theconsensu on climat chang in particular it describ both public and privatesector responsesconsid how to improv the way scientif find are commun and evalu the real risksboth to vulner develop countri and to particular area of the unit state we can bettertackl climat chang thi book show us if we understand it we can use thi knowledg to guideour own behavior and pressur govern and busi to take actionjoseph f c dimento isdirector of the newkirk center for scienc and societi professor of plan polici and designand professor of law and societi at the univers of california irvin he is the author of theglob environ and intern law and other book pamela doughman is assist professor ofenvironment studi at the univers of illinoi at springfield and an energi specialist at thecalifornia energi commiss,climate
207,Climate Change from the Streets,Michael Méndez,Yale University Press,an urgent and time stori of the contenti polit of incorpor environment justic into global climat chang polici although the scienc of climat chang is clear polici decis about how to respond to it effect remain contenti even when such decis claim to be guid by object knowledg they are made and implement through polit institut and relationshipsand all the compet interest and power struggl that thi impli michael mendez tell a time stori of peopl place and power in the context of climat chang and inequ he explor the perspect and influenc lowincom peopl of color bring to their advocaci work on climat chang in california activist group have galvan behind issu such as air pollut poverti allevi and green job to advanc equit climat solut at the local state and global level argu that environment protect and improv public health are inextric link mendez contend that we must incorpor local knowledg cultur and histori into policymak to fulli address the global complex of climat chang and the real threat face our local commun,climate
208,Climate Change,Eileen Claussen & Vicki Arroyo Cochran & Debra P. Davis,BRILL,it is the greatest environment challeng of the centuri but what do we truli know about global climat chang and what can we do about it most of the world top scientist agre that emiss of carbon dioxid and other greenhous gase from human activ such as industri process fossil fuel combust and landus chang are caus the earth to get warmer impact of thi warm may includ damag to our coastal area acceler rate of speci loss alter agricultur pattern and increas incid of infecti diseas the effect of climat chang and effort to mitig climat chang could also have substanti econom ramif the book present the latest research and analysi from promin scientist economist academ and policymak includ tom wigley and joel smith who along with other author of the scienc and impact chapter explain the basic scienc of climat chang the grow evid that human activ are chang our climat and the impact of these chang eileen claussen john gummer henri lee and other author of the global strategi chapter who describ what nation are or are not do to address climat chang and the state of intern climat talk robert stavin john weyant ev ehrlich and other economist who explain whi econom analys of climat polici are conduct whi the project cost of address climat chang vari so wide among econom model and how chang driven by today economi can influenc climat polici gov jean shaheen and other author of the innov solut chapter who describ what state and local govern in theunit state and multin compani are do to monitor and curb greenhous ga emiss and forest reinhardt who offer busi leader advic on steer their compani on a path that is healthi for busi as well as the global climat thi public ha also been publish in paperback pleas click here for detail,climate
209,Encyclical on Climate Change and Inequality,Pope Francis,Melville House,the complet text of laudato si the landmark encycl letter from pope franci that as time magazin report rock the intern commun in the encycl on climat chang and inequ the belov pope exhort the world to combat environment degrad and it impact on the poor in a stir clarion call that is not mere aim at cathol reader but rather at a wide lay audienc the pope cite the overwhelm scientif evid of climat chang and doe not hesit to detail how it is the result of a histor level of unequ distribut of wealth it is in short as the new york time label it an urgent call to action intend to persuad follow around the world to chang their behavior in hope of protect a fragil planet with an insight and inform introduct by harvard professor naomi oresk fame for her bestsel merchant of doubt how a hand of scientist obscur the truth on issu from tobacco smoke to global warm,climate
210,Why We Disagree About Climate Change,Mike Hulme,Cambridge University Press,climat chang is not a problem wait for a solut it is an environment cultur and polit phenomenon which is reshap the way we think about ourselv our societi and human place on earth draw upon twentyf year of profession work as an intern climat chang scientist and public comment mike hulm provid a uniqu insid account of the emerg of thi phenomenon and the divers way in which it is understood he use differ standpoint from scienc econom faith psycholog commun sociolog polit and develop to explain whi we disagre about climat chang in thi way he show that climat chang far from be simpli an issu or a threat can act as a catalyst to revis our percept of our place in the world whi we disagre about climat chang is an import contribut to the ongo debat over climat chang and it like impact on our live,climate
211,Global Climate Change and U.S. Law,Michael Gerrard,American Bar Association,thi comprehens current examin of us law as it relat to global climat chang begin with a summari of the factual and scientif background of climat chang base on government statist and other offici sourc subsequ chapter address the intern and nation framework of climat chang law includ the kyoto protocol state program affect in the absenc of a mandatori feder program issu of disclosur and corpor govern and the insur industri also cover are the legal aspect of other effort includ voluntari program emiss trade program and carbon sequestr,climate
212,Climate Change,Edmond Mathez & Jason Smerdon,~Publisher not available~,thi second edit of climat chang is an access and comprehens guid to the scienc behind global warm edmond a mathez and jason e smerdon provid a broad inform introduct to the scienc that underli our understand of the climat system and the effect of human activ on the warm of our planet,climate
213,Global Climate Change and Human Health,Jay Lemery & Kim Knowlton & Cecilia Sorensen,John Wiley & Sons,learn more about the impact of global warm and climat chang on human health and diseas the second edit of global climat chang and human health deliv an access and comprehens explor of the rapidli acceler and increasingli ubiquit effect of climat chang and global warm on human health and diseas the distinguish and accomplish author discuss the health impact of the econom climatolog and geopolit effect of global warm youll learn about the effect of extrem weather event on public health and the effect of chang meteorolog condit on human health how chang in hydrolog impact the spread of waterborn diseas and noninfecti waterborn threat adapt to and the mitig and govern of climat chang includ intern perspect on climat chang adapt perfect for student of public health medicin nurs and pharmaci global climat chang and human health second edit is an invalu resourc for anyon with an interest in the intersect of climat and human health and diseas,climate
