TITLE,AUTHOR,PUBLISHER,DESCRIPTION,Label
Fixing the Climate,Charles F. Sabel & David G. Victor,Princeton University Press,solving the global climate crisis through local partnerships and experimentation global climate diplomacyfrom the kyoto protocol to the paris agreementis not working despite decades of sustained negotiations by world leaders the climate crisis continues to worsen the solution is within our graspbut we will not achieve it through topdown global treaties or grand bargains among nations charles sabel and david victor explain why the profound transformations needed for deep cuts in emissions must arise locally with government and business working together to experiment with new technologies quickly learn the best solutions and spread that information globally sabel and victor show how some of the most iconic successes in environmental policy were products of this experimentalist approach to problem solving such as the montreal protocol on the ozone layer the rise of electric vehicles and europes success in controlling water pollution they argue that the paris agreement is at best an umbrella under which local experimentation can push the technological frontier and help societies around the world learn how to deploy the technologies and policies needed to tackle this daunting global problem a visionary book that fundamentally reorients our thinking about the climate crisis fixing the climate is a road map to institutional design that can finally lead to selfsustaining reductions in emissions that years of global diplomacy have failed to deliver,climate_change
Climate Change,David Miles,You Are Here Books,climate change would you leave it to chance in this interactive book for kids young readers will learn about climate how climate has changed throughout history and the driving forces of the greenhouse effect using colorful illustrations simple text and research from trusted sources like nasa noaa and the united nations interactive climate change outlines the causes of climate change and gently explores its consequences like rising sea levels more extreme weather and drought though not shy about uncomfortable realities interactive climate change also emphatically teaches hope for the future and includes timely recommendations for what kids can do short bios of adults and kids who are leading the charge and brief summaries of successes that have already happened most importantly of all the books builtin spinner offers readers a choice on every page spin the arrow and leave climate change to chance or do something about it,climate_change
Climate Change (A Ladybird Expert Book),HRH The Prince of Wales & Tony Juniper & Emily Schuckburgh,National Geographic Books,what is climate change how does it work learn from the experts in the allnew ladybird expert series learn about one of the most important issues facing our world today in this clear simple and enlightening introduction from hrh the prince of wales environmentalist tony juniper and climate scientist dr emily shuckburgh it explains the history dangers and challenges of global warming and explores possible solutions with which to reduce its impact youll learn about     the causes and consequences of climate disruption  heatwaves floods and other extreme weather  disappearing wildlife  acid oceans  the benefits of limiting warming  sustainable farming  new clean technologies  the circular economy learn about other topics in the ladybird experts series including gravity quantum physics climate change and evolution written by the leading lights and most outstanding communicators in their fields the ladybird expert books provide clear accessible and authoritative introductions to subjects drawn from science history and culture for an adult readership the ladybird expert series is produced in the same iconic small hardback format pioneered by the original ladybirds each beautifully illustrated book features the first new illustrations produced in the original ladybird style for nearly forty years,climate_change
Disposable City,Mario Alejandro Ariza,Bold Type Books,a deeplyreported personal investigation by a miami journalist into the present and future effects of climate change in the magic citya watery harbinger for coastal cities worldwide miami florida is likely to be entirely underwater by the end of this century residents are already starting to see the effects of sea level rise today from sunny day flooding caused by higher tides to a sewer system on the brink of total collapse the city undeniably lives in a climate changed world in disposable city miami resident mario alejandro ariza shows us not only what climate change looks like on the ground today but also what miami will look like  years from now and how that future has been shaped by the citys racist past and present as politicians continue to kick the can down the road and miami becomes increasingly unlivable real estate vultures and wealthy residents will be able to get out or move to higher ground but the most vulnerable communities disproportionately composed of people of color will face flood damage rising housing costs dangerously higher temperatures and stronger hurricanes that they cant afford to escape miami may be on the front lines of climate change but the battle its fighting today is coming for the rest of the usand the rest of the worldfar sooner than we could have imagined even a decade ago disposable city is a thoughtful portrait of both a vibrant city with a unique culture and the social economic and psychic costs of climate change that call us to act before its too late,climate_change
Climate Maps,Ian F. Mahaney,"The Rosen Publishing Group, Inc",explains how to read and understand a climate map,climate_change
Tales of Two Planets,John Freeman,Penguin,building from his acclaimed anthology tales of two americas beloved writer and editor john freeman draws together a group of our greatest writers from around the world to help us see how the environmental crisis is hitting some of the most vulnerable communities where they live in the past five years john freeman previously editor of granta has launched a celebrated international literary magazine freemans and compiled two acclaimed anthologies that deal with income inequality as it is experienced in the course of this work one major theme came up repeatedly climate change is making already dire inequalities much worse devastating further the already devastated but the problems of climate change are not restricted to those from the less developed world galvanized by his conversations with writers and activists around the world freeman engaged with some of todays most eloquent storytellers many of whom hail from the places under the most acute stressfrom the capital of burundi to bangkok thailand the response has been extraordinary margaret atwood conjures with a dystopian future in a remarkable poem lauren groff whisks us to florida edwidge danticat to haiti tahmima anam to bangladesh yasmine el rashidi to egypt while eka kurniawan brings us to indonesia chinelo okparanta to nigeria and anuradha roy to the himalayas in the wake of floods dam building and drought this is a literary allpoints bulletin of fiction essays poems and reportage about the most important crisis of our times,climate_change
Climate-Challenged Society,John S. Dryzek & Richard B. Norgaard & David Schlosberg,Oxford University Press,a short accessible introductory treatment of how climate change affects society and how social economic and political systems can do and should respond,climate_change
How to Avoid a Climate Disaster,Bill Gates,~Publisher not available~,bill gates has spent a decade investigating the causes and effects of climate change with the help of experts in the fields of physics chemistry biology engineering political science and finance he has focused on what must be done in order to stop the planets slide toward certain environmental disaster in this book he not only explains why we need to work toward netzero emissions of greenhouse gases but also details what we need to do to achieve this profoundly important goal he gives us a cleareyed description of the challenges we face drawing on his understanding of innovation and what it takes to get new ideas into the market he describes the areas in which technology is already helping to reduce emissions where and how the current technology can be made to function more effectively where breakthrough technologies are needed and who is working on these essential innovations finally he lays out a concrete practical plan for achieving the goal of zero emissionssuggesting not only policies that governments should adopt but what we as individuals can do to keep our government our employers and ourselves accountable in this crucial enterprise as bill gates makes clear achieving zero emissions will not be simple or easy to do but if we follow the plan he sets out here it is a goal firmly within our reach,climate_change
Using Climate Maps,Rebecca E. Hirsch,Lerner Digital ™,audisee ebooks with audio combine professional narration and text highlighting for an engaging read aloud experience ever wonder which states are the cloudiest or what city gets the most snow climate maps can tell you they show average weather conditionsin your neighborhood around the world or even on mars but how do you read a climate map and how are these maps made read on to learn the details,climate_change
Urbanism in the Age of Climate Change,Peter Calthorpe,Island Press,cities are green is becoming a common refrain but calthorpe argues that a more comprehensive understanding of urbanism at the regional scale provides a better platform to address climate change in this groundbreaking new work he shows how such regionally scaled urbanism can be combined with green technology to achieve not only needed reductions in carbon emissions but other critical economies and lifestyle benefits rather than just providing another checklist of new energy sources or one dimensional land use alternatives he combines them into comprehensive national growth scenarios for  and documents their potential impacts in so doing he powerfully demonstrates that it will take an integrated approach of land use transformation policy changes and innovative technology to transition to a low carbon economy to accomplish this calthorpe synthesizes thirty years of experience starting with his ground breaking work in sustainable community design in the  following through to his current leadership in transitoriented design regional planning and land use policy peter calthorpe shows us what is possible using real world examples of innovative design strategies and forwardthinking policies that are already changing the way we live this provocative and engaging work emerges from calthorpes belief that just as the last fifty years produced massive changes in our culture economy and environment the next fifty will generate changes of an even more profound nature the book enhanced by its superb fourcolor graphics is a call to action and a road map for moving forward,climate_change
Climate Change and Social Movements,Eugene Nulman,Palgrave Macmillan,climate change and social movements is a riveting and thorough exploration of three important campaigns to influence climate change policy in the united kingdom social movement organizations and activists worked together to pass legislation on emissions targets oppose the construction of carbonintensive infrastructure and establish a public bank that would increase investment into renewable energy and energy efficient technology what impact did the campaigns have on policy when was the timing ripe for activists to win their demands how were these social movement organizations and groups able to effect policy and what strategies were involved the author answers all of these questions and more by delving deep into the campaigns and illuminating the way policymakers think about and respond to social movements,climate_change
Climate and Human Migration,Robert A. McLeman,Cambridge University Press,studies warn that global warming and sea level rise will create hundreds of millions of environmental refugees while climate change will undoubtedly affect future migration patterns and behavior the potential outcomes are far more complex than the environmental refugee scenario suggests this book provides a comprehensive review of how physical and human processes interact to shape migration using simple diagrams and models to guide the researcher policy maker and advanced student through the climatemigration process the book applies standard concepts and theories used in climate and migration scholarship to explain how events such as hurricane katrina the dust bowl african droughts and floods in bangladesh and china have triggered migrations that havent always fit the environmental refugee storyline lessons from past migrations are used to predict how future migration patterns will unfold in the face of sea level rise food insecurity and political instability and to review options for policy makers,climate_change
Climate Change and Cultural Dynamics,David G. Anderson & Kirk Maasch & Daniel H. Sandweiss,Elsevier,the middle holocene epoch  to  years ago was a time of dramatic changes in the physical world and in human cultures across this span climatic conditions changed rapidly with cooling in the high to midlatitudes and drying in the tropics in many parts of the world human groups became more complex with early horticultural systems replaced by intensive agriculture and smallscale societies being replaced by larger more hierarchial organizations climate change and cultural dynamics explores the cause and effect relationship between climatic change and cultural transformations across the midholocene c  bc explores the role of climatic change on the development of society around the world chapters detail diverse geographical regions cowritten by noted archaeologists and paleoclimatologists for nonspecialists,climate_change
Storming the Wall,Todd Miller,City Lights Open Media,fastpaced frontline reportage chronicling how climate change is accelerating migration border buildup and militarization in the us and beyond,climate_change
Climate Change,William James Burroughs,Cambridge University Press,updated textbook on climate change for courses in meteorology oceanography environmental science earth science and geography,climate_change
The Oxford Handbook of Organizational Climate and Culture,Benjamin Schneider & Karen M. Barbera,Oxford Library of Psychology,the oxford handbook of organizational climate and culture presents the breadth of topics from industrial and organizational psychology and organizational behavior through the lenses of organizational climate and culture the handbook reveals in great detail how in both research and practice climate and culture reciprocally influence each other the details reveal the many practices that organizations use to acquire develop manage motivate lead and treat employees both at home and in the multinational settings that characterize contemporary organizations chapter authors are both expert in their fields of research and also represent current climate and culture practice in five national and international companies  mcdonalds the mayo clinic pepsico and tata in addition new approaches to the collection and analysis of climate and culture data are presented as well as new thinking about organizational change from an integrated climate and culture paradigm no other compendium integrates climate and culture thinking like this handbook does and no other compendium presents both an uptodate review of the theory and research on the many facets of climate and culture as well as contemporary practice the handbook takes a climate and culture vantage point on micro approaches to human issues at work recruitment and hiring training and performance management motivation and fairness as well as organizational processes teams leadership careers communication and it also explicates the fact that these are lodged within firms that function in larger national and international contexts,climate_change
Encyclical on Climate Change and Inequality,Pope Francis,National Geographic Books,the complete text of laudato si the landmark encyclical letter from pope francis that as time magazine reported rocked the international community in the encyclical on climate change and inequality the beloved pope exhorts the world to combat environmental degradation and its impact on the poor in a stirring clarion call that is not merely aimed at catholic readers but rather at a wide lay audience the pope cites the overwhelming scientific evidence of climate change and does not hesitate to detail how it is the result of a historic level of unequal distribution of wealth it is in short as the new york times labeled it an urgent call to action    intended to persuade followers around the world to change their behavior in hopes of protecting a fragile planet with an insightful and informative introduction by harvard professor naomi oreskes famed for her bestselling merchants of doubt how a handful of scientists obscured the truth on issues from tobacco smoke to global warming,climate_change
Carbon Inequality,DARIO. KENNER,Routledge,with a specific focus on the united states and the united kingdom carbon inequality studies the role of the richest people in contributing to climate change via their luxury consumption and their investments in an innovative contribution it attempts to quantify personal responsibility for shareholdings in large fossil fuel companies this book explores the implications of the richest peoples historic responsibility for global warming the impacts of which affect them less than most others in global society kenner analyses how the richest people running large oil and gas companies have successfully used their political influence to lobby the us and uk government this assessment of their growing political power is particularly pertinent at a time of increasing inequality and growing public awareness of the impact of climate change the book also highlights the crucial role of the richest in blocking the lowcarbon transition in the us and the uk exploring how this could be countered to ensure fossil fuels are fully replaced by renewable energy this book will be of great relevance to scholars and policy makers with an interest in inequality climate change and sustainability transitions,climate_change
Climate Change,Mark Maslin,"Oxford University Press, USA",previous editions published as global warming,climate
Basher Science: Climate Change,Simon Basher,Macmillan,an introduction to climate change covers such topics as the polar ice caps the greenhouse effect global warming and fossil fuels,climate
Climate Change,Chip Fletcher,John Wiley & Sons,this book introduces climate change fundamentals and essential concepts that reveal the extent of the damage the impacts felt around the globe and the innovation and leadership it will take to bring an end to the status quo emphasizing peerreviewed literature this text details the impact of climate change on land and sea the water cycle human communities the weather and humanitys collective future coverage of greenhouse gases oceanic and atmospheric processes pleistocene and holocene paleoclimate sea levels and other fundamental topics provide a deep understanding of key mechanisms while discussion of extreme weather economic impacts and resource scarcity reveals how climate change is already impacting peoples livesand will continue to do so at an increasing rate for the foreseeable future,climate
The Violence of Climate Change,Kevin J. O'Brien,Georgetown University Press,climate change is viewed as a primarily scientific economic or political issue while acknowledging the legitimacy of these perspectives kevin j obrien argues that we should respond to climate change first and foremost as a case of systematic and structural violence global warming is largely caused by the carbon emissions of the affluent emissions that harm the poor first and worst climate change is violence because it divides human beings from one another and from the earth obrien offers a constructive and creative response to this violence through practical examples of activism and nonviolent peacemaking providing brief biographies of five christians in the united statesjohn woolman jane addams dorothy day martin luther king jr and cesar chavez these activists idealism social commitment and political savvy offer lessons of resistance applicable to the struggle against climate change and for social justice,climate
Climate Change,David Leonard Downie & Kate Brash & Catherine Vaughan,ABC-CLIO,an accessible introduction to climate change that outlines key scientific economic and political issues reviews how the global community has addressed the issue to date and discusses the options being explored for further action  numerous primary source documents including excerpts from important early scientific articles on climate change global climate treaties the  intergovernmental panel on climate change assessment reports and statements from academics businesses religious groups and more  a rich variety of graphics help readers understand current and expected impacts of climate change as well as the latest data and ideas from the scientific community on the subject of global climate change,climate
Climate,Dana Desonie,Infobase Publishing,discusses the issue of global warming and what we can do to prevent its rise this book addresses how people must use energy more efficiently develop alternative energy sources and lower emissions technologies,climate
Climate Change,Joseph F. DiMento & Pamela Doughman,MIT Press,most of us are familiar with the terms climate change and global warming but not toomany of us understand the science behind them we dont really understand how climate change willaffect us and for that reason we might not consider it as pressing a concern as say housingprices or the quality of local education this book explains the scientific knowledge about globalclimate change clearly and concisely in engaging nontechnical language describes how it willaffect all of us and suggests how government business and citizens can take action against it ifpeople dont quite understand the seriousness of climate change it is partly because politiciansand the media have misrepresented the scientific communitys strong consensus on itpoliticians byselectively parsing the words of mainstream scientists and the media by presentingbalanced accounts that give the views of a small number of contrarians equal weight withempirically supported scientific findings the science is complex couched in the technical languageof sinks forcing and albedo and invokes probabilities risks ranges and uncertainties policydiscussions use such unfamiliar terms as no regrets policy clean development mechanism andgreenhousegas intensity climate change explains the nuts and bolts of climate and the greenhouseeffect and describes their interaction it discusses the nature of consensus in science and theconsensus on climate change in particular it describes both public and privatesector responsesconsiders how to improve the way scientific findings are communicated and evaluates the real risksboth to vulnerable developing countries and to particular areas of the united states we can bettertackle climate change this book shows us if we understand it we can use this knowledge to guideour own behavior and pressure governments and businesses to take actionjoseph f c dimento isdirector of the newkirk center for science and society professor of planning policy and designand professor of law and society at the university of california irvine he is the author of theglobal environment and international law and other books pamela doughman is assistant professor ofenvironmental studies at the university of illinois at springfield and an energy specialist at thecalifornia energy commission,climate
Climate Change from the Streets,Michael Méndez,Yale University Press,an urgent and timely story of the contentious politics of incorporating environmental justice into global climate change policy although the science of climate change is clear policy decisions about how to respond to its effects remain contentious even when such decisions claim to be guided by objective knowledge they are made and implemented through political institutions and relationshipsand all the competing interests and power struggles that this implies michael mendez tells a timely story of people place and power in the context of climate change and inequality he explores the perspectives and influence lowincome people of color bring to their advocacy work on climate change in california activist groups have galvanized behind issues such as air pollution poverty alleviation and green jobs to advance equitable climate solutions at the local state and global levels arguing that environmental protection and improving public health are inextricably linked mendez contends that we must incorporate local knowledge culture and history into policymaking to fully address the global complexities of climate change and the real threats facing our local communities,climate
