TITLE,AUTHOR,PUBLISHER,DESCRIPTION,Label
Climate Justice and Collective Action,Angela Kallhoff,Routledge,this book develops a theory of climate cooperation designed for concerted action which emphasises the role and function of collectives in achieving shared climate goals in debates on climate change action research focuses on three major goals on mitigation on adaptation and on transformation even though these goals are accepted concerted action is still difficult to realize climate justice and collective action provides an analysis of why this is the case and develops a theory of climate cooperation designed to overcome the existing roadblocks angela kallhoff starts with a thorough analysis of failures of collective action in the context of climate change action taking inspiration from theories of water cooperation she then establishes a theory of joint action that reframes climate goals as shared goals and highlights the importance of adhering to principles of fairness this also includes an exploration of the normative claims working in the background of climate cooperation finally kallhoff puts forward proposals for a fair allocation of duties to cooperate with respect to climate goals this book will be of great interest to students and scholars of climate action climate justice environmental sociology and environmental philosophy and ethics more broadly,Climate_justice
The EU and Global Climate Justice,Franziskus von Lucke & Thomas Diez & Solveig Aamodt & Bettina Ahrens,Routledge,this book examines the european unions contribution to the development of the global climate regime within the broader framework of global justice it argues that the procedural dimension of justice has been largely overlooked so far in the assessment of eu climate policy and reveals the eu has significantly contributed to the development of the climate regime within its broader efforts to solidarise international society at the same time the book identifies deficits of the climate regime and limits to the eus impact and explains why the eu policy towards global climate change has shifted over time finally however it argues that these policies should not be assessed in terms of being either wholly positive or negative but that they are shot through with ambiguities this book will be of key interest to scholars students and practitioners of climate change climate politics environmental and climate justice studies and more broadly to eu studies and international relations,Climate_justice
Media and Transnational Climate Justice,Anna Roosvall & Matthew Tegelberg,"Peter Lang Incorporated, International Academic Publishers",a wideranging interdisciplinary study of activism and media based on original research this is a timely and insightful contribution to theorizing global justice as involving solidarity and voice beyond existing political structureskate nash professor of sociology goldsmiths university of london and faculty fellow center for cultural sociology yale university,Climate_justice
Climate Justice in a Non-ideal World,Jennifer Clare Heyward & Dominic Roser,Oxford University Press,climate change is a pressing international political issue for which a practical but principled solution is urgently required climate justice in a nonideal world aims to make normative theorising on climate justice more relevant and applicable to political realities and public policy the motivation behind this edited collection is that normative theorising has something to offer even in an imperfect world mired by partial compliance and unfavourable circumstances in the last years a lively debate has sprung up in political philosophy about nonideal theory and there has also been an upsurge of interest in the various normative issues raised by climate change such as intergenerational justice transnational harm collective action or risk assessment however there has been little systematic discussion of the links between climate justice and nonideal theory even though the former would seem like a paradigm example of the relevance of the latter the aim of this edited volume is to address this in doing so the volume presents original work from leading experts on climate ethics including several who have participated in climate policy the first part of the book discusses those facets of the debate on climate justice that become relevant due to the shortcomings of current global action on climate change the second part makes specific suggestions for adjusting current policies and negotiating procedures in ways that are feasible in the relatively short term while still decreasing the distance between current climate policy and the ideal the chapters in the third and final part reflect upon how philosophical work can be brought to bear on the debates in climate science communication and politics,Climate_justice
Justice in Climate Action Planning,Brian Petersen & Hélène B. Ducros,Springer Nature,this edited volume examines how climate action plans engage justice at the scale of the city recent events in the united states make the context particularly ripe for a discussion of justice in urban climate politics on the one hand the emergence of the black lives matter movement george floyds death and the prominence of racial discrimination in the public realm have mainstreamed the notion of justice on the other hand the dire consequences of increased frequency and severity of climate events on vulnerable segments of urban populations are undeniable while some cities have been proactive about integrating justice in their climate action planning in most places an explicit and systematic link between both spheres has been lacking this book explores this interface as it seeks to understand how cities can respond to climate change in a just way and for just outcomes while resilience strategies based on development may engage historic inequities they may at the same time result in marginalizing certain populations through various processes from mismatched solutions to outright exclusion and climate gentrification by identifying how certain populations are included in or excluded from climate action planning practices the chapters in this volume draw on case studies to outline the differential outcomes of climate action in american cities also proposing a template for comparative work beyond the us the authors tackle the debate about how justice is or is not integrated in climate action plans and assess practical implications while also making theoretical and methodological contributions as it fills a gap in the literature at the intersection of justice and climate action the book produces new insights for a wideranging audience students practitioners policymakers planners the nonprofit sector and scholars in geography urban planning urban studies environmental studies ecology political science or anthropology along five axes of investigationtheory resilience equity community and comparison as methodthe contributors offer various pathways into the intersection between urban climate action and different understandings of justice collectively they invite a reflection that can lead to practical initiatives in climate mitigation while also advancing the theorization of social justice to account for the urban as a node where injustice plays out and can be addressed with significant results,Climate_justice
Climate Justice,Randall Abate,~Publisher not available~,climate change is one of the most complex political social and environmental issues of this century and climate change adaptation has become an increasingly large focus of global efforts the international communitys attention on adaptation has been primarily focused on developing countries needs with consensus that the worlds most vulnerable communitiesthe urban and rural poor lowlying island nations and indigenous peoplesrequire additional protection it was in response to this need for equity that climate justice emerged climate justice can be defined generally as addressing the disproportionate burden of climate change impacts on poor and marginalized communities it seeks to promote more equitable allocation of the burdens of these impacts at the local national and global levels through proactive regulatory initiatives and reactive judicial remedies that draw on international human rights and domestic environmental justice theories yet efforts to define climate justice as a field of inquiry can be elusive and underinclusive because the concept is so vast in scope climate justice case studies in global and regional governance challenges seeks to fill that void providing an overview of the landscape of climate justice from a variety of legal and geographic perspectives in a case study format drawing on the expertise of  contributors from  countries the book analyzes climate justice from an international law perspective and from the perspectives of legal responses to promote climate justice in several regions of the world including pacific island nations south asia north america africa and the middle east it addresses proposed solutions to a range of regulatory obstacles under international law us law and foreign domestic law in seeking to promote climate justice on a global scale,Climate_justice
Climate Justice and Historical Emissions,Lukas H. Meyer & Pranay Sanklecha,Cambridge University Press,this book provides a systematic introduction to the debate on historical emissions and climate change for students researchers and policymakers,Climate_justice
Climate Futures,Kum-Kum Bhavnani & John Foran & Priya A. Kurian & Debashish Munshi,Zed Books Ltd.,approaching the issues of climate change and climate justice from a range of diverse perspectives including those of culture gender indigeneity race and sexuality as well as challenging colonial histories and capitalist presents climate futures boldly addresses the apparent inevitability of climate chaos seeking better explanations of the underlying causes and consequences of climate change and mapping strategies toward a better future or at a minimum the most likely bestcase world that we can get to this book envisions planetary social movements robust enough to spark the necessary changes needed to achieve deeply sustainable and just economic social and political policies and practices bringing together insights from interdisciplinary scholars policymakers creatives and activists climate futures argues for the need to get past usandthem divides and acknowledge how lives of creatures far and near human and nonhuman are interconnected,Climate_justice
Defining Environmental Justice,David Schlosberg,Oxford University Press,the book uses both environmental movements and political theory to help define what is meant by environmental and ecological justice it will be useful to anyone interested in environmental politics environmental movements and justice theory,Climate_justice
Climate Justice,Dominic Roser & Christian Seidel,Routledge,the link between justice and climate change is becoming increasingly prominent in public debates on climate policy this clear and concise philosophical introduction to climate justice addresses the hot topic of climate change as a moral challenge using engaging everyday examples the authors address the core arguments by providing a comprehensive and balanced overview of this heated debate enabling students and practitioners to think critically about the subject area and to promote discussion on questions such as why do anything in the face of climate change how much do we owe our descendants a better world or nothing at all how should we distribute the burden of climate action between industrialized and developing countries should i adopt a green lifestyle even if no one else makes an effort which means of reducing emissions are permissible should we put hope in technological solutions should we redesign democratic institutions for more effective climate policy with chapter summaries illustrative examples and suggestions for further reading this book is an ideal introduction for students in political philosophy applied ethics and environmental ethics as well as for practitioners working on one of the most urgent issues of our time ,Climate_justice
Indigenous Peoples and Climate Justice,Giada Giacomini,Springer Nature,this book provides a new interpretation of international law specifically dedicated to indigenous peoples in the context of a climate justice approach the book presents a critical analysis of past and current developments at the intersection of human rights and international environmental law and governance the book suggests new ways forward and demonstrates the need for a paradigmatic shift that would enhance the meaningful participation of indigenous peoples as fundamental actors in the conservation of biodiversity and in the fight against climate change the book offers guidance on a number of critical intersecting and interdependent issues at the forefront of climate change law and policy  inside and outside of the un climate change regime the author suggests that the adoption of a critical perspective on international law is needed in order to highlight inherent structural and systemic issues of the international law regime which are all issues that ultimately impede the pursue of climate justice for indigenous peoples,Climate_justice
Climate Change and Justice,Jeremy Moss,Cambridge University Press,this collection sheds new light on the key ethical issues of climate change justice,Climate_justice
Climate Justice and Non-State Actors,Jeremy Moss & Lachlan Umbers,Routledge,this book investigates the relationship between nonstate actors and climate justice from a philosophical perspective the climate justice literature remains largely focused upon the rights and duties of states yet for decades states have failed to take adequate steps to address climate change this has led some to suggest that if severe climate change and its attendant harms are to be avoided nonstate actors are going to have to step into the breach this collection represents the first attempt to systematically examine the climate duties of the most significant nonstate actors  corporations subnational political communities and individuals targeted at academic philosophers working on climate justice this collection will also be of great interest to students and scholars of global justice applied ethics political philosophy and environmental humanities,Climate_justice
"Understanding Global Warming with Max Axiom, Super Scientist",Agnieszka Biskup,Capstone Classroom,in graphic novel format follows the adventures of max axiom as he explains the science behind global warmingprovided by publisher,Global_warming
The Great Global Warming Blunder,Roy W Spencer,Encounter Books,the great global warming blunder unveils new evidence from major scientific findings that explode the conventional wisdom on climate change and reshape the global warming debate as we know it roy w spencer a former senior nasa climatologist reveals how climate researchers have mistaken cause and effect when analyzing cloud behavior and have been duped by mother nature into believing the earths climate system is far more sensitive to human activities and carbon dioxide than it really is in fact spencer presents astonishing new evidence that recent warming is not the fault of humans but the result of chaotic internal natural cycles that have been causing periods of warming and cooling for millennia more carbon dioxide in the atmosphere is not necessarily to be feared the great global warming blunder explains that burning of fossil fuels may actually be beneficial for life on earth as groupthink behavior and misguided global warming policy proposals threaten the lives of millions of the worlds poorest most vulnerable citizens the great global warming blunder is a scintillating expose and muchneeded call for debate,Global_warming
Global Warming: A Very Short Introduction,Mark Maslin,"Oxford University Press, UK",global warming is one of the most controversial scientific issues of the twenty first century this book provides an informative uptodate and readable book about the predicted impacts of global warming and the surprises that could be in store for us in the near future  global warming is one of the most controversial scientific issues of the twentyfirst century this is a problem that has serious economic sociological geopolitical political and personal implications this very short introduction is an informative uptodate and readable book about the predicted impacts of global warming and the surprises that could be in store for us in the near future it unpacks the controversies that surround global warming drawing on material from the recent report of the intergovernmental panel on climate change ipcc a huge collaborative study drawing together current thinking on the subject from experts in a range of disciplines and for the first time presents the findings of the panel for a general readership the book also discusses the politics of global warming and looks at what we can do now to adapt to climate change and mitigate its worst effects ,Global_warming
The Politically Incorrect Guide to Global Warming,Christopher C. Horner,Regnery Publishing,an exposae of some of the more controversial agendas behind global warming argues that poorquality science and dishonest politics are contributing to the intentionally disporportionate and selfserving levels of fear,Global_warming
Climate Change,Edmond A. Mathez & Jason Smerdon,Columbia University Press,this second edition of climate change is an accessible and comprehensive guide to the science behind global warming exquisitely illustrated the text is geared toward students at a variety of levels edmond a mathez and jason e smerdon provide a broad informative introduction to the science that underlies our understanding of the climate system and the effects of human activity on the warming of our planet mathez and smerdon describe the roles that the atmosphere and ocean play in our climate introduce the concept of radiation balance and explain climate changes that occurred in the past they also detail the human activities that influence the climate such as greenhouse gas and aerosol emissions and deforestation as well as the effects of natural phenomena climate change concludes with a look toward the future discussing climate model projections exploring the economic and technological realities of energy production and presenting a view of the global warming challenge through the lens of risk each chapter features profiles of scientists who advanced our understanding of the material discussed this new edition expands on the first editions presentation of scientific concepts making it ideal for classroom use for a wide swath of undergraduate and masters students with both science and nonscience backgrounds,Global_warming
Global Warming,John Houghton,Cambridge University Press,how much of global warming is due to human activities how far will it be possible to adapt to changes of climate sir john houghtons definitive full colour guide to climate change answers these questions and more by providing the best and latest information available including the latest ipcc findings the simple logical flow of ideas gives an invaluable grounding in the science as well as the physical and human impacts of climate change for undergraduate students across a wide range of disciplines accessible to both scientists and nonscientists the text avoids mathematical equations and includes more technical material in boxes while simple figures help students to understand the conclusions the science leads to without being overwhelmed by vast amounts of data questions for students to consider and test their understanding are included in each chapter along with carefully selected further reading to expand their knowledge,Global_warming
A Global Warming Primer,Jeffrey Bennett,~Publisher not available~,is humaninduced global warming a real threat to our future most people will express an opinion on this question but relatively few can back their opinions with solid evidence many times weve even heard pundits say i am not a scientist to avoid the issue altogether but the truth is the basic science is not that difficult using a question and answer format this book will help readers achieve three major goals to see that anyone can understand the basic science of global warming to understand the arguments about this issue made by skeptics so that readers will be able to decide for themselves what to believe to understand why despite the gloom and doom that often surrounds this topic the solutions are ones that will not only protect the world for our children and grandchildren but that will actually lead us to a stronger economy with energy that is cheaper cleaner and more abundant than the energy we use today,Global_warming
An Inconvenient Truth,Al Gore,Penguin,former vice president al gores new york times  bestselling book is a daring call to action exposing the shocking reality of how humankind has aided in the destruction of our planet and the future we face if we do not take action to stop global warming now viking has adapted this book for the most important audience of all todays youth who have no choice but to confront this climate crisis headon dramatic fullcolor photos illustrations and graphs combine with gores effective and clear writing to explain global warming in very real terms what it is what causes it and what will happen if we continue to ignore it an inconvenient truth will change the way young people understand global warming and hopefully inspire them to help change the course of history,Global_warming
Windfall,Mckenzie Funk,Penguin,a fascinating investigation into how people around the globe are cashing in on a warming world mckenzie funk has spent the last six years reporting around the world on how we are preparing for a warmer planet funk shows us that the best way to understand the catastrophe of global warming is to see it through the eyes of those who see it most clearlyas a market opportunity global warmings physical impacts can be separated into three broad categories melt drought and deluge funk travels to two dozen countries to profile entrepreneurial people who see in each of these forces a potential windfall the melt is a boon for newly arable mineralrich regions of the arctic such as greenlandand for the surprising kings of the manmade snow trade the israelis the process of desalination vital to israels survival can produce a snowlike byproduct that alpine countries use to prolong their ski season drought creates opportunities for private firefighters working for insurance companies in california as well as for fund managers backing south sudanese warlords who control local farmland as droughts raise food prices globally there is no more precious asset the delugethe rising seas surging rivers and superstorms that will threaten island nations and coastal citieshas been our most distant concern but after hurricane sandy and failure after failure to cut global carbon emissions it is not so distant for dutch architects designing floating cities and american scientists patenting hurricane defenses the race is on for lowlying countries like bangladesh the coming deluge presents an existential threat funk visits the front lines of the melt the drought and the deluge to make a human accounting of the booming business of global warming by letting climate change continue unchecked we are choosing to adapt to a warming world containing the resulting surge will be big business some will benefit but much of the planet will suffer mckenzie funk has investigated both sides and what he has found will shock us all to understand how the world is preparing to warm windfall follows the money,Global_warming
