,TITLE,AUTHOR,PUBLISHER,DESCRIPTION,Label
0,Building a Resilient Tomorrow,Alice C. Hill & Leonardo Martinez-Diaz,"Oxford University Press, USA",even under the most optimist scenario signific global climat chang is now inevit while squar confront the scale of the risk we face build a resili tomorrow present replic sustain success and clearcut polici recommend that can improv the climat resili of commun in the us and beyond,climate_disruption
1,The End of Ice,Dahr Jamail,~Publisher not available~,a firsthand chronicl of the catastroph realiti of our planet chang ecosystem and the necess of relish thi vulner fragil earth while we still can,climate_disruption
2,Critical Perspectives on Climate Disruption,Robert Chehoski,"The Rosen Publishing Group, Inc",primari and secondari sourc document discuss the evolut of climat chang effect of global warm how global warm may alter agricultur and industri the role of govern in prevent climat chang,climate_disruption
3,Transformational Resilience,Bob Doppelt,Greenleaf,thi book call on all climat program to expand beyond emiss reduct and physic adapt to focu on assist individu and group to learn skill to use the advers caus by climat chang to learn grow and flourish it urg mental health educ and faith leader to expand beyond post crisistreat to emphas build prevent person and psychosoci resili skill failur to proactiv help peopl deal construct with the harm mental health and psychosoci impact of climat disrupt will serious impair the safeti and health of individu as well as the secur and social wellb of organ commun and whole societi for gener to come it will also delay or complet block effort to reduc the impact of climat disrupt to manag level doppelt begin by describ how natur human psychobiolog reaction to the trauma and toxic stress gener by climat disrupt damag the psycholog emot and social wellb of individu organ commun and whole societi use numer exampl includ hi own organ transform resili program the author describ method and skill that may be use to build capac within all level of societi to avoid self and social harm reaction and use the trauma of climat chang as catalyst to find new mean direct and hope in life use the author extens experi of advis public privat and nonprofit sector on use behavior and system chang knowledg and tool thi book appli an import new perspect to the question of how to success respond to climat chang,climate_disruption
4,Developing Practical Measures to Prevent Climate Disruption,Robert Goble & Gordon Thompson,~Publisher not available~,descript not avail,climate_disruption
5,Drawdown,Paul Hawken,Penguin,new york time bestsel the most substant solut to revers global warm base on meticul research by lead scientist and policymak around the world at thi point in time the drawdown book is exactli what is need a credibl conserv solutionbysolut narr that we can do it read it is an effect inocul against the widespread percept of doom that human cannot and will not solv the climat crisi report byeffect includ increas determin and a sens of ground hope per espen stokn author what we think about when we tri not to think about global warm there been no real way for ordinari peopl to get an understand of what they can do and what impact it can have there remain no singl comprehens reliabl compendium of carbonreduct solut across sector at least until now the public is hungri for thi kind of practic wisdom david robert vox thi is the ideal environment scienc textbookonli it is too interest and inspir to be call a textbook peter kareiva director of the institut of the environ and sustain ucla in the face of widespread fear and apathi an intern coalit of research profession and scientist have come togeth to offer a set of realist and bold solut to climat chang one hundr techniqu and practic are describ heresom are well known some you may have never heard of they rang from clean energi to educ girl in lowerincom countri to land use practic that pull carbon out of the air the solut exist are econom viabl and commun throughout the world are current enact them with skill and determin if deploy collect on a global scale over the next thirti year they repres a credibl path forward not just to slow the earth warm but to reach drawdown that point in time when greenhous gase in the atmospher peak and begin to declin these measur promis cascad benefit to human health secur prosper and wellbeinggiv us everi reason to see thi planetari crisi as an opportun to creat a just and livabl world,climate_disruption
6,Climate Change (A Ladybird Expert Book),HRH The Prince of Wales & Tony Juniper & Emily Shuckburgh,Penguin UK,part of the new ladybird expert seri climat chang is a clear simpl and enlighten introduct to one of the most import issu face our world today from hrh the princ of wale environmentalist toni junip and climat scientist dr emili shuckburgh it explain the histori danger and challeng of global warm and explor possibl solut with which to reduc it impact youll learn about the caus and consequ of climat disrupt heatwav flood and other extrem weather disappear wildlif acid ocean the benefit of limit warm sustain farm new clean technolog and the circular economi written by the lead light and most outstand commun in their field the ladybird expert book provid clear access and authorit introduct to subject drawn from scienc histori and cultur other book current avail in the ladybird expert seri includ quantum mechan evolut for an adult readership the ladybird expert seri is produc in the same icon small hardback format pioneer by the origin ladybird each beauti illustr book featur the first new illustr produc in the origin ladybird style for nearli forti year,climate_disruption
7,Resilience to Climate Change,Candice Howarth,Springer,the frequenc and intens of climat shock such as heatwav and flood are expect to increas under a chang climat with sever implic across the food energi water environ nexu thi book critic explor how to improv resili to climat shock by examin the rang of challeng and opportun that exist in the aftermath of shock and discuss factor that exacerb and mitig these it innov discuss the import of embed commun collabor and coproduct within resiliencebuild across sector and stakehold do so with polici practition and scientif commun candic howarth argu can pave the way to overcom challeng that emerg from climat shock and facilit the codesign of sustain robust and resili respons,climate_disruption
8,How to Change Minds about Our Changing Climate,Seth B. Darling & Douglas L. Sisterson,The Experiment,the book to spark action on the defin challeng of our time in our posttruth world there onli one place to turn to if we want to live in realiti scienc and the research on climat chang is clear it real it threaten us all and human activ is the primari caus thi essenti handbook dismantl all the most pernici misunderstand spread by denier and replac them with the truth face with an imperil planet that we must urgent work to save we dont have time for anyth els,climate_disruption
9,What We Think About When We Try Not To Think About Global Warming,Per Espen Stoknes,Chelsea Green Publishing,today about percent of scientist affirm that climat chang is human made and about percent still question it despit that overwhelm major though about half the popul of rich countri like our choos to believ the percent and paradox thi larg camp of denier grow even larger as more and more alarm proof of climat chang ha crop up over the last decad thi disconnect ha both climat scientist and activist scratch their head grow anxiou and respond usual by repeat more fact to win the argument but the more climat fact pile up the greater the resist to them grow and the harder it becom to enact measur to reduc greenhous ga emiss and prepar commun for the inevit chang ahead is human up to the task it is a that start say psychologist and climat expert per espen stokn from an inadequ understand of the way most human think act and live in the world around them with dozen of exampl he show how to retel the stori of climat chang and appli commun strategi more fit for the taskpublish descript,climate_disruption
10,The Climate Pandemic,Dennis Meredith,~Publisher not available~,much of what you have been told about climat disrupt are myth the most comprehens book on climat disrupt the climat pandem reveal whi current plan to limit global heat rise will not avoid climat catastroph renew energi will not offer a major clean energi sourc decarbon our energi system is a delus and final the human speci will not surviv the assault of climat disrupt the book detail the scienc technolog polit econom and psycholog that govern our climat futur it explor the mechan of climatedriven heat wave megadrought wildfir forest declin and superstorm the human impact of global heat and climat disrupt includ increas toxic and diseas famin migrat conflict and polit collaps whi the media scientist environmentalist corpor and politician have fail to provid solut and the shortcom of the pari agreement renew energi carbon captur and geoengin,climate_disruption
11,Climate Change,Suhaib A. Bandh,Springer Nature,begin in the second half of the twentieth centuri the impact of climat chang have been fierc caus loss of human life and irrepar destruct to natur and manmad infrastructur in mani part of the world the differ between climat chang now and in the past is that of sudden and disproportion disrupt of the natur energi dynam by the chang consumpt pattern of billion of human be who have pollut terrestri and aquat ecosystem the pictur that emerg from the exhaust analysi of intern data drawn from the most reliabl sourc indic that we have possibl gain access to the gateway of extinct and it is time that we take correct step immedi global climat chang is further alter our relationship with the environ modifi rel stabl climat factor and make them uncertain unpredict and threaten chang in land use and an increas demand for water resourc due to climat chang have affect the capac of ecosystem to sustain food product ensur the suppli of freshwat resourc provid ecosystem servic and promot rural multifunction ensur food product doe not just depend on increas water effici promot climat resili crop product or reduc landus competit for urban but also on a more suitabl and stabl climat as the chang in climat factor like precipit temperatur radiat evapor and wind bring about some major shift in global food suppli accord to special report on emiss scenario sre focus on greenhous ga emiss project and repres concentr pathway rcp conduct by the intergovernment panel on climat chang ipcc climat chang increas the risk of simultan crop failur includ corn rice legum and veget if irrig system are not fulli adapt to water stress situat a chang climat could have mani advers impact on other sector of our environ thi book offer concret uptod and appropri studi cum research materi for student research academician and policymak it will be of a greater interest to student and research in the field of environment scienc agricultur scienc agronomi and sustain develop,climate_disruption
12,Storming the Wall,Todd Miller,City Lights Books,recipi of the izzi award for excel in investig journal everi so often a book come along that can dramat chang or elev one think about a global problem much like naomi klein book todd miller storm the wall is such a book and deserv far more attent and discussionizzi award judg ithaca colleg a galvan forecast of global warm endgam and a power indict of america current stancekirku review as global warm acceler drought last longer flood rise higher and superstorm becom more frequent with increas number of peopl on the move as a result the busi of contain thembord fortificationi boom in storm the wall todd miller travel around the world to connect the dot between climateravag commun the corpor cash in on border militar and emerg movement for environment justic and sustain report from the flashpoint of climat clash and from like site of futur battl miller chronicl a grow system of militar divis between the rich and the poor the environment secur and the environment expos stori of crisi greed and violenc are juxtapos with power exampl of solidar and hope in thi urgent and time messag from the frontlin of the postpari agreement era todd miller write about the border have appear in the new york time tom dispatch and mani other place prais for storm the wall noth will test human institut like climat chang in thi centurya thi book make crystal clear peopl on the move from rise water spread desert and endless storm could profoundli destabil our civil unless we seiz the chanc to reimagin our relationship to each other thi is no drill but it is a test and it will be grade passfailbil mckibben author eaarth make a life on a tough new planet as todd miller show in thi import and harrow book climatedriven migrat is set to becom one of the defin issu of our time thi is a mustread bookchristian parenti john jay colleg of crimin justic author of tropic of chao climat chang and the new geographi of violenc todd miller report from the crack in the wall of the global climat secur statemilitar zone design to keep power elit safe from poor and uproot peopl miller find hopehop that may not surviv in trumpworldmolli molloy research librarian for latin america and the border at new mexico state univers and creator of frontera list miller deliv a prescient and sober view of our increasingli dystopian planet as the impact of humancaus climat disrupt continu to intensifydahr jamail awardwin independ journalist author of the end of ice todd miller import book chronicl how exist dispar in wealth and power combin with the dramat chang we are caus in thi planet ecosystem mean either we come togeth around our common human or forfeit the right to call ourselv fulli humanrobert jensen author of the end of patriarchi plain radic and argu for our live,climate_disruption
13,Teaching Climate Change in Literary and Cultural Studies,Shane Hall & Stephanie LeMenager & Stephen Siperstein,Routledge,climat chang is an enorm and increasingli urgent issu thi import book highlight how human disciplin can mobil the creativ and critic power of student teacher and commun to confront climat chang the book is divid into four clear section to help reader integr climat chang into the class and topic they are alreadi teach as well as engag with interdisciplinari method and techniqu teach climat chang in the human constitut a map and toolkit for anyon who wish to draw upon the strength of literari and cultur studi to teach valuabl lesson that engag with climat chang,climate_disruption
14,Climate Change,Joseph J. Romm,Oxford University Press,thi book offer the most uptod examin of climat chang foundat scienc implic for our futur and clean energi solut that can mitig it effectsback cover,climate_disruption
15,Climate Change (A Ladybird Expert Book),HRH The Prince of Wales & Tony Juniper & Emily Schuckburgh,National Geographic Books,what is climat chang how doe it work learn from the expert in the allnew ladybird expert seri learn about one of the most import issu face our world today in thi clear simpl and enlighten introduct from hrh the princ of wale environmentalist toni junip and climat scientist dr emili shuckburgh it explain the histori danger and challeng of global warm and explor possibl solut with which to reduc it impact youll learn about the caus and consequ of climat disrupt heatwav flood and other extrem weather disappear wildlif acid ocean the benefit of limit warm sustain farm new clean technolog the circular economi learn about other topic in the ladybird expert seri includ graviti quantum physic climat chang and evolut written by the lead light and most outstand commun in their field the ladybird expert book provid clear access and authorit introduct to subject drawn from scienc histori and cultur for an adult readership the ladybird expert seri is produc in the same icon small hardback format pioneer by the origin ladybird each beauti illustr book featur the first new illustr produc in the origin ladybird style for nearli forti year,climate_disruption
16,"Carbon Criminals, Climate Crimes",Ronald C. Kramer,Rutgers University Press,choic outstand academ titl carbon crimin climat crime analyz the loom threat pose by climat chang from a criminolog perspect it advanc the field of green criminolog through a examin of the crimin natur of catastroph environment harm result from the releas of greenhous gase the book describ and explain what corpor in the fossil fuel industri the us govern and the intern polit commun did or fail to do in relat to global warm carbon crimin climat crime integr research and theori from a wide varieti of disciplin to analyz four specif statecorpor climat crime continu extract of fossil fuel and rise carbon emiss polit omiss failur relat to the mitig of these emiss social organ climat chang denial and climat crime of empir which includ militarist form of adapt to climat disrupt the final chapter review polici that could mitig greenhous ga emiss adapt to a warm world and achiev climat justic,climate_disruption
17,Climate Change and the Crisis of Capitalism,Mark Pelling & David Manuel-Navarrete & M. R. Redclift,Routledge,are establish econom social and polit practic capabl of deal with the combin contemporari crisi of climat chang and econom disrupt will fall back on those wisdom that have prefigur crise help identifi way forward or simpli reconfigur risk so that it might reappear in anoth guis in the futur thi volum argu that the combin of global environment chang and global econom restructur requir a rethink of the prioriti process and underli valu that shape contemporari develop aspir and polici if your interest in get to the bottom of whi we are kill thi beauti planet of our and find out the way in which we can fight thi unfortun tendenc of our speci then pleas have a go you might like it manchest climat monthli,climate_disruption
18,Transformational Resilience,Bob Doppelt,Routledge,use the author extens experi of advis public privat and nonprofit sector on person organ and commun behavior and system chang knowledg and tool thi book appli a new len to the question of how to respond to climat chang it offer a scientif rigor understand of the neg mental health and psychosoci impact of climat chang and argu that overlook these issu will have veri damag consequ the practic assess of variou method to build human resili offer by transform resili then make a power case for the need to quickli expand beyond emiss reduct and harden physic infrastructur to enhanc the capac of individu and group to cope with the inevit chang affect all level of societyappli a traumainform mental health and psychosoci perspect transform resili offer a groundbreak approach to respond to climat disrupt the book describ how climat disrupt traumat societi and how effect respons can catalyz posit learn growth and chang,climate_disruption
19,Requiem for a Species,Clive Hamilton,Routledge,first publish in routledg is an imprint of taylor franci an informa compani,climate_disruption
20,The Great Disruption,Paul Gilding,A&C Black,it time to stop just worri about climat chang say paul gild instead we need to brace for impact becaus global crisi is no longer avoid the great disrupt start in with spike food and oil price and dramat ecolog chang like the melt polar icecap it is not simpli about fossil fuel and carbon footprint we have come to the end of econom growth version a world economi base on consumpt and wast where we live beyond the mean of our planet ecosystem and resourc the great disrupt offer a stark and unflinch look at the challeng human face yet also a deepli optimist messag the come decad will see loss suffer and conflict as our planetari overdraft is paid howev they will also bring out the best human can offer compass innov resili and adapt gild tell us how to fight and win what he call the one degre war to prevent catastroph warm of the earth and how to start today the crisi we are in repres a rare chanc to replac our addict to growth with an ethic of sustain and it alreadi happen it also an unmatch busi opportun old industri will collaps while new compani liter reshap our economi in the aftermath of the great disrupt we will measur growth in a new way it will mean not quantiti of stuff but qualiti and happi of life and ye there is life after shop the great disrupt is an invigor and wellinform polem by an advoc for sustain and climat chang who ha dedic hi life to campaign for a balanc use of earth limit resourc it is essenti read,climate_disruption
21,A Farmer's Guide to Climate Disruption,Rebekah L Fraser,~Publisher not available~,product yield pest diseas pressur food qualiti and popul are all aspect of food secur be affect by climat disrupt accord to current project the global popul will be percent higher in becaus of thi and anticip dietari chang grower will need to produc percent more food annual by without expand the land base what can you do includ interview with some of the world top research in the field of agricultur a farmer guid to climat disrupt includ interview with some of the world top research in the field of agricultur and provid insight into how you can thrive in the chang climat by use produc grow method that stem the tide of climat chang while regener your land,climate_disruption
22,The Second Media Age,Mark Poster,John Wiley & Sons,thi book examin the implic of new commun technolog in the light of the most recent work in social and cultur theori and argu that new develop in electron media such as the internet and virtual realiti justifi the design of a second media age,climate_disruption
23,Climate Psychology,Paul Hoggett,Springer,thi book investig the psychosoci phenomenon which is societi failur to respond to climat chang it analys the nonrat dimens of our collect paralysi in the face of worsen climat chang and environment destruct explor the emot ethic social organiz and cultur dynam to blame for thi global lack of action the book featur eleven research project from four differ countri and is divid in two part the first highlight novel methodolog the second present new find contributor to the first part show how a deep listen approach to research can reveal the anxieti tension contradict frame and narr that contribut to peopl experi and the mani way climat chang and other environment risk are imagin through metaphor imageri and dream use detail interview extract drawn from politician scientist and activist as well as ordinari peopl the second part of the book examin the mani differ way in which we both avoid and squar up to thi gather disast and the mani face of alarm outrag denial and indiffer thi involv,climate_disruption
24,Unprecedented Crime,Dr. Peter D. Carter & Elizabeth Woodworth,SCB Distributors,in the heat wave extrem wild fire and flood around the world confirm beyond doubt that climat disrupt is now a fullblown emerg we have enter churchil period of consequ yet govern have simpli watch the disast magnifi while rush ahead with new pipelin and annual trillion in fossil fuel subsidi govern simpli cannot say they did not know the event we are see today have been consist forecast ever sinc the first assess by the intergovernment panel on climat chang which wa sign by all govern back in which the lancet ha describ as the best research project ever design unpreced crime first lay out the culpabl of government polit and religi bodi corpor and the media through their failur to report or act on the climat emerg no emerg respons ha even been contempl by wealthi highemit nation govern extrem weather report never even hint at the need to address climat chang it then report how independ of govern score of proven zerocarbon game changer have been come onlin all over the world these excit technolog describ in the book are now abl to power both household electr and energydens heavi industri we alreadi have the technic solut to the problem with these solut we can act in time to reduc greenhous ga emiss to nearzero within year these will crime against life itself by neglig govern oblivi media and an insouci civil societi are crime that everyday citizen can nonetheless readili grasp and then take to the street and to the court to protest on behalf of their children and grandchildren thi thoroughli research and highlydocu book will show them how,climate_disruption
25,"Climate Change, Literature, and Environmental Justice",Janet Fiskio,Cambridge University Press,introduct fear of a black planet ecotopia and eugen in climat narr ghost and repar map and memori bodi tell stori mourn and hospit after katrina round danc and resist slow insurrect dissent collect voic and social care cannib spirit and sacr seed epilogu everyday microutopia,climate_disruption
