TITLE,AUTHOR,PUBLISHER,DESCRIPTION,Label
Building a Resilient Tomorrow,Alice C. Hill & Leonardo Martinez-Diaz,"Oxford University Press, USA",even under the most optimistic scenarios significant global climate change is now inevitable while squarely confronting the scale of the risks we face building a resilient tomorrow presents replicable sustainability successes and clearcut policy recommendations that can improve the climate resilience of communities in the us and beyond,climate_disruption
The End of Ice,Dahr Jamail,Publisher not available~,a firsthand chronicle of the catastrophic reality of our planets changing ecosystems and the necessity of relishing this vulnerable fragile earth while we still can,climate_disruption
Critical Perspectives on Climate Disruption,Robert Chehoski,"The Rosen Publishing Group, Inc",primary and secondary source documents discuss the evolution of climate change effects of global warming how global warming may alter agriculture and industry the role of governments in preventing climate change,climate_disruption
Transformational Resilience,Bob Doppelt,Greenleaf,this book calls on all climate programs to expand beyond emission reductions and physical adaption to focus on assisting individuals and groups to learn skills to use the adversities caused by climate change to learn grow and flourish it urges mental health education and faith leaders to expand beyond post crisistreatment to emphasize building preventative personal and psychosocial resilience skills failure to proactively help people deal constructively with the harmful mental health and psychosocial impacts of climate disruption will seriously impair the safety and health of individuals as well as the security and social wellbeing of organizations communities and whole societies for generations to come it will also delay or completely block efforts to reduce the impacts of climate disruption to manageable levels doppelt begins by describing how natural human psychobiological reactions to the traumas and toxic stresses generated by climate disruption damage the psychological emotional and social wellbeing of individuals organizations communities and whole societies using numerous examples including his own organizations transformational resilience program the author describes methods and skills that may be used to build capacity within all levels of societies to avoid self and socially harmful reactions and use the traumas of climate change as catalysts to find new meaning direction and hope in life using the authors extensive experience of advising public private and nonprofit sectors on using behavioral and systems change knowledge and tools this book applies an important new perspective to the question of how to successfully respond to climate change,climate_disruption
Developing Practical Measures to Prevent Climate Disruption,Robert Goble & Gordon Thompson,Publisher not available~,description not available,climate_disruption
Drawdown,Paul Hawken,Penguin, new york times bestseller  the  most substantive solutions to reverse global warming based on meticulous research by leading scientists and policymakers around the world at this point in time the drawdown book is exactly what is needed a credible conservative solutionbysolution narrative that we can do it reading it is an effective inoculation against the widespread perception of doom that humanity cannot and will not solve the climate crisis reported byeffects include increased determination and a sense of grounded hope per espen stoknes author what we think about when we try not to think about global warming theres been no real way for ordinary people to get an understanding of what they can do and what impact it can have there remains no single comprehensive reliable compendium of carbonreduction solutions across sectors at least until now    the public is hungry for this kind of practical wisdom david roberts vox this is the ideal environmental sciences textbookonly it is too interesting and inspiring to be called a textbook peter kareiva director of the institute of the environment and sustainability ucla in the face of widespread fear and apathy an international coalition of researchers professionals and scientists have come together to offer a set of realistic and bold solutions to climate change one hundred techniques and practices are described heresome are well known some you may have never heard of they range from clean energy to educating girls in lowerincome countries to land use practices that pull carbon out of the air the solutions exist are economically viable and communities throughout the world are currently enacting them with skill and determination if deployed collectively on a global scale over the next thirty years they represent a credible path forward not just to slow the earths warming but to reach drawdown that point in time when greenhouse gases in the atmosphere peak and begin to decline these measures promise cascading benefits to human health security prosperity and wellbeinggiving us every reason to see this planetary crisis as an opportunity to create a just and livable world,climate_disruption
Climate Change (A Ladybird Expert Book),HRH The Prince of Wales & Tony Juniper & Emily Shuckburgh,Penguin UK,part of the new ladybird expert series climate change is a clear simple and enlightening introduction to one of the most important issues facing our world today from hrh the prince of wales environmentalist tony juniper and climate scientist dr emily shuckburgh it explains the history dangers and challenges of global warming and explores possible solutions with which to reduce its impact youll learn about the causes and consequences of climate disruption heatwaves floods and other extreme weather disappearing wildlife acid oceans the benefits of limiting warming sustainable farming new clean technologies and the circular economy written by the leading lights and most outstanding communicators in their fields the ladybird expert books provide clear accessible and authoritative introductions to subjects drawn from science history and culture other books currently available in the ladybird expert series include  quantum mechanics  evolution for an adult readership the ladybird expert series is produced in the same iconic small hardback format pioneered by the original ladybirds each beautifully illustrated book features the first new illustrations produced in the original ladybird style for nearly forty years,climate_disruption
Resilience to Climate Change,Candice Howarth,Springer,the frequency and intensity of climate shocks such as heatwaves and flooding are expected to increase under a changing climate with severe implications across the food energy water environment nexus this book critically explores how to improve resilience to climate shocks by examining the range of challenges and opportunities that exist in the aftermath of shocks and discusses factors that exacerbate and mitigate these it innovatively discusses the importance of embedding communication collaboration and coproduction within resiliencebuilding across sectors and stakeholders doing so with policy practitioner and scientific communities candice howarth argues can pave the way to overcome challenges that emerge from climate shocks and facilitate the codesign of sustainable robust and resilient responses,climate_disruption
How to Change Minds about Our Changing Climate,Seth B. Darling & Douglas L. Sisterson,The Experiment,the book to spark action on the defining challenge of our time in our posttruth world theres only one place to turn to if we want to live in reality science and the research on climate change is clear its real it threatens us all and human activity is the primary cause this essential handbook dismantles all the most pernicious misunderstandings spread by deniers and replaces them with the truth faced with an imperiled planet that we must urgently work to save we dont have time for anything else,climate_disruption
What We Think About When We Try Not To Think About Global Warming,Per Espen Stoknes,Chelsea Green Publishing,today about  percent of scientists affirm that climate change is human made and about  percent still question it despite that overwhelming majority though about half the population of rich countries like ours choose to believe the  percent and paradoxically this large camp of deniers grows even larger as more and more alarming proof of climate change has cropped up over the last decades this disconnect has both climate scientists and activists scratching their heads growing anxious and responding usually by repeating more facts to win the argument but the more climate facts pile up the greater the resistance to them grows and the harder it becomes to enact measures to reduce greenhouse gas emissions and prepare communities for the inevitable change ahead is humanity up to the task it is a  that starts says psychologist and climate expert per espen stoknes from an inadequate understanding of the way most humans think act and live in the world around them with dozens of examples he shows how to retell the story of climate change and apply communication strategies more fit for the taskpublishers description,climate_disruption
The Climate Pandemic,Dennis Meredith,Publisher not available~,much of what you have been told about climate disruption are myths the most comprehensive book on climate disruption the climate pandemic reveals why current plans to limit global heating rise will not avoid climate catastrophe renewable energy will not offer a major clean energy source decarbonizing our energy system is a delusion and finally the human species will not survive the assaults of climate disruption the book details the science technology politics economics and psychology that govern our climate future it explores the mechanisms of climatedriven heat waves megadroughts wildfires forest decline and superstorms the human impacts of global heating and climate disruption including increased toxicity and disease famine migration conflict and political collapse why the media scientists environmentalists corporations and politicians have failed to provide solutions and the shortcomings of the paris agreement renewable energy carbon capture and geoengineering,climate_disruption
Climate Change,Suhaib A. Bandh,Springer Nature,beginning in the second half of the twentieth century the impacts of climate change have been fierce causing loss of human life and irreparable destruction to natural and manmade infrastructure in many parts of the world the difference between climate change now and in the past is that of sudden and disproportionate disruption of the natural energy dynamics by the changing consumption patterns of billions of human beings who have polluted terrestrial and aquatic ecosystems the picture that emerges from the exhaustive analysis of international data drawn from the most reliable sources indicates that we have possibly gained access to the gateway of extinction and it is time that we take corrective steps immediately global climate change is further altering our relationship with the environment modifying relatively stable climatic factors and making them uncertain unpredictable and threatening changes in land use and an increasing demand for water resources due to climate change have affected the capacity of ecosystems to sustain food production ensure the supply of freshwater resources provide ecosystem services and promote rural multifunctionality ensuring food production does not just depend on increasing water efficiency promoting climate resilient crop production or reducing landuse competition for urbanization but also on a more suitable and stable climate as the changes in climatic factors like precipitation temperature radiation evaporation and wind bring about some major shifts in global food supplies according to special report on emission scenarios sres focused on greenhouse gas emissions projections and representative concentration pathways rcps conducted by the intergovernmental panel on climate change ipcc climate change increases the risk of simultaneous crop failures including corn rice legumes and vegetables if irrigation systems are not fully adapted to water stress situations a changing climate could have many adverse impacts on other sectors of our environment this book offers concrete uptodate and appropriate study cum research material for students researchers academicians and policymakers it will be of a greater interest to students and researchers in the field of environmental science agriculture science agronomy and sustainable development,climate_disruption
Storming the Wall,Todd Miller,City Lights Books,recipient of the  izzy award for excellence in investigative journalism every so often a book comes along that can dramatically change or elevate ones thinking about a global problem much like naomi kleins books todd millers storming the wall is such a book and deserves far more attention and discussionizzy award judges ithaca college  a galvanizing forecast of global warmings endgame and a powerful indictment of americas current stancekirkus reviews as global warming accelerates droughts last longer floods rise higher and superstorms become more frequent with increasing numbers of people on the move as a result the business of containing themborder fortificationis booming in storming the wall todd miller travels around the world to connect the dots between climateravaged communities the corporations cashing in on border militarization and emerging movements for environmental justice and sustainability reporting from the flashpoints of climate clashes and from likely sites of futures battles miller chronicles a growing system of militarized divisions between the rich and the poor the environmentally secure and the environmentally exposed stories of crisis greed and violence are juxtaposed with powerful examples of solidarity and hope in this urgent and timely message from the frontlines of the postparis agreement era todd millers writings about the border have appeared in the new york times tom dispatch and many other places praise for storming the wall nothing will test human institutions like climate change in this centuryas this book makes crystal clear people on the move from rising waters spreading deserts and endless storms could profoundly destabilize our civilizations unless we seize the chance to reimagine our relationships to each other this is no drill but it is a test and it will be graded passfailbill mckibben author eaarth making a life on a tough new planet as todd miller shows in this important and harrowing book climatedriven migration is set to become one of the defining issues of our time this is a mustread bookchristian parenti john jay college of criminal justice author of tropic of chaos climate change and the new geography of violence todd miller reports from the cracks in the walls of the global climate security statemilitarized zones designed to keep powerful elites safe from poor and uprooted peoples miller finds hopehope that may not survive in trumpworldmolly molloy research librarian for latin america and the border at new mexico state university and creator of frontera list miller delivers a prescient and sober view of our increasingly dystopian planet as the impacts of humancaused climate disruption continue to intensifydahr jamail awardwinning independent journalist author of the end of ice todd millers important book chronicles how existing disparities in wealth and power combined with the dramatic changes we are causing in this planets ecosystems mean either we come together around our common humanity or forfeit the right to call ourselves fully humanrobert jensen author of the end of patriarchy plain radical and arguing for our lives,climate_disruption
Teaching Climate Change in Literary and Cultural Studies,Shane Hall & Stephanie LeMenager & Stephen Siperstein,Routledge,climate change is an enormous and increasingly urgent issue this important book highlights how humanities disciplines can mobilize the creative and critical power of students teachers and communities to confront climate change the book is divided into four clear sections to help readers integrate climate change into the classes and topics they are already teaching as well as engage with interdisciplinary methods and techniques teaching climate change in the humanities constitutes a map and toolkit for anyone who wishes to draw upon the strengths of literary and cultural studies to teach valuable lessons that engage with climate change,climate_disruption
Climate Change,Joseph J. Romm,Oxford University Press,this book offers the most uptodate examination of climate changes foundational science implications for our future and clean energy solutions that can mitigate its effectsback cover,climate_disruption
Climate Change (A Ladybird Expert Book),HRH The Prince of Wales & Tony Juniper & Emily Schuckburgh,National Geographic Books,what is climate change how does it work learn from the experts in the allnew ladybird expert series learn about one of the most important issues facing our world today in this clear simple and enlightening introduction from hrh the prince of wales environmentalist tony juniper and climate scientist dr emily shuckburgh it explains the history dangers and challenges of global warming and explores possible solutions with which to reduce its impact youll learn about     the causes and consequences of climate disruption  heatwaves floods and other extreme weather  disappearing wildlife  acid oceans  the benefits of limiting warming  sustainable farming  new clean technologies  the circular economy learn about other topics in the ladybird experts series including gravity quantum physics climate change and evolution written by the leading lights and most outstanding communicators in their fields the ladybird expert books provide clear accessible and authoritative introductions to subjects drawn from science history and culture for an adult readership the ladybird expert series is produced in the same iconic small hardback format pioneered by the original ladybirds each beautifully illustrated book features the first new illustrations produced in the original ladybird style for nearly forty years,climate_disruption
"Carbon Criminals, Climate Crimes",Ronald C. Kramer,Rutgers University Press, choice outstanding academic title carbon criminals climate crimes analyzes the looming threats posed by climate change from a criminological perspective it advances the field of green criminology through a examination of the criminal nature of catastrophic environmental harms resulting from the release of greenhouse gases the book describes and explains what corporations in the fossil fuel industry the us government and the international political community did or failed to do in relation to global warming carbon criminals climate crimes integrates research and theory from a wide variety of disciplines to analyze four specific statecorporate climate crimes continued extraction of fossil fuels and rising carbon emissions political omission failure related to the mitigation of these emissions socially organized climate change denial and climate crimes of empire which include militaristic forms of adaptation to climate disruption the final chapter reviews policies that could mitigate greenhouse gas emissions adapt to a warming world and achieve climate justice,climate_disruption
Climate Change and the Crisis of Capitalism,Mark Pelling & David Manuel-Navarrete & M. R. Redclift,Routledge,are established economic social and political practices capable of dealing with the combined contemporary crisis of climate change and economic disruption will falling back on those wisdoms that have prefigured crises help identify ways forward or simply reconfigure risk so that it might reappear in another guise in the future this volume argues that the combination of global environmental change and global economic restructuring require a rethinking of the priorities processes and underlying values that shape contemporary development aspirations and policy if youre interested in getting to the bottom of why we are killing this beautiful planet of ours and finding out the ways in which we can fight this unfortunate tendency of our species then please have a go you might like it  manchester climate monthly,climate_disruption
Transformational Resilience,Bob Doppelt,Routledge,using the authors extensive experience of advising public private and nonprofit sectors on personal organization and community behavioral and systems change knowledge and tools this book applies a new lens to the question of how to respond to climate change it offers a scientifically rigorous understanding of the negative mental health and psychosocial impacts of climate change and argues that overlooking these issues will have very damaging consequences the practical assessment of various methods to build human resilience offered by transformational resilience then makes a powerful case for the need to quickly expand beyond emission reductions and hardening physical infrastructure to enhance the capacity of individuals and groups to cope with the inevitable changes affecting all levels of societyapplying a traumainformed mental health and psychosocial perspective transformational resilience offers a groundbreaking approach to responding to climate disruption the book describes how climate disruption traumatizes societies and how effective responses can catalyze positive learning growth and change,climate_disruption
Requiem for a Species,Clive Hamilton,Routledge,first published in  routledge is an imprint of taylor  francis an informa company,climate_disruption
The Great Disruption,Paul Gilding,A&C Black,its time to stop just worrying about climate change says paul gilding instead we need to brace for impact because global crisis is no longer avoidable the great disruption started in  with spiking food and oil prices and dramatic ecological change like the melting polar icecap it is not simply about fossil fuels and carbon footprints we have come to the end of economic growth version  a world economy based on consumption and waste where we lived beyond the means of our planets ecosystems and resources the great disruption offers a stark and unflinching look at the challenge humanity faces  yet also a deeply optimistic message the coming decades will see loss suffering and conflict as our planetary overdraft is paid however they will also bring out the best humanity can offer compassion innovation resilience and adaptability gilding tells us how to fight and win what he calls the one degree war to prevent catastrophic warming of the earth and how to start today the crisis we are in represents a rare chance to replace our addiction to growth with an ethic of sustainability and its already happening its also an unmatched business opportunity old industries will collapse while new companies literally reshape our economy in the aftermath of the great disruption we will measure growth in a new way it will mean not quantity of stuff but quality and happiness of life and yes there is life after shopping the great disruption is an invigorating and wellinformed polemic by an advocate for sustainability and climate change who has dedicated his life to campaigning for a balanced use of earths limited resources it is essential reading,climate_disruption
A Farmer's Guide to Climate Disruption,Rebekah L Fraser,Publisher not available~,production  yield pest  disease pressure food quality and population are all aspects of food security being affected by climate disruption according to current projections the global population will be  percent higher in  because of this and anticipated dietary changes growers will need to produce  percent more food annually by  without expanding the land base what can you do including interviews with some of the worlds top researchers in the field of agriculture a farmers guide to climate disruption includes interviews with some of the worlds top researchers in the field of agriculture and provides insight into how you can thrive in the changing climate by using produce growing methods that stem the tide of climate change while regenerating your land,climate_disruption
The Second Media Age,Mark Poster,John Wiley & Sons,this book examines the implications of new communication technologies in the light of the most recent work in social and cultural theory and argues that new developments in electronic media such as the internet and virtual reality justify the designation of a second media age,climate_disruption
Climate Psychology,Paul Hoggett,Springer,this book investigates the psychosocial phenomenon which is societys failure to respond to climate change it analyses the nonrational dimensions of our collective paralysis in the face of worsening climate change and environmental destruction exploring the emotional ethical social organizational and cultural dynamics to blame for this global lack of action the book features eleven research projects from four different countries and is divided in two parts the first highlighting novel methodologies the second presenting new findings contributors to the first part show how a deep listening approach to research can reveal the anxieties tensions contradictions frames and narratives that contribute to peoples experiences and the many ways climate change and other environmental risks are imagined through metaphor imagery and dreams using detailed interview extracts drawn from politicians scientists and activists as well as ordinary people the second part of the book examines the many different ways in which we both avoid and square up to this gathering disaster and the many faces of alarm outrage denial and indifference this involves,climate_disruption
