TITLE,AUTHOR,PUBLISHER,DESCRIPTION,Label
Loss and Damage from Climate Change,Reinhard Mechler & Laurens M. Bouwer & Thomas Schinko & Swenja Surminski & JoAnne Linnerooth-Bayer,Springer,this book provides an authoritative insight on the loss and damage discourse by highlighting stateoftheart research and policy linked to this discourse and articulating its multiple concepts principles and methods written by leading researchers and practitioners it identifies practical and evidencebased policy options to inform the discourse and climate negotiations with climaterelated risks on the rise and impacts being felt around the globe has come the recognition that climate mitigation and adaptation may not be enough to manage the effects from anthropogenic climate change this recognition led to the creation of the warsaw international mechanism on loss and damage in  a climate policy mechanism dedicated to dealing with climaterelated effects in highly vulnerable countries that face severe constraints and limits to adaptation endorsed in  by the paris agreement and effectively considered a third pillar of international climate policy debate and research on loss and damage continues to gain enormous traction yet concepts methods and tools as well as directions for policy and implementation have remained contested and vague suitable for researchers policyadvisors practitioners and the interested public the book furthermore  discusses the political legal economic and institutional dimensions of the issue highlights normative questions central to the discourse  provides a focus on climate risks and climate risk management  presents salient case studies from around the world,Climate_policy
The Cost of Climate Policy,Mark Jaccard & John Nyboer & Bryn Sadownik,UBC Press,reducing greenhouse gas emissions is a major environmental challenge facing the world we all want to reduce the risks of global warming but how much will this cost what will it mean on a personal business or community level and what policy responses should we expect from our governments the cost of climate policy sheds light on these pressing issues using canada as their focal point the authors look specifically at the impact of emission reduction policies on energy prices technology options and lifestyle choices the book concludes with concrete proposals for overcoming the constraints of environmental policy making and the high initial costs of action,Climate_policy
Values in Climate Policy,David Morrow,Rowman & Littlefield Publishers,children born today in the maldives may someday have to abandon their homeland rising seas caused by climate change could swallow most of their tiny island nation within their lifetime their fate symbolizes the double inequity at the heart of climate change those who have contributed the least to climate change will suffer the most from it all is not lost however the scale and impact of climate change depends on the policies that people choose how quickly will we eliminate our greenhouse gas emissions how will we do it who will pay for it what will we protect through adaptation how will we weigh the fortunes of future generations and the natural world against our own answers to questions like these reflect a constellation of value judgments that deserve close scrutiny in addition to providing essential background on the science economics and politics of climate change this book explores the values at stake in climate policy with the aim of shrinking the gap between climate ethics and climate policy,Climate_policy
National Climate Policy,Elin Lerum Boasson,Routledge,failed attempts at producing ambitious global climate commitments and instruments have made it increasingly important for nation states to deliver climate policies this in turn requires a better understanding of national climate policymaking in this book elin lerum boasson develops an innovative and wellgrounded analytical framework for assessing national climatepolicy development why do national climate policies emerge and change this question is underpinned by the role played by different actors and the kind social mechanism at work boasson asks to what extent and how is the emergence and change of climate policy influenced by politicians and the national political fields business and organizational fields eu policy and the european environment social and entrepreneurial mechanisms combining policy studies with sociological new institutionalism and drawing on three climate policy subareas in norway renewable energy lowenergy buildings and carbon capture and storage boasson presents a multifield framework that allows the reader to capture the entire policy cycle explaining policy initiation policy adoption and the longterm social feedback effects resulting from implementation or lack of implementation,Climate_policy
Global Climate Policy,Urs Luterbacher & Detlef F. Sprinz,MIT Press,analyses of the international climate change regime consider the challenges of maintaining current structures and the possibilities for creating new forms of international cooperation the current international climate change regime has a long history and it is likely that its evolution will continue despite such recent setbacks as the decision by president donald trump to withdraw the united states from the paris agreement of  indeed the us withdrawal may spur efforts by other members of the international community to strengthen the paris accord on their own this volume offers an original contribution to the study of the international political context of climate change over the last three decades with fresh analyses of the current international climate change regime that consider both the challenges of maintaining current structures and the possibilities for creating new forms of international cooperation the contributors are leading experts with both academic and policy experience some are advisors to governments and the climate secretariat itself their contributions combine substantive evidence with methodological rigor they discuss such topics as the evolution of the architecture of the climate change regime different theoretical perspectives gametheoretical and computer simulation approaches to modeling outcomes and assessing agreements coordination with other legal regimes nonstate actors developing and emerging countries implementation compliance and effectiveness of agreements and the challenges of climate change mitigation after the paris agreement contributors michael aklin guri bang daniel bodansky thierry brechet lars bruckner frank grundig jon hovi yasuko kameyama urs luterbacher axel michaelowa katharina michaelowa carla norrlof matthew paterson lavanya rajamani tora skodvin detlef f sprinz arild underdal jorge e vinuales hugh ward,Climate_policy
Flexible Mechanisms for an Efficient Climate Policy,Karl L. Brockmann & Marcus Stronzik,Springer Science & Business Media,in the kyoto protocol to the un framework convention on climate change industrialized countries agreed on binding absolute targets for greenhouse gas emissions and on the admission of flexible marketeconomy instruments  such as emissions trading joint implementation and the clean development mechanism  used for reaching the targets the contributions in this volume reveal that flexible instruments can lower the costs of climate protection considerably  not only in theory but also in practice concerning implementation it will be necessary to take care of possible loopholes uncertainties and transaction costs which may be too high if no proper design is chosen,Climate_policy
The Design and Implementation of US Climate Policy,Don Fullerton & Catherine Wolfram,University of Chicago Press,economic research on climate change has been crucial in advancing our understanding of the consequences associated with global warming as well as the costs and benefits of the various policies that might reduce emissions of greenhouse gases as nations work to develop climate policies economic insights into their design and implementation are ever more important with a balance between theoretical and empirical approaches the design and implementation of us climate policy looks at the possible effects of various climate policies on a range of economic outcomes the studies that comprise the volume examine topics that include the coordinationor lack thereofbetween the federal and state governments implications of monitoring and enforcing climate policy and the specific consequences of various climate policies for the agricultural automotive and buildings sectors,Climate_policy
Understanding Environmental Policy,Steven Cohen,Columbia University Press,the first edition of this pragmatic course text emphasized the policy value of a big picture approach to the ethical political technological and scientific economic and management aspects of environmental issues the text then applied this approach to realworld case examples involving leaking underground storage tanks toxic waste cleanup and the effects of global climate change this second edition demonstrates the ongoing effectiveness of this framework to generating meaningful action and policy solutions to todayos urgent environmental issues the text adds case examples concerning congestion taxes ewaste hydrofracking and recent developments in global climate change and updates references and other materials throughout incorporating the political and policy changes of the obama administrationos first term and developments in national and global environmental issues,Climate_policy
Carbon Captured,Matto Mildenberger,MIT Press,a comparative examination of domestic climate politics that offers a theory for crossnational differences in domestic climate policymaking climate change threatens the planet and yet policy responses have varied widely across nations some countries have undertaken ambitious programs to stave off climate disaster others have done little and still others have passed policies that were later rolled back in this book matto mildenberger opens the black box of domestic climate politics examining policy making trajectories in several countries and offering a theoretical explanation for national differences in the climate policy process mildenberger introduces the concept of double representationwhen carbon polluters enjoy political representation on both the left through industrial unions fearful of job loss and the right through industrial business associations fighting policy costsand argues that different climate policy approaches can be explained by the interaction of climate policy preferences and domestic institutions he illustrates his theory with detailed histories of climate politics in norway the united states and australia along with briefer discussions of policies in in germany japan the united kingdom and canada he shows that norway systematically shielded politically connected industrial polluters from costs beginning with its pioneering carbon tax the united states after the failure of carbon reduction legislation finally acted on climate reform through a series of obama administration executive actions and australias labor and green parties enacted an emissions trading scheme which was subsequently repealed by a conservative liberal party government ultimately mildenberger argues for the importance of political considerations in understanding the climate policymaking process and discusses possible future policy directions,Climate_policy
Climate Change and Social Movements,Eugene Nulman,Springer,climate change and social movements is a riveting and thorough exploration of three important campaigns to influence climate change policy in the united kingdom the author delves deep into the campaigns and illuminates the way policymakers think about and respond to social movements,Climate_policy
Neoliberalism and Climate Policy in the United States,Robert MacNeil,Routledge,this book explores how washingtons efforts to act on climate change have been translated under conditions of american neoliberalism where the state struggles to find a stable and legitimate role in the economy and where environmental and industrial policy are enormously contentious topics this original work conceptualizes us climate policy first and foremost as a question of innovation policy with capital accumulation and market domination as its main drivers it argues that us climate policy must be understood in the context of washingtons broader efforts over the past four decades to dominate and monopolize novel hightech markets and its use of immense amounts of state power to achieve this end from this perspective many elements of us climate politics that seem confusing or contradictory actually appear to have an obvious and consistent logic this book will be of particular interest to students and scholars of ipe as well as individuals generally interested in gaining a stronger understanding of us climate politics and policy and the role and influence of neoliberalism on contemporary economic governance,Climate_policy
Climate Change,David G. Victor,Council on Foreign Relations,council on foreign relations this book provides a balanced and comprehensive account of the issues involved in climate change and the range of domestic and foreign policy options available to american policymakers,Climate_policy
Climate Change and Society,Riley E. Dunlap & Robert J. Brulle,"Oxford University Press, USA",climate change is one of todays most important issues presenting an intellectual challenge to the natural and social sciences while there has been progress in natural science understanding of climate change social science research has not been as fully developed this collection of essays breaks new theoretical and empirical ground by presenting climate change as a thoroughly social phenomenon embedded in our institutions and cultural practices,Climate_policy
The Violence of Climate Change,Kevin J. O'Brien,Georgetown University Press,climate change is viewed as a primarily scientific economic or political issue while acknowledging the legitimacy of these perspectives kevin j obrien argues that we should respond to climate change first and foremost as a case of systematic and structural violence global warming is largely caused by the carbon emissions of the affluent emissions that harm the poor first and worst climate change is violence because it divides human beings from one another and from the earth obrien offers a constructive and creative response to this violence through practical examples of activism and nonviolent peacemaking providing brief biographies of five christians in the united statesjohn woolman jane addams dorothy day martin luther king jr and cesar chavez these activists idealism social commitment and political savvy offer lessons of resistance applicable to the struggle against climate change and for social justice,Climate_policy
Climate Change from the Streets,Michael Méndez,Yale University Press,an urgent and timely story of the contentious politics of incorporating environmental justice into global climate change policy although the science of climate change is clear policy decisions about how to respond to its effects remain contentious even when such decisions claim to be guided by objective knowledge they are made and implemented through political institutions and relationshipsand all the competing interests and power struggles that this implies michael mendez tells a timely story of people place and power in the context of climate change and inequality he explores the perspectives and influence lowincome people of color bring to their advocacy work on climate change in california activist groups have galvanized behind issues such as air pollution poverty alleviation and green jobs to advance equitable climate solutions at the local state and global levels arguing that environmental protection and improving public health are inextricably linked mendez contends that we must incorporate local knowledge culture and history into policymaking to fully address the global complexities of climate change and the real threats facing our local communities,Climate_policy
Understanding Climate Change,Sarah L. Burch & Sara E. Harris,University of Toronto Press,the second edition of understanding climate change provides readers with a concise accessible and holistic picture of the climate change problem including both the scientific and human dimensions,Climate_policy
An Introduction to Climate Change Economics and Policy,Felix FitzRoy & Elissaios Papyrakis,Routledge,the  edition of an introduction to climate change economics and policy explains the key scientific economic and policy issues related to climate change in a completely uptodate introduction for anyone interested and students at all levels in various related courses including environmental economics international development geography politics and international relations fitzroy and papyrakis highlight how economists and policymakers often misunderstand the science of climate change underestimate the growing threat to future civilization and survival and exaggerate the costs of radical measures needed to stabilize the climate in contrast they show how direct and indirect costs of fossil fuels particularly the huge health costs of local pollution actually exceed the investment needed for transition to an almost zero carbon economy in two or three decades using available technology,Climate_policy
Farming for Our Future,PETER H.. ROSENBERG LEHNER (NATHAN A.) & Nathan Rosenberg,~Publisher not available~,farming for our future examines the policies and legal reforms necessary to accelerate the adoption of practices that can make agriculture in the united states climateneutral or better these proven practices will also make our food system more resilient to the impacts of climate change agricultures contribution to climate change is substantialmuch more so than official figures suggestand we will not be able to achieve our overall mitigation goals unless agricultural emissions sharply decline fortunately farms and ranches can be a major part of the climate solution while protecting biodiversity strengthening rural communities and improving the lives of the workers who cultivate our crops and rear our animals the importance of agricultural climate solutions can not be underestimated it is a critical element both in ensuring our food security and limiting climate change this book provides essential solutions to address the greatest crises of our time,Climate_policy
Turning Down the Heat,H. Compston & I. Bailey,Springer,this study analyses the politics of climate policy in a range of affluent democracies and at eu level in order to identify political strategies that would make it easier for governments to make major cuts in greenhouse gas emissions without sustaining significant political damage,Climate_policy
The Climate Change Playbook,Dennis Meadows & Linda Booth Sweeney & Gillian Martin Mehers,Chelsea Green Publishing,the simple interactive exercises in the climate change playbook can help citizens better understand climate change diagnose its causes anticipate its future consequences and effect constructive change adapted from the systems thinking playbook the twentytwo games are now specifically relevant to climatechange communications and crafted for use by experts advocates and educators illustrated guidelines walk leaders through setting each game up facilitating it and debriefing participants users will find games that are suitable for a variety of audienceswhether large and seated as in a conference room or smaller and mobile as in a workshop seminar or meeting,Climate_policy
Climate Change,John T. Hardy,John Wiley & Sons,humaninduced climate change is a serious concern drawing increasing attention from the media policy makers and citizens around the world this comprehensive and thoughtprovoking volume explains in easily understandable language the potential effects of climate change on our planet and our lives climate change causes effects and solutions examines the latest scientific findings without any advanced technical knowledge it goes beyond a description of changes in the physical environment to consider the broader issues of ecological economic and human effects of climate change the book explains the causes and effects of climate change from a natural and human environment perspective mitigation options and policies that could reduce the impacts of climate change global impacts  with case studies are taken from north america europe australasia and elsewhere essential reading for undergraduates and general readers who want to heighten their knowledge and understanding of this important problem,Climate_policy
EU Climate Policy,Elin Lerum Boasson & Mr Jørgen Wettestad,"Ashgate Publishing, Ltd.",climate policy is today a significant area of eu governance providing important framework conditions for many industries but how has eu climate policy developed this book offers structured comparative case studies of the development of four central climate policies emissions trading systems renewables carbon capture and storage and energy policy for buildings examining the intriguing similarities and differences in how these have taken shape combining sociological new institutionalism and political science theories in a novel and engaging way elin lerum boasson and jrgen wettestad explore and explain the history of eu climate policy what emerges are fascinating stories  of skilled entrepreneurs who have managed to create and exploit political windows of opportunity and of more longterm pathdependent developments drawing on more than  interviewees the authors present accounts never told before providing a valuable and timely contribution to our knowledge of environmental management and eu integration this book is a mustread for all those seeking to understand the driving forces in eu climate policy and recognize its prospects for the future,Climate_policy
"Firms, Governments, and Climate Policy",Carlo Carraro & Christian Egenhofer,Edward Elgar Publishing,the kyoto protocol to reduce greenhouse gases ghgs in the majority of industrialised countries is the first small step on the way to an effective climate policy in the longterm climate policy will call for greater ghg reductions and the full participation of the global community the five integrated chapters of this book review theoretical findings and empirical evidence in the search for the right incentives which could induce firms and governments to undertake ghg abatement measures this book analyses the policy mixes that provide the best possible incentives for firms and governments to act on climate change and sign up to international climate agreements in doing so the authors address a multitude of related issues including the linkages between flexible mechanisms and voluntary agreements regulation and taxation the opportunities and barriers of the kyoto protocol for industry and the incentives for firms to undertake climaterelated rd and investments as well as illustrating the environmental benefits and costeffectiveness of alternative policy mixes in reducing ghg emissions the authors also offer sensible policy prescriptions for increasing the numbers of countries that ratify and implement climate agreements environmental and resource economists environmental scientists climate analysts and policymakers should all read this book which offers an authoritative contribution to what is arguably the most critical contemporary environmental policy issue,Climate_policy
A Climate Policy Revolution,Roland Kupers,~Publisher not available~,in this book roland kupers argues that the climate crisis is well suited to the bottomup rapid and revolutionary change complexity science theorizes he succinctly makes the case that complexity science promises policy solutions to address climate change,Climate_policy
EU Climate Change Policy,Marjan Peeters & Kurt Deketelaere,Edward Elgar Pub,   this excellent edited collection assembled by peeters and deketelaere on the achievements of eu climate change policy is a very timely publication they have brought together nineteen distinguished mostly european scholars on climate law and policy to provide an informative account of the flurry of initiatives  benjamin j richardson maastricht journal of european and comparative law,Climate_policy
