,Publication,Title,Date,Label
420,VTDigger,julie moore there is a line between brave and imprudent on climate action,"Fri, 03 Feb 2023 12:10:00 GMT",climate
421,Journal & Courier,west lafayette students advocate for climate legislation at statehouse,"Fri, 03 Feb 2023 19:23:17 GMT",climate
422,UN News,climate change wmo unveils plans for sustainable monitoring of ,"Wed, 01 Feb 2023 16:44:52 GMT",climate
423,Newsweek,fungal infections are spreading and climate change is to blame,"Fri, 03 Feb 2023 16:29:14 GMT",climate
424,Capital Public Radio News,winter storms in california will become more intense as climate ,"Fri, 03 Feb 2023 08:04:13 GMT",climate
425,The Durango Herald,federal court us must consider climate impacts of drilling in ,"Fri, 03 Feb 2023 11:45:26 GMT",climate
426,Climate Home News,cables become cool,"Fri, 03 Feb 2023 14:36:00 GMT",climate
427,International Monetary Fund,improving access to climate finance,"Thu, 02 Feb 2023 19:09:44 GMT",climate
428,Reuters,policy watch europe beefs up green deal in response to bidens ,"Fri, 03 Feb 2023 16:29:00 GMT",climate
429,The Wildlife Society,in california some songbirds face climate challenges,"Fri, 03 Feb 2023 13:33:43 GMT",climate
430,Bloomberg,south africa says finalizing climate plan as finance head quits,"Fri, 03 Feb 2023 08:45:43 GMT",climate
431,NOLA.com,our views fight climate threats with change adaptability,"Fri, 03 Feb 2023 09:30:00 GMT",climate
432,The Olympian,thurston youth die at council meeting to protest lack of action on climate change,"Fri, 03 Feb 2023 13:00:00 GMT",climate
433,WTOL,climate friday  how does this toledo winter compare to previous years,"Fri, 03 Feb 2023 17:09:00 GMT",climate
434,Colorado Newsline,as southeast states warm tva criticized on preparations for dealing ,"Fri, 03 Feb 2023 18:50:53 GMT",climate
435,Daily Planet`,the national platform to support spanish cities meet their climate goals,"Fri, 03 Feb 2023 12:12:26 GMT",climate
436,Phys.org,water crises due to climate change more severe than previously thought,"Thu, 02 Feb 2023 17:00:03 GMT",climate
437,UC Davis Health,uc davis health recognized as a  health care climate ,"Fri, 03 Feb 2023 18:59:43 GMT",climate
438,Arup,what are the effects of climate change,"Fri, 03 Feb 2023 19:47:47 GMT",climate
439,Energy News Network,a hidden challenge for minneapolis climate goals shoddy insulation,"Fri, 03 Feb 2023 10:59:00 GMT",climate
440,eJewish Philanthropy,climate change delayed gratification and tu bshevat,"Fri, 03 Feb 2023 12:36:31 GMT",climate
441,WDFW,new wdfw report calls for science,"Thu, 02 Feb 2023 12:00:00 GMT",climate
442,American Banker,feds climate scenario pilot is a waste of time and resources,"Fri, 03 Feb 2023 16:01:00 GMT",climate
443,Kennebec Journal and Morning Sentinel,push made for full funding for maine climate corps,"Thu, 02 Feb 2023 22:43:47 GMT",climate
444,TechCrunch,the impact investor and climate correspondent walk into a bar,"Fri, 03 Feb 2023 15:01:13 GMT",climate
445,Outside,the alaska oil willow project could destroy bidens climate legacy ,"Thu, 02 Feb 2023 19:23:14 GMT",climate
446,The Revelator,united states includes dam emissions in un climate reporting for ,"Fri, 03 Feb 2023 13:01:46 GMT",climate
447,Euronews,are european cities equipped to face the consequences of climate ,"Fri, 03 Feb 2023 19:10:59 GMT",climate
448,E&T Magazine,digital initiatives to improve predictions of climate,"Fri, 03 Feb 2023 11:48:30 GMT",climate
449,The New York Times,recession resilient climate start,"Mon, 30 Jan 2023 10:00:18 GMT",climate
450,Harvard Crimson,harvard medical school will integrate climate change into md ,"Fri, 03 Feb 2023 08:00:00 GMT",climate
451,Environmental Defence,we need real climate plans not false solutions,"Fri, 03 Feb 2023 21:17:09 GMT",climate
452,Smart Cities Dive,what denvers climate office learned from early e,"Fri, 03 Feb 2023 16:07:41 GMT",climate
453,Utah State University,usu faculty receive grant to examine  communicate regional ,"Thu, 02 Feb 2023 23:57:12 GMT",climate
454,CNN,extreme cold snaps why temperatures still plummet to dangerous levels even as the planet warms,"Fri, 03 Feb 2023 13:13:00 GMT",climate
455,The Beacon,opinion protect our climate and our money,"Fri, 03 Feb 2023 18:00:05 GMT",climate
456,Detroit Free Press,us rep huizenga to lead republicans against secs climate ,"Fri, 03 Feb 2023 19:34:46 GMT",climate
457,KPBS,california regulators deliver climate credits early to offer relief from ,"Fri, 03 Feb 2023 01:37:00 GMT",climate
458,The Guardian,worlds biggest investment fund warns directors to tackle climate crisis or face sack,"Fri, 03 Feb 2023 13:22:00 GMT",climate
459,Tallahassee Democrat,gas stoves health and climate change  opinion,"Fri, 03 Feb 2023 18:00:18 GMT",climate
460,Truthout,manchin signals revival of dirty deal climate movement vows to ,"Fri, 03 Feb 2023 16:45:56 GMT",climate
461,Thomson Reuters,how best to integrate climate,"Fri, 03 Feb 2023 02:48:45 GMT",climate
462,SciTechDaily,scientists use exotic dna to help create climate,"Fri, 03 Feb 2023 02:47:13 GMT",climate
463,Pennsylvania State University,study reveals new clues about how earths thermostat controls ,"Fri, 03 Feb 2023 14:48:09 GMT",climate
464,Environmental Defense Fund,top white house aide brian deese indispensable in historic ,"Thu, 02 Feb 2023 19:01:46 GMT",climate
465,JTA News - Jewish Telegraphic Agency,jewish institutions have a tool for fighting climate change their bank accounts,"Fri, 03 Feb 2023 16:00:08 GMT",climate
466,JD Supra,washington state implements major programs to reach climate ,"Fri, 03 Feb 2023 14:06:08 GMT",climate
467,GreenBiz,episode  do you know your climate fingerprint,"Fri, 03 Feb 2023 10:45:33 GMT",climate
468,JD Supra,united kingdom competition authority announces support for ,"Fri, 03 Feb 2023 19:06:35 GMT",climate
469,The Guardian,could putting the clock forward help tackle the climate crisis,"Thu, 02 Feb 2023 06:02:00 GMT",climate
470,City of Sonoma,draft climate action plan to be considered at first climate action ,"Thu, 02 Feb 2023 19:45:32 GMT",climate
471,PR Newswire,climate startup future becomes first to pay ,"Thu, 02 Feb 2023 16:04:00 GMT",climate
472,WLRN,mixed,"Fri, 03 Feb 2023 14:00:00 GMT",climate
473,MeriTalk,nasa ibm plan to use ai in climate change research,"Fri, 03 Feb 2023 15:47:20 GMT",climate
474,NRDC (Natural Resources Defense Council),deese instrumental in delivering critical climate action,"Fri, 03 Feb 2023 20:17:26 GMT",climate
475,Charleston Post Courier, annual carolopolis awards takes aim at historic preservation ,"Fri, 03 Feb 2023 14:00:00 GMT",climate
476,Eurocities,energy performance of buildings a hope for climate,"Fri, 03 Feb 2023 06:59:17 GMT",climate
477,Gizmodo,the last of us is right climate change is making fungi more ,"Thu, 02 Feb 2023 20:10:00 GMT",climate
478,University of New Haven News,idea council subcommittee co,"Fri, 03 Feb 2023 16:04:47 GMT",climate
479,Yale Climate Connections,a double whammy wildfire debris pollutes drinking water,"Fri, 03 Feb 2023 12:05:00 GMT",climate
480,The Guardian,football and the climate crisis does the game really want to tackle it,"Thu, 02 Feb 2023 17:23:00 GMT",climate
481,Impakter,how the european central banks new climate policy could ,"Fri, 03 Feb 2023 16:02:41 GMT",climate
482,Sky News,will solar farms land us with a climate solution,"Fri, 03 Feb 2023 20:38:13 GMT",climate
483,The Washington Post,will steffen climate scientist who warned of a hothouse earth dies ,"Tue, 31 Jan 2023 11:52:00 GMT",climate
484,Vancouver Sun,bc government announces  million in climate adaptation funding,"Fri, 03 Feb 2023 20:40:41 GMT",climate
485,National Oceanic and Atmospheric Administration,climate attribution tools critical for understanding extreme events,"Mon, 09 Jan 2023 08:00:00 GMT",climate
486,The New York Times,newly published from climate fiction to a lost congolese princess,"Thu, 02 Feb 2023 19:00:00 GMT",climate
487,Executive Gov,noaa asce sign memorandum of understanding to work toward ,"Fri, 03 Feb 2023 21:52:19 GMT",climate
488,Corporate Secretary,the week in grc norways swf warns directors on climate change ,"Fri, 03 Feb 2023 15:37:08 GMT",climate
489,Pensions & Investments,blackrocks sustainable investing chief to join jeff bezos climate ,"Fri, 03 Feb 2023 20:45:44 GMT",climate
490,Locus Online,maya c james reviews revelations horror writers for climate ,"Fri, 03 Feb 2023 16:30:36 GMT",climate
491,The Associated Press - en Espaol,calif climate bill would make companies disclose emissions,"Tue, 31 Jan 2023 01:19:44 GMT",climate
492,NPR,climate,"Tue, 10 Jan 2023 08:00:00 GMT",climate
493,The Hill,climate change consumer deception lawsuits threaten free speech will the supreme court take note,"Thu, 02 Feb 2023 13:00:00 GMT",climate
494,The New York Times,climate change may bring new era of trade wars as eu and us spar,"Wed, 25 Jan 2023 08:00:00 GMT",climate
495,The Washington Post,a new climate reality less warming but worse impacts on the planet,"Fri, 06 Jan 2023 08:00:00 GMT",climate
496,NPR,how our perception of time shapes our approach to climate change,"Wed, 04 Jan 2023 08:00:00 GMT",climate
497,BBC,climate change europe and polar regions bear brunt of warming in ,"Tue, 10 Jan 2023 08:00:00 GMT",climate
498,Scientific American,the right words are crucial to solving climate change,"Tue, 17 Jan 2023 14:00:46 GMT",climate
499,Federal Reserve,federal reserve board,"Tue, 17 Jan 2023 08:00:00 GMT",climate
500,BBC,how climate change threatens to close ski resorts,"Wed, 25 Jan 2023 08:00:00 GMT",climate
501,NASA,nasa noaa to announce  global temperatures climate ,"Tue, 10 Jan 2023 08:00:00 GMT",climate
