,Publication,Title,Date,Label
0,NPR,energy experts share how the us can reach bidens renewable energy goals,"Thu, 02 Feb 2023 23:00:50 GMT",renewable_energy
1,MIT Technology Review,busting three myths about materials and renewable energy,"Thu, 02 Feb 2023 11:00:00 GMT",renewable_energy
2,Engadget,researchers can now pull hydrogen directly from seawater no filtering required,"Fri, 03 Feb 2023 21:40:54 GMT",renewable_energy
3,Quartz,shell invested  times more in buybacks than renewables in ,"Fri, 03 Feb 2023 21:47:00 GMT",renewable_energy
4,KARE11.com,minnesota senate passes  percent by  bill,"Fri, 03 Feb 2023 12:24:01 GMT",renewable_energy
5,Nature.com,could solar panels in space supply earth with clean energy,"Wed, 01 Feb 2023 18:02:56 GMT",renewable_energy
6,Fox News,mexico plans to accelerate its push toward renewable energy as global energy costs rise,"Fri, 03 Feb 2023 14:55:00 GMT",renewable_energy
7,Reuters,mexico looks to giant solar park in the desert to assuage carbon concerns,"Thu, 02 Feb 2023 22:03:00 GMT",renewable_energy
8,Santa Barbara Independent,city of santa barbara updates deal with tesla for renewable energy storage,"Thu, 02 Feb 2023 22:30:14 GMT",renewable_energy
9,CNBC,greenwashing is a good thing according to one renewable energy tycoon,"Thu, 02 Feb 2023 06:49:13 GMT",renewable_energy
10,The New York Times,the shift to renewable energy is speeding up heres how,"Tue, 31 Jan 2023 16:14:27 GMT",renewable_energy
11,InvestorPlace,the  most undervalued renewable energy stocks for your february buy list,"Fri, 03 Feb 2023 03:04:03 GMT",renewable_energy
12,ETF Trends,renewable energy was the main supply of eu electricity in ,"Fri, 03 Feb 2023 18:37:48 GMT",renewable_energy
13,UCF,new green storage system offers renewable energy on,"Fri, 03 Feb 2023 15:36:39 GMT",renewable_energy
14,ETF Trends,nbct holding nextera energy to double renewable energy portfolio,"Thu, 02 Feb 2023 20:36:16 GMT",renewable_energy
15,Environment America,renewable energy and conservation is there an elephant in the ,"Fri, 03 Feb 2023 19:49:10 GMT",renewable_energy
16,About Amazon,amazon sets a new record for the most renewable energy ,"Tue, 31 Jan 2023 11:06:14 GMT",renewable_energy
17,GreenBiz,mcdonalds new strategy to bring renewable energy to its supply chain,"Thu, 02 Feb 2023 16:25:35 GMT",renewable_energy
18,NU PropertyCasualty360,renewable energy growth ushers in new insurance needs,"Fri, 03 Feb 2023 14:22:39 GMT",renewable_energy
19,TriplePundit,will coal,"Fri, 03 Feb 2023 08:05:58 GMT",renewable_energy
20,Reuters,petronas set to buy wirsol australian renewable energy assets ,"Fri, 03 Feb 2023 17:36:00 GMT",renewable_energy
21,Norfolk Daily News,renewable energy siting guidelines offer tool for local officials,"Fri, 03 Feb 2023 15:53:00 GMT",renewable_energy
22,Environment America,environment america announces new push for state  ,"Thu, 02 Feb 2023 16:16:45 GMT",renewable_energy
23,Utility Dive,gov hochul proposes allowing new york power authority to build ,"Thu, 02 Feb 2023 15:27:47 GMT",renewable_energy
24,MIT Technology Review,yes we have enough materials to power the world with renewable energy,"Tue, 31 Jan 2023 11:06:04 GMT",renewable_energy
25,St. Albert Gazette,solar show shines a light on renewable energy,"Fri, 03 Feb 2023 21:00:00 GMT",renewable_energy
26,Utility Dive,solar industry group expects some irs guidance by feb  on ,"Thu, 02 Feb 2023 19:23:28 GMT",renewable_energy
27,Beaumont Enterprise,entergy texas launches green select renewable energy program,"Fri, 03 Feb 2023 19:28:45 GMT",renewable_energy
28,Yahoo Finance,europe is no longer the epicenter of clean energy investment,"Wed, 01 Feb 2023 23:00:00 GMT",renewable_energy
29,Farm Progress,turning to renewable energy to dry grain,"Fri, 03 Feb 2023 17:31:36 GMT",renewable_energy
30,Reuters,eu ukraine plan cooperation on renewable energy hydrogen,"Tue, 31 Jan 2023 15:29:00 GMT",renewable_energy
31,CleanTechnica,clean energy to communities program launched by department of energy,"Thu, 02 Feb 2023 22:08:29 GMT",renewable_energy
32,reNEWS,edf renewables signs ppa for texas solar farm,"Fri, 03 Feb 2023 09:15:22 GMT",renewable_energy
33,KTVZ,transmission lines often ignored but key to northwests renewable ,"Fri, 03 Feb 2023 05:56:30 GMT",renewable_energy
34,Solar Industry,emerson debuts ovation green single,"Thu, 02 Feb 2023 15:42:10 GMT",renewable_energy
35,European Commission,heating and cooling from renewables gradually increasing ,"Fri, 03 Feb 2023 10:01:44 GMT",renewable_energy
36,Vox.com,renewables are growing on the texas power grid republicans want more natural gas,"Mon, 30 Jan 2023 18:10:00 GMT",renewable_energy
37,JD Supra,renewable energy update,"Thu, 02 Feb 2023 20:26:15 GMT",renewable_energy
38,Maine Public,renewable energy corridor to northern maine clears hurdle with ok ,"Tue, 31 Jan 2023 18:05:00 GMT",renewable_energy
39,Fast Company,scientists want to turn abandoned coal mines into energy storage facil,"Fri, 03 Feb 2023 09:00:00 GMT",renewable_energy
40,chinadialogue,ghanas renewables push,"Fri, 03 Feb 2023 15:56:49 GMT",renewable_energy
41,Duke Energy News Center,duke energy to help customers go  renewable,"Tue, 31 Jan 2023 13:29:43 GMT",renewable_energy
42,Law360,renewable energy investor approves  shares buyback,"Fri, 03 Feb 2023 13:18:00 GMT",renewable_energy
43,ReliefWeb,leveraging climate finance to bring renewable energy to un ,"Thu, 02 Feb 2023 18:40:30 GMT",renewable_energy
44,NBC News,puerto rico faces a critical time to determine its energy future,"Fri, 03 Feb 2023 14:07:44 GMT",renewable_energy
45,Noozhawk,rainstorms swell water supply spark clean renewable energy use,"Fri, 03 Feb 2023 01:20:00 GMT",renewable_energy
46,Local 22/44 News,burlington electric opposes tightening clean energy standard,"Thu, 02 Feb 2023 04:33:55 GMT",renewable_energy
47,Earthjustice,earthjustice and seia challenge grid operator rules that restrict ,"Tue, 31 Jan 2023 20:11:38 GMT",renewable_energy
48,Mortgage Professional,imperial ridge launches new commercial division to finance ,"Thu, 02 Feb 2023 13:51:53 GMT",renewable_energy
49,Power Technology,ge renewable energy secures wind turbine contract from repsol,"Fri, 03 Feb 2023 09:17:26 GMT",renewable_energy
50,World Bank Group,accelerating access to renewable energy in west africa,"Wed, 01 Feb 2023 01:58:27 GMT",renewable_energy
51,Forbes,renewable energy is growing quickly worldwide,"Wed, 18 Jan 2023 08:00:00 GMT",renewable_energy
52,GreenBiz,the renewable energy transition is creating a green jobs boom,"Fri, 20 Jan 2023 08:00:00 GMT",renewable_energy
53,EE Journal,integrating renewable,"Fri, 03 Feb 2023 14:03:56 GMT",renewable_energy
54,Foreign Policy,norway is planning to profit from climate change,"Tue, 31 Jan 2023 16:57:21 GMT",renewable_energy
55,NPR,puerto ricos  renewable energy by  goal includes lots of ,"Mon, 23 Jan 2023 08:00:00 GMT",renewable_energy
56,Bulletin of the Atomic Scientists,want clean energy fast streamlining environmental reviews could ,"Wed, 01 Feb 2023 11:08:07 GMT",renewable_energy
57,Barron's,bp may cut renewable energy spending its stock could catch exxon chevron,"Wed, 01 Feb 2023 14:56:00 GMT",renewable_energy
58,UN News,un chief calls for renewable energy revolution for a brighter global ,"Sat, 14 Jan 2023 08:00:00 GMT",renewable_energy
59,Carbon Brief,media reaction us inflation reduction act and the global clean ,"Fri, 03 Feb 2023 14:16:59 GMT",renewable_energy
60,Wisconsin Public Radio,wisconsin utilities are investing in battery storage to aid clean ,"Fri, 03 Feb 2023 11:00:00 GMT",renewable_energy
61,CBC.ca,proposed wind farm could become  renewable energy competitor for nsp,"Fri, 03 Feb 2023 18:10:22 GMT",renewable_energy
62,Bloomberg Philanthropies,new africa renewable energy manufacturing initiative will help ,"Tue, 17 Jan 2023 12:11:29 GMT",renewable_energy
63,WUFT,energy experts share how the us can reach bidens renewable ,"Thu, 02 Feb 2023 23:39:40 GMT",renewable_energy
64,World Economic Forum, clever ways to store renewable energy without batteries,"Thu, 26 Jan 2023 15:14:00 GMT",renewable_energy
65,The Guardian,shells actual spending on renewables is fraction of what it claims group alleges,"Wed, 01 Feb 2023 17:14:00 GMT",renewable_energy
66,Clean Energy Wire,renewable energy leaders show mixed views on whether germany ,"Mon, 30 Jan 2023 11:55:39 GMT",renewable_energy
67,reNEWS,krivaca wind farm secures  investment,"Fri, 03 Feb 2023 12:31:39 GMT",renewable_energy
68,Marketscreener.com,cemex supplies lower carbon cement for major renewable energy projects in europe,"Fri, 03 Feb 2023 13:20:33 GMT",renewable_energy
69,Guardian Nigeria,fg reaffirms renewable energy critical to addressing electricity woes,"Fri, 03 Feb 2023 13:21:00 GMT",renewable_energy
70,The Atlanta Journal Constitution,mayors office revives atlantas clean energy advisory board,"Fri, 03 Feb 2023 22:26:26 GMT",renewable_energy
71,World Economic Forum,the renewable energy transition is creating a green jobs boom,"Fri, 13 Jan 2023 08:00:00 GMT",renewable_energy
72,IEEFA,indias union budget a mixed bag for the renewable energy sector ,"Thu, 02 Feb 2023 08:47:12 GMT",renewable_energy
73,reNEWS,plenitude starts production from texas solar farm,"Fri, 03 Feb 2023 09:48:33 GMT",renewable_energy
74,European Commission,electricity from renewable sources on the rise,"Fri, 27 Jan 2023 10:04:01 GMT",renewable_energy
75,Utility Dive,new england policymakers have the tech and funds for energy ,"Fri, 03 Feb 2023 15:07:01 GMT",renewable_energy
76,reNEWS,totalenergies sells stake in  renewable projects,"Fri, 03 Feb 2023 08:13:31 GMT",renewable_energy
77,Environment America,renewable energy predicted to grow,"Wed, 11 Jan 2023 08:00:00 GMT",renewable_energy
78,90.5 WESA,sen casey visits lehigh valley crayola factory highlights use of ,"Tue, 31 Jan 2023 10:31:00 GMT",renewable_energy
79,The Guardian,this is an era of plentiful cheap renewable energy but the fossil fuel dinosaurs cant admit it,"Fri, 20 Jan 2023 08:00:00 GMT",renewable_energy
80,reNEWS,jbm solar submits roundhill solar farm proposal,"Fri, 03 Feb 2023 15:29:45 GMT",renewable_energy
81,InsideClimate News,four big things to expect in clean energy in ,"Thu, 05 Jan 2023 08:00:00 GMT",renewable_energy
82,Forbes, energy predictions ira spurs clean energy boom electric trucks accelerate battery demand surges epa cuts power sector pollution,"Mon, 09 Jan 2023 08:00:00 GMT",renewable_energy
83,Al-Monitor,turkey plans to expand renewable energy but sticks to coal nuclear,"Thu, 02 Feb 2023 12:38:07 GMT",renewable_energy
84,CleanTechnica,another year another record in denmarks renewable energy progress,"Sat, 14 Jan 2023 08:00:00 GMT",renewable_energy
85,reNEWS,uk energy groups call on chancellor for more clean energy ,"Fri, 03 Feb 2023 10:28:17 GMT",renewable_energy
86,ETEnergyWorld,malaysia faces inconvenient truth on clean energy goals,"Fri, 03 Feb 2023 07:45:00 GMT",renewable_energy
87,The Indian Express,minister  mw capacity renewable energy projects installed in punjab,"Thu, 02 Feb 2023 22:06:28 GMT",renewable_energy
88,The Jakarta Post,beware the risks of foreign capital in renewable energy sector,"Thu, 02 Feb 2023 23:56:13 GMT",renewable_energy
89,OilPrice.com,renewable energy had a banner year in ,"Sun, 08 Jan 2023 08:00:00 GMT",renewable_energy
90,Reuters,india uae close to deal on renewable electricity grid link indian ,"Sun, 15 Jan 2023 08:00:00 GMT",renewable_energy
91,PBS NewsHour,alaska villages effort to go greener helps local economy,"Sat, 21 Jan 2023 08:00:00 GMT",renewable_energy
92,Deccan Herald,sitharaman urges industry to set standards in renewable energy,"Fri, 03 Feb 2023 02:14:45 GMT",renewable_energy
93,Utility Dive,doe launches updated mapping tool to optimize renewable energy ,"Thu, 12 Jan 2023 08:00:00 GMT",renewable_energy
94,ABS-CBN News,doe supports full foreign ownership for renewable energy projects,"Fri, 03 Feb 2023 09:56:00 GMT",renewable_energy
95,ITWeb,renewable energy attracts sas coal miners,"Fri, 03 Feb 2023 09:46:58 GMT",renewable_energy
96,Euronews,which european countries use the most renewable energy,"Fri, 20 Jan 2023 08:00:00 GMT",renewable_energy
97,World Economic Forum,the global energy crisis is causing hardships for many but its also ,"Fri, 06 Jan 2023 08:00:00 GMT",renewable_energy
98,EcoWatch,record renewable energy generation in australia led to record ,"Wed, 25 Jan 2023 08:00:00 GMT",renewable_energy
99,Forbes,russias invasion of ukraine triggers renewable energy rush say world leaders in abu dhabi,"Sun, 15 Jan 2023 08:00:00 GMT",renewable_energy
100,Verizon,verizon surpasses  gigawatts of projected renewable energy ,"Thu, 12 Jan 2023 08:00:00 GMT",renewable_energy
101,American Public Power Association,peninsula clean energy signs contracts expanding renewable ,"Wed, 25 Jan 2023 12:00:00 GMT",renewable_energy
102,Reuters,lulas amazon pledge looks distant as brazil battles deforestation,"Thu, 02 Feb 2023 10:35:00 GMT",deforestation
103,Vox.com,palm oil is actually not that bad for the environment anymore,"Thu, 02 Feb 2023 12:30:00 GMT",deforestation
104,National Geographic,madagascars sacred trees face existential threats in a changing world,"Fri, 03 Feb 2023 18:21:27 GMT",deforestation
105,The Guardian,deforestation piles pressure on south americas elusive chacoan peccary,"Tue, 31 Jan 2023 09:31:00 GMT",deforestation
106,Al Jazeera English,brazilian amazon deforestation up  in bolsonaros last month,"Sat, 07 Jan 2023 08:00:00 GMT",deforestation
107,BBC,climate boss carneys firm linked with deforestation,"Fri, 16 Dec 2022 08:00:00 GMT",deforestation
108,Vox.com,foods like coffee and beef cause deforestation this eu law could help fix the problem,"Tue, 10 Jan 2023 08:00:00 GMT",deforestation
109,New Scientist,amazon deforestation may shrink himalayan snow and antarctic ice,"Thu, 05 Jan 2023 08:00:00 GMT",deforestation
110,Grist,indigenous territories in the brazilian amazon effectively protect forests why is deforestation increasing,"Fri, 06 Jan 2023 08:00:00 GMT",deforestation
111,The Guardian,eu ban on deforestation,"Thu, 05 Jan 2023 08:00:00 GMT",deforestation
112,Mongabay.com,changing circumstances turn sustainable communities into ,"Wed, 01 Feb 2023 22:59:32 GMT",deforestation
113,Mongabay.com,indigenous communities threatened as deforestation rises in ,"Mon, 30 Jan 2023 17:19:23 GMT",deforestation
114,Down To Earth Magazine,warming beyond borders amazon deforestation heats up tibet ,"Fri, 03 Feb 2023 12:34:34 GMT",deforestation
115,Forbes,how digital and distributed technology are being used to prevent deforestation,"Thu, 26 Jan 2023 09:57:02 GMT",deforestation
116,Ecosystem Marketplace,companies increase ambition to protect biodiversity from ,"Mon, 30 Jan 2023 20:58:11 GMT",deforestation
117,Science,the drivers and impacts of amazon forest degradation,"Thu, 26 Jan 2023 23:06:29 GMT",deforestation
118,EARTH.ORG,global deforestation in  can the world reach the global ,"Thu, 02 Feb 2023 00:01:25 GMT",deforestation
119,Mongabay.com,from deforestation to restoration policy plots path to amazon recovery,"Fri, 06 Jan 2023 08:00:00 GMT",deforestation
120,Reuters Canada,exclusive brazil launches first anti,"Thu, 19 Jan 2023 08:00:00 GMT",deforestation
121,Mongabay.com,deforestation out of control in reserve in brazils cattle capital,"Wed, 11 Jan 2023 08:00:00 GMT",deforestation
122,FoodNavigator.com,what does europes deforestation law mean for palm oil rspo ,"Wed, 01 Feb 2023 11:27:12 GMT",deforestation
123,WRIC ABC 8News,invasive species to deforestation virginia evaluates the state of the forest for ,"Fri, 27 Jan 2023 12:45:00 GMT",deforestation
124,Eco-Business,is there a case for high forest low deforestation carbon credits,"Wed, 01 Feb 2023 05:20:00 GMT",deforestation
125,Reuters,despite their net,"Thu, 05 Jan 2023 08:00:00 GMT",deforestation
126,Green Queen Media,coffee and chocolate drive deforestation and human rights violations can the industries change,"Wed, 01 Feb 2023 07:04:01 GMT",deforestation
127,Forbes,brazil already has its best tool against deforestation,"Fri, 06 Jan 2023 08:00:00 GMT",deforestation
128,Mongabay.com,venezuelas yapacana national park suffering increasing mining ,"Wed, 11 Jan 2023 08:00:00 GMT",deforestation
129,chinadialogue,coal extraction in indonesia is driving deforestation,"Mon, 16 Jan 2023 08:00:00 GMT",deforestation
130,VOA Learning English,brazils president lula works to stop amazon deforestation,"Sun, 29 Jan 2023 21:57:24 GMT",deforestation
131,Carbon Brief,cropped  january  brazil under lula  reaction eu ,"Wed, 11 Jan 2023 08:00:00 GMT",deforestation
132,Phys.org,deforestation proposed eu import ban may fail to protect tropical rainforests and farmers how it should work,"Mon, 09 Jan 2023 08:00:00 GMT",deforestation
133,PRI,investors policy dialogue on deforestation ipdd  pri web page,"Mon, 16 Jan 2023 08:00:00 GMT",deforestation
134,The Conversation Indonesia,why queensland is still ground zero for australian deforestation,"Fri, 27 Jan 2023 05:45:49 GMT",deforestation
135,Anadolu Agency | English,brazils amazon saw worst deforestation levels in  years in  ,"Fri, 20 Jan 2023 08:00:00 GMT",deforestation
136,Eco-Business,palm oil buyers compromise no,"Tue, 17 Jan 2023 08:00:00 GMT",deforestation
137,Mighty Earth,sweet nothings deforestation remains high across ghana  cote ,"Fri, 13 Jan 2023 08:00:00 GMT",deforestation
138,SGGP News,lam dong province discovers  illegal deforestation cases in ,"Fri, 03 Feb 2023 01:51:02 GMT",deforestation
139,UNEP,faith groups help to save disappearing forests,"Wed, 11 Jan 2023 08:00:00 GMT",deforestation
140,Verra,technical review of west et al  and  guizar,"Tue, 31 Jan 2023 05:00:00 GMT",deforestation
141,The Brazilian Report,how brazil can halve amazon deforestation in the short term,"Thu, 02 Feb 2023 16:58:21 GMT",deforestation
142,Food Ingredients First,deforestation debate indonesia and malaysia clash with ,"Wed, 11 Jan 2023 08:00:00 GMT",deforestation
143,The Weather Channel,farming more seaweed could help fight food crisis deforestation ,"Fri, 27 Jan 2023 08:13:08 GMT",deforestation
144,Chatham House,heriberto araujo small farmers can help save the amazon,"Fri, 03 Feb 2023 12:00:00 GMT",deforestation
145,Plant Based News, million trees by ,"Thu, 02 Feb 2023 17:06:22 GMT",deforestation
146,ClientEarth,eutr newsletter,"Fri, 03 Feb 2023 10:56:50 GMT",deforestation
147,Myjoyonline,communities to be rewarded for planting trees to reduce carbon ,"Fri, 03 Feb 2023 13:10:42 GMT",deforestation
148,WINA AM 1070,brazil authorities probe amazon ties to capital attacks  newsradio ,"Wed, 01 Feb 2023 19:36:31 GMT",deforestation
149,Centre Daily Times,flagship species was devastated by deforestation now pa experts may bring it back,"Fri, 27 Jan 2023 21:38:32 GMT",deforestation
150,The Guardian,revealed more than  of rainforest carbon offsets by biggest certifier are worthless analysis shows,"Wed, 18 Jan 2023 08:00:00 GMT",deforestation
151,ABC News,germany pledges  million for brazil environment amazon,"Mon, 30 Jan 2023 16:40:36 GMT",deforestation
152,CosmeticsDesign-Europe.com,deforestation,"Wed, 25 Jan 2023 12:30:34 GMT",deforestation
153,asianews.network,eus green policy a priority for asean,"Mon, 30 Jan 2023 03:59:36 GMT",deforestation
154,POLITICO Europe,eu,"Thu, 02 Feb 2023 05:00:00 GMT",deforestation
155,thethirdpole.net,post,"Thu, 02 Feb 2023 03:30:00 GMT",deforestation
156,The Hill,lula and biden face a historic opportunity to protect the amazon,"Wed, 01 Feb 2023 21:00:00 GMT",deforestation
157,Nature.com,the post,"Fri, 03 Feb 2023 10:50:12 GMT",deforestation
158,The Star Online,deforestation is no longer an issue,"Sat, 14 Jan 2023 08:00:00 GMT",deforestation
159,ConfectioneryNews.com,over  of cocoa exports from cote divoire untraceable new ,"Thu, 02 Feb 2023 14:36:38 GMT",deforestation
160,Reuters,brazil says plans green bond sale this year,"Thu, 26 Jan 2023 08:00:00 GMT",deforestation
161,Guitar World,paul mccartney shares previously unreleased jeff beck collaboration,"Tue, 31 Jan 2023 11:00:25 GMT",deforestation
162,pnas.org,a pantropical assessment of deforestation caused by industrial ,"Mon, 12 Sep 2022 07:00:00 GMT",deforestation
163,Science,disentangling the numbers behind agriculture,"Fri, 09 Sep 2022 07:00:00 GMT",deforestation
164,Mongabay.com,amazons tallest tree at risk as deforestation nears,"Wed, 28 Dec 2022 08:00:00 GMT",deforestation
165,Environment America,the eu just took a major step to prevent deforestation around the ,"Thu, 08 Dec 2022 08:00:00 GMT",deforestation
166,Nature.com,deforestation slowed last year  but not enough to meet climate goals,"Mon, 24 Oct 2022 07:00:00 GMT",deforestation
167,CarbonCredits.com,us to sanction brazils amazon deforestation criminals,"Fri, 25 Nov 2022 08:00:00 GMT",deforestation
168,CNBC,deforestation in brazilian amazon hits tragic record in ,"Wed, 13 Jul 2022 07:00:00 GMT",deforestation
169,Economist Impact,progress on  pledges deforestation,"Sun, 09 Oct 2022 07:00:00 GMT",deforestation
170,Mongabay.com,deforestation is pushing amazon to point of no return wwf report,"Wed, 09 Nov 2022 08:00:00 GMT",deforestation
171,nasa.gov,deforestation follows a road through ucayali,"Mon, 24 Oct 2022 07:00:00 GMT",deforestation
172,Mongabay.com,to be effective zero,"Wed, 30 Nov 2022 08:00:00 GMT",deforestation
173,The Nature Conservancy,landmark eu legislation will make european consumption ,"Tue, 06 Dec 2022 08:00:00 GMT",deforestation
174,Reuters,exclusive deforestation of brazilian savanna surged some  in a ,"Tue, 13 Dec 2022 08:00:00 GMT",deforestation
175,GreenBiz, this past year in deforestation,"Tue, 15 Nov 2022 08:00:00 GMT",deforestation
176,Mongabay.com,zero,"Tue, 27 Dec 2022 08:00:00 GMT",deforestation
177,Ropes & Gray LLP,an update on the eu deforestation regulation  the parliaments ,"Tue, 15 Nov 2022 08:00:00 GMT",deforestation
178,Greenpeace International,how deforestation is pushing the amazon to a climate tipping point,"Fri, 26 Aug 2022 07:00:00 GMT",deforestation
179,CNN,deforestation is accelerating in brazil as bolsonaros first term ends experts say,"Tue, 20 Sep 2022 07:00:00 GMT",deforestation
180,PBS NewsHour,brazils lula pledges big fight against deforestation at ,"Wed, 16 Nov 2022 08:00:00 GMT",deforestation
181,Reuters,analysis the next amazon congo basin faces rising deforestation ,"Fri, 11 Nov 2022 08:00:00 GMT",deforestation
182,Reuters,deforestation of brazilian amazon retreats from ,"Wed, 30 Nov 2022 08:00:00 GMT",deforestation
183,The New York Times,deforestation remains high despite cop  pledges,"Thu, 28 Apr 2022 07:00:00 GMT",deforestation
184,LatestLY,its world neglected tropical diseases day reducing deforestation unplanned housing ,"Mon, 30 Jan 2023 15:15:57 GMT",deforestation
185,Conservation International,news spotlight record deforestation could forever transform the ,"Mon, 18 Jul 2022 07:00:00 GMT",deforestation
186,Mongabay.com,new app tells donors what communities need to stop deforestation ,"Mon, 02 Jan 2023 08:00:00 GMT",deforestation
187,Mongabay.com,in final days before bolsonaros defeat deforestation boomed in brazil,"Fri, 11 Nov 2022 08:00:00 GMT",deforestation
188,Reuters,norway says fund to reduce amazon deforestation in brazil back in ,"Tue, 03 Jan 2023 08:00:00 GMT",deforestation
189,PBS NewsHour,brazils lulas promises to end deforestation face challenges from traditional rubber tappers,"Fri, 23 Dec 2022 08:00:00 GMT",deforestation
190,Reuters,worlds top finance firms continue to fuel deforestation report warns,"Mon, 17 Oct 2022 07:00:00 GMT",deforestation
191,International Monetary Fund,ugandan climate activists fight deforestation by planting,"Thu, 10 Nov 2022 08:00:00 GMT",deforestation
192,NPR,brazils election could determine the fate of the amazon after surging ,"Sat, 01 Oct 2022 07:00:00 GMT",deforestation
193,Mongabay.com,deforestation accelerated in brazil while climate talks were ,"Fri, 09 Dec 2022 08:00:00 GMT",deforestation
194,Mongabay.com,ahead of election deforestation increased in brazil,"Fri, 07 Oct 2022 07:00:00 GMT",deforestation
195,Nature.com,deforestation intensifies daily temperature variability in the northern ,"Mon, 10 Oct 2022 07:00:00 GMT",deforestation
196,GreenBiz,a deforestation roadmap that leaves a lot to be desired,"Thu, 10 Nov 2022 08:00:00 GMT",deforestation
197,EcoWatch,deforestation  everything you need to know,"Wed, 12 Oct 2022 07:00:00 GMT",deforestation
198,Nature.com,land tenure drives brazils deforestation rates across socio ,"Sat, 01 Oct 2022 07:00:00 GMT",deforestation
199,The Manila Times,the value of insects why we must act now to protect them,"Thu, 02 Feb 2023 15:58:08 GMT",deforestation
200,Mongabay.com,the amazon will reach tipping point if current trend of deforestation ,"Mon, 03 Oct 2022 07:00:00 GMT",deforestation
201,Carbon Brief,cropped  november  deforestation pledges food systems ,"Thu, 24 Nov 2022 08:00:00 GMT",deforestation
202,The Hill,society isnt changing fast enough to stop climate change study,"Wed, 01 Feb 2023 16:44:00 GMT",climate_policy
203,Foreign Policy,norway is planning to profit from climate change,"Tue, 31 Jan 2023 16:57:21 GMT",climate_policy
204,The Economist,habitat loss and climate change increase the risk of new diseases,"Tue, 31 Jan 2023 18:03:29 GMT",climate_policy
205,Scientific American,how water finally became a climate change priority,"Tue, 31 Jan 2023 16:00:14 GMT",climate_policy
206,The Conversation,climate change is transforming australias cultural life  so why isnt it mentioned in the new national cultural policy,"Wed, 01 Feb 2023 02:55:00 GMT",climate_policy
207,CBS News,coastal residents on climate change the oceans coming for you,"Sun, 08 Jan 2023 08:00:00 GMT",climate_policy
208,BBC,how climate change threatens to close ski resorts,"Wed, 25 Jan 2023 08:00:00 GMT",climate_policy
209,CNBC,powell reiterates fed is not going to become a climate policymaker,"Tue, 10 Jan 2023 08:00:00 GMT",climate_policy
