,Publication,Title,Date,Label
210,New Scientist,earths geological thermostat is too slow to prevent climate change,"Thu, 26 Jan 2023 18:56:15 GMT",climate_policy
211,The New York Times,opinion  im a scientist who spoke up about climate change my employer fired me,"Tue, 10 Jan 2023 08:00:00 GMT",climate_policy
212,Forbes,heres why climate change gets the spotlight but biodiversity doesnt,"Wed, 01 Feb 2023 06:52:19 GMT",climate_policy
213,Brookings Institution,climate change adapting to a new normal,"Sat, 28 Jan 2023 01:43:57 GMT",climate_policy
214,Center For American Progress,how the office of climate change and health equity can respond ,"Mon, 30 Jan 2023 14:06:29 GMT",climate_policy
215,The New York Times,climate change may bring new era of trade wars as eu and us spar,"Wed, 25 Jan 2023 08:00:00 GMT",climate_policy
216,Impakter,how the european central banks new climate policy could ,"Fri, 03 Feb 2023 16:02:41 GMT",climate_policy
217,UNM School of Law News,largest greenhouse gas emitters overlooked in state climate policy ,"Fri, 03 Feb 2023 17:04:01 GMT",climate_policy
218,Phys.org,new mexicos largest emitters overlooked in state climate policy says report,"Wed, 01 Feb 2023 20:28:03 GMT",climate_policy
219,Harvard Crimson,harvard medical school will integrate climate change into md ,"Fri, 03 Feb 2023 08:00:00 GMT",climate_policy
220,E-International Relations,climate change scientific evidence and projected warming,"Thu, 02 Feb 2023 20:14:56 GMT",climate_policy
221,JD Supra,united kingdom competition authority announces support for ,"Fri, 03 Feb 2023 19:06:35 GMT",climate_policy
222,Science Daily,climate change may cut us forest inventory by a fifth this century,"Thu, 02 Feb 2023 00:43:56 GMT",climate_policy
223,Clyde & Co,nsw epa releases its climate change policy and climate change ,"Fri, 03 Feb 2023 00:17:47 GMT",climate_policy
224,Euronews,are european cities equipped to face the consequences of climate ,"Fri, 03 Feb 2023 19:10:59 GMT",climate_policy
225,Nature.com,research on public support for climate policy instruments must ,"Thu, 26 Jan 2023 16:05:02 GMT",climate_policy
226,The Revelator,united states includes dam emissions in un climate reporting for ,"Fri, 03 Feb 2023 13:01:46 GMT",climate_policy
227,California Ag Today,uc anr expands expertise for climate change economic ,"Fri, 03 Feb 2023 17:11:38 GMT",climate_policy
228,The Wall Street Journal,opinion  al gore and the end of climate policy,"Fri, 03 Feb 2023 22:06:00 GMT",climate_policy
229,Yale Program on Climate Change Communication,climate change in the american mind politics  policy december ,"Tue, 31 Jan 2023 12:22:30 GMT",climate_policy
230,GreenBiz, another big year for climate policy,"Thu, 05 Jan 2023 08:00:00 GMT",climate_policy
231,Marco News, to know cvs to reduce pharmacy hours climate change news ,"Fri, 03 Feb 2023 13:12:57 GMT",climate_policy
232,The Washington Post,meet the group sharpening the gop attack on woke climate policies,"Mon, 30 Jan 2023 14:10:00 GMT",climate_policy
233,Reuters,policy watch europe beefs up green deal in response to bidens ,"Fri, 03 Feb 2023 16:29:00 GMT",climate_policy
234,ReliefWeb,republic of congo economic update,"Thu, 02 Feb 2023 21:40:55 GMT",climate_policy
235,The Business Journals,blue planet foundations melissa miyashiro helps shape climate ,"Thu, 02 Feb 2023 21:47:00 GMT",climate_policy
236,NPR,how our perception of time shapes our approach to climate change,"Wed, 04 Jan 2023 08:00:00 GMT",climate_policy
237,Responsible Investor,sec to prioritise climate change disclosure shareholder proposal ,"Wed, 01 Feb 2023 15:17:55 GMT",climate_policy
238,University of Colorado Boulder,why does climate policy lag science  colorado arts and sciences ,"Thu, 12 Jan 2023 08:00:00 GMT",climate_policy
239,Carnegie Endowment for International Peace,climate change is now coming for the elite,"Wed, 18 Jan 2023 08:00:00 GMT",climate_policy
240,Scientific American,the right words are crucial to solving climate change,"Tue, 17 Jan 2023 14:00:46 GMT",climate_policy
241,Nature.com,multidimensional partisanship shapes climate policy support and ,"Mon, 09 Jan 2023 08:00:00 GMT",climate_policy
242,Virginia Business Magazine,business climate change,"Fri, 03 Feb 2023 18:30:36 GMT",climate_policy
243,PRI,an introduction to responsible investment climate change for asset ,"Mon, 29 Jun 2020 07:00:00 GMT",climate_policy
244,ACT Alliance,act and bread for the world publish new study on human mobility ,"Fri, 03 Feb 2023 15:37:38 GMT",climate_policy
245,JD Supra,this weeks climate policy update,"Tue, 10 Jan 2023 08:00:00 GMT",climate_policy
246,Harvard Medical School,connecting climate change and health  harvard medical school,"Mon, 09 Jan 2023 08:00:00 GMT",climate_policy
247,Corporate Secretary,chubb and travelers aim to exclude climate change proposals,"Thu, 02 Feb 2023 16:36:56 GMT",climate_policy
248,The Guardian,google let daily wire advertise on climate change is a hoax searches,"Fri, 27 Jan 2023 16:33:00 GMT",climate_policy
249,Assembly of First Nations,afn bulletin,"Fri, 03 Feb 2023 15:16:36 GMT",climate_policy
250,World Economic Forum,what is the eus new bauhaus movement for forests,"Tue, 31 Jan 2023 17:24:00 GMT",climate_policy
251,Education Week,students want climate change education most teachers dont get ,"Tue, 31 Jan 2023 22:01:04 GMT",climate_policy
252,PRI,ipr quarterly forecast tracker,"Wed, 25 Jan 2023 08:00:00 GMT",climate_policy
253,The Hindu,soumya swaminathan nominated to governing council on climate change,"Fri, 03 Feb 2023 16:24:00 GMT",climate_policy
254,Brookings Institution,methane comes front and center in climate change policy,"Fri, 06 Jan 2023 08:00:00 GMT",climate_policy
255,World Economic Forum,climate change and the environment  top stories this week  world ,"Mon, 09 Jan 2023 08:00:00 GMT",climate_policy
256,Atlas Obscura,does this silly,"Tue, 31 Jan 2023 22:03:14 GMT",climate_policy
257,World Economic Forum,climate change is adding to a growing infectious disease burden ,"Wed, 18 Jan 2023 08:00:00 GMT",climate_policy
258,Lexology,climate policy newsletter,"Thu, 05 Jan 2023 08:00:00 GMT",climate_policy
259,The Hill,climate change consumer deception lawsuits threaten free speech will the supreme court take note,"Thu, 02 Feb 2023 13:00:00 GMT",climate_policy
260,World Economic Forum,climate change threatens everyones health  heres how ,"Tue, 17 Jan 2023 08:00:00 GMT",climate_policy
261,The Nation,regional cooperation on climate change,"Fri, 03 Feb 2023 20:20:30 GMT",climate_policy
262,World Economic Forum,trade can help us address climate change four trade ministers ,"Thu, 19 Jan 2023 08:00:00 GMT",climate_policy
263,Fox News,biden says climate change is bigger threat to humanity than nuclear war were going to have a real problem,"Wed, 01 Feb 2023 02:39:00 GMT",climate_policy
264,Austin Chronicle,texas lege looks to address flooding and drought without saying ,"Fri, 03 Feb 2023 06:04:02 GMT",climate_policy
265,BBC,exxonmobil oil giant predicted climate change in ,"Thu, 12 Jan 2023 08:00:00 GMT",climate_policy
266,Guardian Nigeria,presidential forum on environment climate change holds  nigeria,"Fri, 03 Feb 2023 13:23:00 GMT",climate_policy
267,House of Lords Library,nature,"Fri, 03 Feb 2023 15:47:23 GMT",climate_policy
268,University of Massachusetts Boston,researchers explore impacts of climate change through the eyes ,"Wed, 11 Jan 2023 08:00:00 GMT",climate_policy
269,World Economic Forum,how improving road safety can help tackle climate change,"Tue, 10 Jan 2023 08:00:00 GMT",climate_policy
270,Geospatial World,ibm nasa collaborate for climate change research,"Wed, 01 Feb 2023 23:27:48 GMT",climate_policy
271,University of North Carolina at Greensboro,climate change impacts on past societies offer lessons for global ,"Mon, 16 Jan 2023 08:00:00 GMT",climate_policy
272,The Round Table,the commonwealth climate change small states and inequality,"Thu, 02 Feb 2023 13:47:10 GMT",climate_policy
273,Euronews,are european cities equipped to face the consequences of climate ,"Fri, 03 Feb 2023 19:11:26 GMT",climate_policy
274,The Guardian,three issues will decide if labors climate policy is a success  what the government does next is key,"Fri, 13 Jan 2023 08:00:00 GMT",climate_policy
275,The Institutional Investors Group on Climate Change,climate change tops wef global risks report   iigcc,"Fri, 13 Jan 2023 08:00:00 GMT",climate_policy
276,Schroders,qa how weve engaged with european banks over climate change,"Tue, 31 Jan 2023 12:38:36 GMT",climate_policy
277,Stuff,approach to funding infrastructure needed to avoid managed retreat ,"Tue, 31 Jan 2023 20:42:00 GMT",climate_policy
278,Inside Housing,not fit for purpose epc ratings need reform says climate change ,"Fri, 03 Feb 2023 14:00:00 GMT",climate_policy
279,Stuff,greens james shaw looks for cross,"Tue, 31 Jan 2023 16:00:00 GMT",climate_policy
280,Global News,quebecs green zeal likely to push trudeau governments climate policies,"Sat, 07 Jan 2023 08:00:00 GMT",climate_policy
281,Colorado Department of Public Health and Environment,climate change  department of public health  environment,"Thu, 29 Dec 2022 21:55:46 GMT",climate_policy
282,The White House,fact sheet president biden announces new initiatives at  ,"Fri, 11 Nov 2022 08:00:00 GMT",climate_policy
283,The Harvard Law School Forum on Corporate Governance,how companies are  and arent  leading on climate policy,"Mon, 12 Dec 2022 08:00:00 GMT",climate_policy
284,Brookings Institution,climate policy curves linking policy choices to climate outcomes,"Wed, 14 Dec 2022 08:00:00 GMT",climate_policy
285,The White House,fact sheet biden,"Thu, 08 Sep 2022 07:00:00 GMT",climate_policy
286,CalMatters,slashing greenhouse gases california revises climate change ,"Wed, 16 Nov 2022 08:00:00 GMT",climate_policy
287,OEHHA, report indicators of climate change in california,"Tue, 01 Nov 2022 07:00:00 GMT",climate_policy
288,The White House,fact sheet biden,"Tue, 08 Nov 2022 08:00:00 GMT",climate_policy
289,The White House,fact sheet biden,"Thu, 06 Oct 2022 07:00:00 GMT",climate_policy
290,UNFCCC,climate plans remain insufficient more ambitious action needed ,"Wed, 26 Oct 2022 07:00:00 GMT",climate_policy
291,Nature.com,the missing risks of climate change,"Wed, 26 Oct 2022 07:00:00 GMT",climate_policy
292,Forbes,how to reboot climate policy after  five models of policy making,"Sun, 04 Dec 2022 08:00:00 GMT",climate_policy
293,NRDC (Natural Resources Defense Council),what are the solutions to climate change,"Tue, 13 Dec 2022 08:00:00 GMT",climate_policy
294,Brookings Institution,us climate policy progress,"Wed, 30 Nov 2022 08:00:00 GMT",climate_policy
295,Columbia | SIPA Center on Global Energy Policy,how the unequal effects of climate change broke economists ,"Thu, 27 Oct 2022 07:00:00 GMT",climate_policy
296,NPR,republicans prepare to challenge democrats climate change efforts ,"Fri, 30 Dec 2022 08:00:00 GMT",climate_policy
297,Environmental Defense Fund,the biggest thing congress has ever done to address climate change,"Fri, 12 Aug 2022 07:00:00 GMT",climate_policy
298,Climate Policy Initiative,global landscape of climate finance a decade of data,"Thu, 27 Oct 2022 07:00:00 GMT",climate_policy
299,CalMatters,california takes steps to battle climate change,"Thu, 01 Sep 2022 07:00:00 GMT",climate_policy
300,NPR,kids are increasingly coping with climate change heres their advice,"Thu, 17 Nov 2022 08:00:00 GMT",climate_policy
301,CNBC,young people just got a louder voice on climate change  and could soon be shaping policy,"Wed, 23 Nov 2022 08:00:00 GMT",climate_policy
302,Express & Star,wolves players will be making changes to their usual kit this weekend as part of a sustainability campaign,"Fri, 03 Feb 2023 16:03:19 GMT",sustainability
303,The New York Times,can fashion weeks trash problem be solved,"Tue, 31 Jan 2023 20:00:11 GMT",sustainability
304,The Wall Street Journal,how to craft successful sustainability programs,"Fri, 03 Feb 2023 17:17:00 GMT",sustainability
305,The Hill,equilibriumsustainability  how adding stickers to windows can help save birds,"Thu, 02 Feb 2023 22:59:00 GMT",sustainability
306,The Business of Fashion,the multi,"Tue, 31 Jan 2023 14:00:00 GMT",sustainability
307,CoinDesk,makerdao constitution would fund sustainability efforts with  mkr tokens from reserves emissions,"Fri, 03 Feb 2023 20:14:00 GMT",sustainability
308,Eco-Business,brands please stop saying sustainability is in our dna,"Wed, 01 Feb 2023 06:34:00 GMT",sustainability
309,Liverpool FC,lfc becomes first premier league club to be sustainably certified,"Thu, 02 Feb 2023 06:07:44 GMT",sustainability
310,Yahoo Finance,makerdao constitution would fund sustainability efforts with  mkr tokens from reserves emissions,"Fri, 03 Feb 2023 20:14:00 GMT",sustainability
311,AZ Snake Pit,a perspective on sustainability of the diamondbacks,"Tue, 31 Jan 2023 19:00:00 GMT",sustainability
312,aam-us.org,elevating sustainability efforts in museum dining operations ,"Fri, 03 Feb 2023 14:06:15 GMT",sustainability
313,Forbes,semiconductor sustainability  and the potential of chips to save energy,"Fri, 03 Feb 2023 15:00:00 GMT",sustainability
314,Reuters,exclusive blackrock sustainability chief bodnar to join bezos earth ,"Fri, 03 Feb 2023 15:34:00 GMT",sustainability
315,I by IMD,lets be clear esg is not woke and its different from sustainability,"Fri, 03 Feb 2023 08:30:03 GMT",sustainability
316,Colorado State University,sustainability help wanted csu training carbon management ,"Fri, 03 Feb 2023 18:51:03 GMT",sustainability
317,City of Tampa,city center at hanna project awarded for sustainability resilience,"Fri, 03 Feb 2023 13:17:38 GMT",sustainability
318,Packaging World,new sustainability innovations across categories,"Fri, 03 Feb 2023 22:10:28 GMT",sustainability
319,Supply Chain Dive,sustainability still takes a backseat to profit for procurement teams ,"Thu, 02 Feb 2023 20:55:22 GMT",sustainability
320,KPLC,sasol announces plans for sustainability hub,"Fri, 03 Feb 2023 03:24:00 GMT",sustainability
321,The Enterprisers Project, sustainability strategies that help reduce costs,"Fri, 03 Feb 2023 08:02:43 GMT",sustainability
322,Catholic Review of Baltimore,papal farm gardens will be home to new center promoting ,"Fri, 03 Feb 2023 19:35:46 GMT",sustainability
323,Acceleration Economy,how tech modernization drives win,"Fri, 03 Feb 2023 14:00:00 GMT",sustainability
324,Floor Focus,state of sustainability  next stage greening demands more of ,"Fri, 03 Feb 2023 19:59:12 GMT",sustainability
325,The Drinks Business,new sustainability roadmap unveiled for centre,"Fri, 03 Feb 2023 13:38:51 GMT",sustainability
326,JD Supra,moves made toward a new sustainability reporting system in ,"Fri, 03 Feb 2023 19:12:39 GMT",sustainability
327,AdAge.com,coronas new beach music festivals tie into its sustainability push ,"Fri, 03 Feb 2023 16:48:36 GMT",sustainability
328,wolves.co.uk,sustainability  wolverhampton wanderers fc,"Fri, 03 Feb 2023 18:43:03 GMT",sustainability
329,PR Newswire,john deeres  sustainability report shows progress against ,"Wed, 01 Feb 2023 13:00:00 GMT",sustainability
330,Environment + Energy Leader,esg and earnings go together atkore releases third ,"Fri, 03 Feb 2023 12:45:17 GMT",sustainability
331,pnas.org,how to help ukrainian scientists overcome russias invasion and ,"Fri, 03 Feb 2023 18:55:16 GMT",sustainability
332,Department of Education (.gov),ed invites organizations to make school infrastructure and ,"Wed, 01 Feb 2023 14:19:27 GMT",sustainability
333,ZDNet, best ways to make your gadget use greener and save money too,"Fri, 03 Feb 2023 14:00:17 GMT",sustainability
334,Sustainability Magazine,nick giannakakis,"Fri, 03 Feb 2023 14:56:35 GMT",sustainability
335,The Daily Collegian Online,nasa challenge transforms penn states environmental ,"Fri, 03 Feb 2023 08:00:00 GMT",sustainability
336,Forbes,samsungs everyday sustainability philosophy embodied in the new galaxy ,"Wed, 01 Feb 2023 22:19:08 GMT",sustainability
337,FreightWaves,make last,"Fri, 03 Feb 2023 19:52:33 GMT",sustainability
338,Cornell Chronicle,new sustainable tourism program charts course for travels future ,"Fri, 03 Feb 2023 17:29:41 GMT",sustainability
339,ZDNet,tech for a sustainable future the challenges and opportunities ahead,"Fri, 03 Feb 2023 13:58:35 GMT",sustainability
340,Food Business News,study finds sustainability labels impact red meat consumption,"Thu, 02 Feb 2023 14:23:46 GMT",sustainability
341,AV Network,qa environmentally friendly packaging part of shure ,"Fri, 03 Feb 2023 09:46:16 GMT",sustainability
342,CNBC,sp dow jones is knocking adani enterprises off its sustainability index,"Fri, 03 Feb 2023 05:23:54 GMT",sustainability
343,Dartmouth News,sustainability renovations underway at rauner library,"Fri, 03 Feb 2023 15:09:30 GMT",sustainability
344,RFID Journal,beontag plans new us factory with sustainability,"Fri, 03 Feb 2023 12:01:33 GMT",sustainability
345,The Hill,sustainability  un seeks to streamline air pollution tracking,"Wed, 01 Feb 2023 23:41:00 GMT",sustainability
346,GreenBiz,sustainable product design can help businesses identify new models,"Thu, 02 Feb 2023 11:01:14 GMT",sustainability
347,PR Newswire,entergy recently recognized as sustainability leader,"Wed, 01 Feb 2023 15:00:00 GMT",sustainability
348,Yahoo Finance,telus ranks highest among north american telecoms on corporate knights global  most sustainable corporations,"Fri, 03 Feb 2023 16:56:00 GMT",sustainability
349,Hendrix College,sustainability fiber artists ideas to improve our world at the wma,"Tue, 31 Jan 2023 20:04:29 GMT",sustainability
350,The Business Journals,hines new southeast region ceo believes in sustainability,"Fri, 03 Feb 2023 18:55:00 GMT",sustainability
351,HRZone,companies need greater sustainability alignment  heres how hr can help,"Fri, 03 Feb 2023 08:08:02 GMT",sustainability
352,Nature.com,pathways to net,"Mon, 30 Jan 2023 16:06:42 GMT",sustainability
353,Mintz,energy  sustainability washington update  february ,"Fri, 03 Feb 2023 12:00:00 GMT",sustainability
354,Marketscreener.com,alk abello as   annual sustainability report,"Fri, 03 Feb 2023 11:26:29 GMT",sustainability
355,Latin Lawyer,ecija launches sustainability practice in mexico with hire,"Fri, 03 Feb 2023 11:13:23 GMT",sustainability
356,Thomson Reuters Tax & Accounting,new climate and sustainability disclosure rules on track for ,"Thu, 26 Jan 2023 15:56:51 GMT",sustainability
357,Hindustan Times,sustainability is a key focus area for india at ,"Fri, 03 Feb 2023 14:58:30 GMT",sustainability
358,Simple Flying,lufthansa cargo is now flying a boeing  with shark skin ,"Fri, 03 Feb 2023 14:00:00 GMT",sustainability
359,The Washington Post,vegan sustainable how to spot greenwashing in fashion,"Fri, 27 Jan 2023 14:30:00 GMT",sustainability
360,Mondaq,whistleblower complaint capitalizes on sec interest in ,"Fri, 03 Feb 2023 12:17:28 GMT",sustainability
361,ETFdb.com,this etf may be propelled by sustainable bond issuance,"Fri, 03 Feb 2023 13:57:15 GMT",sustainability
362,Chemist+Druggist,lloydsdirect gains sustainability certification for goals outside of profit,"Fri, 03 Feb 2023 13:07:37 GMT",sustainability
363,Pennsylvania State University,attorney alumna to be featured in live session focused on career ,"Fri, 03 Feb 2023 14:20:58 GMT",sustainability
364,Pennsylvania State University,libraries slow fashion resource fair explores wearable ,"Wed, 01 Feb 2023 17:51:45 GMT",sustainability
365,Nature.com,reducing global land,"Thu, 26 Jan 2023 16:10:13 GMT",sustainability
366,waste360,northstar recycling acquires sonoco sustainability solutions,"Thu, 02 Feb 2023 06:15:37 GMT",sustainability
367,Supply Chain Management Review,reaching  sustainable packaging proves difficult to achieve,"Fri, 03 Feb 2023 15:19:31 GMT",sustainability
368,Breaking Travel News,klm appoints zita schellekens as svp of sustainability  strategy,"Fri, 03 Feb 2023 08:42:32 GMT",sustainability
369,AustinTexas.gov,office of sustainability  annual highlights,"Tue, 24 Jan 2023 08:00:00 GMT",sustainability
370,Kettering University,sustainability,"Fri, 06 Jan 2023 16:48:32 GMT",sustainability
371,Metropolis Magazine,a recent book surveys wohas commitment to sustainability,"Thu, 02 Feb 2023 21:40:21 GMT",sustainability
372,ESG Clarity,morningstar ceo on esg politics future of sustainability,"Fri, 03 Feb 2023 21:18:09 GMT",sustainability
373,edie.net,are ceos sidelining environmental sustainability as rising costs bite,"Mon, 16 Jan 2023 08:00:00 GMT",sustainability
374,Seeking Alpha,evv good in concept but distribution sustainability is a big concern,"Thu, 02 Feb 2023 22:22:08 GMT",sustainability
375,GreenBiz,building sustainability programs from the ground up,"Tue, 17 Jan 2023 08:00:00 GMT",sustainability
376,Nature.com,ecologically unequal exchanges driven by eu consumption,"Thu, 26 Jan 2023 08:00:00 GMT",sustainability
377,Retail TouchPoints,apparel sustainability nonprofit seeks applications for climate ,"Fri, 03 Feb 2023 13:20:00 GMT",sustainability
378,Cornell Chronicle,new ny outcomes fund pays farmers to adopt sustainable ,"Fri, 03 Feb 2023 19:24:02 GMT",sustainability
379,Marketscreener.com,blackrocks head of sustainability policy and engage,"Fri, 03 Feb 2023 15:29:32 GMT",sustainability
380,EIN News,five upg sustainability leaders from europe compete for votes to reach hurricane island usa,"Fri, 03 Feb 2023 16:53:00 GMT",sustainability
381,FOX 21 Online,duluths sustainability officer receives minnesota climate ,"Thu, 02 Feb 2023 21:18:16 GMT",sustainability
382,Stockholm Environment Institute,sustainability assessment of urban and peri,"Tue, 31 Jan 2023 18:36:21 GMT",sustainability
383,Ohio University,science cafe features jason trembly exploring sustainability ,"Tue, 31 Jan 2023 09:05:05 GMT",sustainability
384,Waste Dive,westrock notes global paper market headwinds but touts ,"Thu, 02 Feb 2023 16:12:59 GMT",sustainability
385,vmagazine.com,depolarizing style and sustainability operasport autumn winter ,"Fri, 03 Feb 2023 19:03:54 GMT",sustainability
386,FoodNavigator-Asia.com,trend tracker contradictory flavour combos top  industry ,"Fri, 03 Feb 2023 03:01:23 GMT",sustainability
387,The Business Journals,gileads dan oday delivers a clear message stability sustainability ,"Fri, 03 Feb 2023 17:51:00 GMT",sustainability
388,Construction News,removing politics from the sustainability equation,"Fri, 03 Feb 2023 06:50:31 GMT",sustainability
389,Insurance News Net,researchers at swiss reinsurance company ltd release new ,"Thu, 02 Feb 2023 22:57:45 GMT",sustainability
390,Agg-Net,enhanced safety and sustainability for brett vehicles,"Fri, 03 Feb 2023 12:41:20 GMT",sustainability
391,Sustainability Magazine,energy efficiency is the practical proven path to net zero,"Fri, 03 Feb 2023 10:25:44 GMT",sustainability
392,"East Brunswick, NJ Patch",star students co,"Thu, 02 Feb 2023 18:45:20 GMT",sustainability
393,S&P Global,key sustainability trends that will drive decision,"Mon, 16 Jan 2023 08:00:00 GMT",sustainability
394,Sustainability Magazine,gfk helping the helper transform,"Fri, 03 Feb 2023 09:39:26 GMT",sustainability
395,Maine Public,cmp parent company to fund sustainability,"Tue, 31 Jan 2023 18:23:00 GMT",sustainability
396,LawInSport,the uefa financial sustainability regulations evolution or ,"Fri, 03 Feb 2023 15:21:54 GMT",sustainability
397,Power Technology,green cloud mooted for sustainable business,"Fri, 03 Feb 2023 08:02:40 GMT",sustainability
398,Nature.com,polydimethylsiloxane,"Thu, 26 Jan 2023 16:18:54 GMT",sustainability
399,Taiwan News,rge closes inaugural  million sustainability,"Fri, 03 Feb 2023 06:45:00 GMT",sustainability
400,CalPERS,calpers names peter cashion new head of sustainability ,"Thu, 12 Jan 2023 08:00:00 GMT",sustainability
401,CNET,why tech companies cant stop talking about sustainability,"Mon, 16 Jan 2023 08:00:00 GMT",sustainability
402,NPR,climate change and a population boom could dry up the great salt lake in  years,"Fri, 03 Feb 2023 10:09:26 GMT",climate
403,Vox.com,anticipatory cash transfers are a neglected climate change solution,"Fri, 03 Feb 2023 12:00:00 GMT",climate
404,POLITICO,gop takes aim at bidens climate agenda,"Fri, 03 Feb 2023 22:00:00 GMT",climate
405,The Hill,oversight chair requests details on kerrys international climate negotiations,"Thu, 02 Feb 2023 20:39:00 GMT",climate
406,The Atlantic,the most famous climate goal is woefully misunderstood,"Wed, 01 Feb 2023 12:30:00 GMT",climate
407,The Wall Street Journal,sec considers easing climate,"Fri, 03 Feb 2023 12:30:00 GMT",climate
408,The Washington Post,few signs that rich countries will help poor ones with climate fund,"Thu, 02 Feb 2023 14:30:00 GMT",climate
409,The Guardian,jordan petersons zombie climate contrarianism follows a well,"Thu, 02 Feb 2023 00:27:00 GMT",climate
410,The New York Times,how the inflation reduction act can save you money a consumers guide,"Wed, 01 Feb 2023 10:00:02 GMT",climate
411,Gothamist,mayor adams record,"Fri, 03 Feb 2023 15:58:00 GMT",climate
412,Scientific American,a climate scientist is evaluating the uss spy programs,"Fri, 03 Feb 2023 19:00:15 GMT",climate
413,Fox Business,sec considers easing climate,"Fri, 03 Feb 2023 15:29:57 GMT",climate
414,United Nations,water  at the center of the climate crisis  united nations,"Wed, 01 Feb 2023 21:44:57 GMT",climate
415,University of Colorado Boulder, million grant to extend study of how climate change shapes ,"Fri, 03 Feb 2023 16:48:12 GMT",climate
416,Canary Media,chart lng expansion plans threaten global climate progress,"Fri, 03 Feb 2023 16:54:00 GMT",climate
417,POLITICO,worlds climate goal is slipping away,"Thu, 02 Feb 2023 23:00:00 GMT",climate
418,Reuters,concrete traps  soaked from air in climate,"Fri, 03 Feb 2023 11:24:00 GMT",climate
419,Columbia University,meet the next generation of africas climate forecasters,"Fri, 03 Feb 2023 13:30:42 GMT",climate
